id	project_name	processed_title	processed_description	processed_labels	priority_id	type_id	status_name	topic_id	top_terms
13547838	IGNITE	fix validation autoadjust scaleup scaledown create zone catalog	find default value create modify zone catalog correct datanodesautoadjust datanodesautoadjustscaleup datanodesautoadjustscaledown necessary correct value default zone parameter create update zone validation maybe light refactoring class change	['ignite-3']	3	1	Resolved	25	['create', 'fix', 'update', 'change', 'class', 'use', 'currently', 'support', 'thin', 'api']
13589041	IGNITE	calcite engine multi node index scan fail index binary object field	reproducer code java public class indexscanmultinodeintegrationt extend abstractbasicintegrationtest public void testcomplexkeyscan ignitecache emp new int new key private static class employerkey private final int private final int private int code fail noformat cause classcastexception binaryobjectimpl cast comparable noformat	['calcite', 'ise']	3	1	Resolved	67	['new', 'class', 'index', 'fail', 'java', 'cause', 'implementation', 'currently', 'use', 'create']
13118962	IGNITE	thread starvation monitoring	ignite thread pools starvation description situation occur user submit task recursively submit task synchronously wait result job arrive worker node queue forever free thread public pool thread wait job result detection solution task timeout set task task gets cancel automatically web console provide ability cancel task job report timed task job report web console report log need introduce new config property set timeout reported job log record web console include master node start time	['iep-7']	3	4	Resolved	29	['new', 'ignite', 'fail', 'exception', 'start', 'use', 'add', 'like', 'support', 'thin']
13341350	IGNITE	add ability view count hot cold page page memory	currently determine hot touch recently cold page page memory information helpful datum region size tune effectiveness page replacement algorithm information represent histogram show count page touch time interval	['iep-35', 'iep-62', 'ise']	3	2	Resolved	68	['client', 'add', 'support', 'currently', 'api', 'create', 'thin', 'java', 'use', 'implementation']
13494787	IGNITE	thin linq join	support query join linq provider	['.net', 'linq', 'ignite-3']	3	4	Resolved	78	['type', 'support', 'thin', 'add', 'update', 'client', 'use', 'implementation', 'currently', 'api']
13397349	IGNITE	ignite switch google code style	agree need switch google code style change column limit instead space indentation instead update xml file checkstyle plugin attach create code guideline wiki page ignite update link	['ignite-3']	3	4	Resolved	4	['ignite', 'update', 'change', 'create', 'use', 'currently', 'support', 'thin', 'api', 'method']
13485874	IGNITE	orderingfuture notify dependent asynchronously	currently follow problem callbacks invoke future incompleted directly getnow method callback invoke long block operation impede completion	['ignite-3']	3	1	Resolved	152	['method', 'add', 'new', 'currently', 'client', 'update', 'configuration', 'support', 'thin', 'api']
13521482	IGNITE	java thin client connection balance	ignite java thin client connect address provide address list typical configuration lead overload server node underloade server node improve workload distribution choose random channel range address minimal port partition awareness enable use random open channel instead default channel operation map certain node	['important', 'ise']	3	4	Resolved	55	['java', 'thin', 'client', 'ignite', 'api', 'change', 'implementation', 'use', 'currently', 'support']
13503094	IGNITE	thin testexecuteonrandomnode flaky	code expect teardown nunit framework assertionexception expect apache ignite test ignitetestsbase teardown buildagent work module platform dotnet apache ignite test line nunit framework assert message nunit framework assert result string message object args nunit framework assert actual iresolveconstraint expression string message object args nunit framework assert expect object actual apache ignite test ignitetestsbase teardown buildagent work module platform dotnet apache ignite test line code problem forgot fix teardown check	['.net', 'ignite-3']	3	1	Resolved	83	['ignite', 'work', 'thin', 'fix', 'change', 'use', 'currently', 'support', 'api', 'implementation']
13550203	IGNITE	return future metastore event process	try switch configuration catalog discover metastore wait catalog listener complete notification lead race slightly unpredictable behavior example want create table update catalog start procedure create raft group wait complete release metastore revison rebalance engine start rebalance timer record metastore immediately begin process rebalance fall nullpointerexception obtain stable topology metastore raft group time start briefly need fix updatelogimpl	['ignite-3']	3	4	Resolved	25	['create', 'fix', 'update', 'change', 'class', 'use', 'currently', 'support', 'thin', 'api']
13099567	IGNITE	thin client basic exception handle	exception handling thin client response include success flag define exception format protocol case failure	['.net']	3	4	Resolved	14	['exception', 'client', 'index', 'thin', 'method', 'implement', 'currently', 'add', 'support', 'api']
13315416	IGNITE	thin client compute leak clientnotificationhandler instance	multithreaded thin client compute scenario possibility clientnotificationhandler leak handler remain correspond task complete reproduce add follow code end computeclienttests testexecutejavataskasyncmultithreade code var failoversocket testutils socket var socket testutils socket var listeners testutils notificationlistener assert code	['.net']	2	1	Resolved	163	['client', 'thin', 'implement', 'start', 'add', 'like', 'work', 'support', 'fix', 'currently']
13468800	IGNITE	rid index partition	index store partition file index partition dispose current codebase grouppagestoreholder useful correct flaky	['ignite-3']	3	4	Resolved	156	['index', 'update', 'implement', 'method', 'configuration', 'support', 'thin', 'use', 'change', 'add']
13562985	IGNITE	deserialization instant field marshallable fail	instant final class assume instant field contain instance instant type know upfront apply optimization write descriptor field content time instant define writereplace replace instance type ser serialize type actually change serialization apply optimization case	['ignite-3']	3	1	Resolved	46	['type', 'class', 'fail', 'java', 'cause', 'new', 'method', 'thin', 'fix', 'use']
13569364	IGNITE	implement api drop pagememory index	task identical time implement page memory	['ignite-3']	3	4	Resolved	156	['index', 'update', 'implement', 'method', 'configuration', 'support', 'thin', 'use', 'change', 'add']
13520231	IGNITE	java thin client cluster discovery	cluster endpoint discovery protocol implementation thin client implementation java thin client add	['iep-44', 'important', 'ise']	3	2	Resolved	100	['thin', 'client', 'java', 'implementation', 'add', 'use', 'configuration', 'currently', 'support', 'api']
13571281	IGNITE	extract volatile state abstractpagememorymvpartitionstorage separate class	abstractpagememorymvpartitionstorage contain bunch volatile field replace rebalance cleanup propose wrap field single class order code little bit maintainable follow benefit easy understand component storage update easy add volatile component forget update easy avoid unnecessary volatile read state fetch single read downside code little bit verbose need access state class	['ignite-3']	4	4	Resolved	37	['class', 'new', 'update', 'follow', 'configuration', 'example', 'add', 'fail', 'implement', 'method']
13578418	IGNITE	node miss clusterstatemessage start	clustermanagementgroupmanager register message handler clusterstatemessage startasync method approach result race clusterstatemessage miss receive handler register solution register handler constructor handler wait clustermanagementgroupmanager start able process new message	['ignite-3']	3	1	Resolved	28	['start', 'client', 'new', 'use', 'change', 'currently', 'support', 'thin', 'configuration', 'method']
13536528	IGNITE	sql onheap cache stores row cache basis access row index basis	index cache sqlonheapcache property enable node failure noformat corruptedtreeexception corrupt msg runtime failure row cause igniteexception fail store new index row cause unsupportedoperationexception inline type noformat root cause indexrowcache create cache group store indexrowimpl bind particular index case index require datum row get row onheap cache wrong index row handler	['ise']	3	1	Resolved	166	['index', 'cause', 'new', 'create', 'type', 'fail', 'implementation', 'thin', 'use', 'method']
13276021	IGNITE	reflectionfactory essential thank platformdotnetsessionlockresult	currently treat reflectionfactory nice thing silently ignore failure reflection code try class reffactorycls reflectionfactory reffac ctorfac catch nosuchmethodexception classnotfoundexception illegalaccessexception invocationtargetexception ignore code essential thank class platformdotnetsessionlockresult register note start constructor have access reflectionfactory jboss hide example lead follow cryptic exception courtesy stack overflow code severe ignitekernal serverservice thread pool get exception start rollback startup routine class binaryobjectexception fail find constructor class platformdotnetsessionlockresult code suggestion follow introduce warning reflectionfactory find instead ignore exception add constructor platformdotnetsessionlockresult sure class need reflection start optionally instead introduce error reflectionfactory find	['ise', 'usability']	3	1	Resolved	90	['class', 'exception', 'start', 'follow', 'error', 'add', 'example', 'currently', 'fail', 'thin']
13282203	IGNITE	dotnetcore publish dir copy bin dir	recent change break release build publish folder present dotnet bin	['.net']	1	1	Resolved	15	['new', 'change', 'index', 'update', 'start', 'add', 'support', 'thin', 'use', 'method']
13567035	IGNITE	calcite engine tuple row comparison work	currentrly row comparison fail error use index reproducer code java table test integer val integer index test val test values test val test code exception noformat cause runtimeexception resolve method object class object class class sqlfunction noformat	['ise']	3	1	Open	127	['index', 'class', 'use', 'support', 'add', 'update', 'new', 'thin', 'java', 'implementation']
13505710	IGNITE	use class instead ignitebituple response txstatereplicarequest	lot response partitionreplicalistener express ignitebituple make code hard read hard modify inconvenient use ticket focus replace tuple send response txstatereplicarequest name class let leaderortxstate	['ignite-3']	3	3	Resolved	127	['index', 'class', 'use', 'support', 'add', 'update', 'new', 'thin', 'java', 'implementation']
13419732	IGNITE	calcite engine setop execution node rewinde	reproducer code java table integer test values select select test throw noformat cause indexoutofboundsexception index size	['calcite']	3	1	Resolved	166	['index', 'cause', 'new', 'create', 'type', 'fail', 'implementation', 'thin', 'use', 'method']
13536404	IGNITE	add method internaltransaction get initial schema timestamp	method return readt transaction begint transaction	['ignite-3']	3	4	Resolved	135	['method', 'add', 'new', 'class', 'work', 'fail', 'cause', 'fix', 'error', 'start']
13536875	IGNITE	switch table ids uuid integer	currently table store name list item configuration internally configuration identify uuid uuid identify table system need change addition internal ids need configuration need generate integer ids use rest system identify table table ids generate global counter generate index zone ids internal ids remain switch store table index zone configuration store catalog scope task	['ignite-3']	3	4	Resolved	111	['configuration', 'index', 'use', 'change', 'currently', 'add', 'support', 'thin', 'start', 'like']
13567028	IGNITE	optimize listener collection update abstracteventproducer	discover update collection listener abstracteventproducer little optimal optimize	['ignite-3']	4	4	Resolved	156	['index', 'update', 'implement', 'method', 'configuration', 'support', 'thin', 'use', 'change', 'add']
13538377	IGNITE	embed basic data streamer	implement basic datum streamer java embed api recordviewimpl keyvalueviewimpl recordbinaryviewimpl keyvaluebinaryviewimpl receiver use case confluence display ignite	['iep-102', 'ignite-3']	3	3	Resolved	5	['implement', 'new', 'index', 'use', 'work', 'example', 'like', 'implementation', 'currently', 'api']
13436866	IGNITE	biginteger serialize user object serialization	try pass biginteger code cause class igniteexception fail marshal message invoke writeobject cause class marshalexception invoke writeobject cause class specialmethodinvocationexception writeobject invocation fail cause invocationtargetexception method cause illegalstateexception field miss locally access perform bug code reproduce uncomment line	['ignite-3']	3	1	Resolved	115	['cause', 'class', 'fail', 'implementation', 'method', 'change', 'implement', 'work', 'support', 'create']
13531159	IGNITE	fix npe build index	implementation index building fluky test appear stack trace error noformat completionexception nullpointerexception invoke batch null cause nullpointerexception invoke batch null noformat	['ignite-3']	3	1	Resolved	107	['cause', 'error', 'implementation', 'start', 'client', 'implement', 'thin', 'exception', 'work', 'use']
13547849	IGNITE	refactore test easy switch catalog	implementation task test find like refactor simplify switching catalog itrebalancedistributedtest itignitedistributionzonemanagernoderestarttest tablemanagert	['ignite-3']	3	4	Resolved	102	['new', 'like', 'implementation', 'implement', 'work', 'index', 'start', 'example', 'create', 'api']
13558003	IGNITE	select index perform update operation partition	implement need correctly select index insert datum transaction update operation partition collect available registered index time operation drop available index know	['ignite-3']	3	4	Resolved	156	['index', 'update', 'implement', 'method', 'configuration', 'support', 'thin', 'use', 'change', 'add']
13354667	IGNITE	incorrect table query type generic	generic type queryentity value type result broken sql table code var ignite ignition gettestconfiguration var cfg new cacheconfiguration testutils testname new var cache ignite new generictest prop var table cache string code result table culture neutral add generic support	['.net']	4	1	Resolved	45	['ignite', 'type', 'new', 'start', 'support', 'cause', 'exception', 'fail', 'use', 'add']
13572371	IGNITE	unconditionally update storage proper raft index partitionlistener	despite fact reasonable skip datum update execute collocate primary replica storage require unconditionally update storage proper raft index partitionlistener detail code java synchronize safetime code	['ignite-3']	3	1	Resolved	156	['index', 'update', 'implement', 'method', 'configuration', 'support', 'thin', 'use', 'change', 'add']
13572030	IGNITE	java thin datastreamer partition awareness break assignment available moment	return list abstractclientstreamerpartitionawarenessprovider assume partition count change server node lag return assignment give timestamp streamer partition awareness work potential fixes wait assignment server return null affect performance return correct partition count null value fast simple	['ignite-3']	3	1	Resolved	55	['java', 'thin', 'client', 'ignite', 'api', 'change', 'implementation', 'use', 'currently', 'support']
13525531	IGNITE	introduce thread type thread pool	like ignite need custom class thread custom property currently use custom thread type network event loop guess give wide adoption async code developer struggle understand thread execute actual operation example thencompose whencomplete closure execute thread complete future thread want use default fork join pool example force operation pool clear mark thread follow category perform storage read perform storage write perform network operation safely block etc know sure thread fit operation execute ideally assertion runtime logic help find exist bug bottleneck	['ignite-3', 'storage-threading', 'threading']	3	4	Resolved	20	['start', 'example', 'create', 'use', 'type', 'ignite', 'like', 'update', 'class', 'configuration']
13594624	IGNITE	create revision metastorage removal effect	currently remove behave differently removeall remove argument key correspond entry exist remove command create new metastorage revision behave like command hand removeall key correspond non existing entry create new metastorage revision code invoke method see early optimization apply remove invoke revision create remove invoke optimization happen add key relate idempotency put cause new revision create look inconsistently simplify logic create metastorage revision result execute command potentially change metastorage change	['ignite-3']	3	4	Resolved	24	['create', 'remove', 'new', 'change', 'add', 'like', 'currently', 'cause', 'method', 'support']
13055944	IGNITE	start plugin onignitestart	currently initialize start plugin ipluginprovider start onignitestart callback correct java plugin invoke callback start method callback register instead initialize plugin pluginprocessor ctor	['.net']	3	7	Resolved	28	['start', 'client', 'new', 'use', 'change', 'currently', 'support', 'thin', 'configuration', 'method']
13398977	IGNITE	thin add support native datum type	add support data type thin client date time etc nativetypes use binarytuple format exchange row datum binarytuple implementation update support miss type update ignitetuple support type object mapper irecordview	['.net', 'iep-78', 'ignite-3']	3	4	Resolved	78	['type', 'support', 'thin', 'add', 'update', 'client', 'use', 'implementation', 'currently', 'api']
13566245	IGNITE	get catalog version index create	implement ticket need way catalog version index interest create need safe invoke outside update metastore catalog thread	['ignite-3']	3	4	Resolved	156	['index', 'update', 'implement', 'method', 'configuration', 'support', 'thin', 'use', 'change', 'add']
13589739	IGNITE	rid	find unused field need remove implement metastorage compaction trigger	['ignite-3']	3	4	Resolved	69	['follow', 'implementation', 'implement', 'configuration', 'remove', 'ignite', 'error', 'fix', 'work', 'fail']
13402655	IGNITE	calcite engine operator day hour minute return wrong result	example query noformat select date date day select date date hour select date date minute select date date return value millisecond year time unit return value month	['calcite']	3	1	Resolved	89	['example', 'update', 'work', 'new', 'use', 'method', 'currently', 'support', 'thin', 'change']
13408227	IGNITE	native persistence data structure porting	goal ignite reuse basic datum structure ignite persistence codebase need fix design flaw remove dependency wal logging functionality ignite wal external service item pay attention port data structure class hierarchy abstracedatastructure freelist implementation implementation necessary consider individually port exist unit test require effort type parameter clarification data structure need detail think issue concentrate porting free list bplustree maybe class like storable revisit	['ignite-3']	3	3	Resolved	9	['ignite', 'type', 'exception', 'work', 'java', 'configuration', 'start', 'fail', 'error', 'create']
13559019	IGNITE	add test parallel building new index table update	discover test build index change table insertion update need add integration test good integration test associate building index index module	['ignite-3']	3	4	Resolved	93	['index', 'add', 'update', 'change', 'new', 'support', 'thin', 'use', 'method', 'configuration']
13492439	IGNITE	thin incorrect colocation hash ignore precision localtime localdatetime timestamp	rowassembler serialize localtime localdatetime timestamp accord affect colocation hash client implementation ignore precision calculate colocation hash result different value precision maximum	['.net', 'ignite-3']	3	1	Resolved	100	['thin', 'client', 'java', 'implementation', 'add', 'use', 'configuration', 'currently', 'support', 'api']
13562986	IGNITE	thin testexecutecolocatedupdatestablecacheontabledrop flaky	apache ignite test compute computetest testexecutecolocatedupdatestablecacheontabledrop flaky code apache ignite tablenotfoundexception table find apache ignite igniteexception tablenotfoundexception ign traceid table find apache ignite internal clientsocket clientop pooledarraybuffer request boolean expectnotification buildagent work module platform dotnet apache ignite internal line apache ignite internal clientfailoversocket clientop transaction pooledarraybuffer request preferrednode preferrednode iretrypolicy retrypolicyoverride boolean expectnotification buildagent work module platform dotnet apache ignite internal line apache ignite internal clientfailoversocket clientop pooledarraybuffer request preferrednode preferrednode boolean expectnotification buildagent work module platform dotnet apache ignite internal line apache ignite internal table table timestamp buildagent work module platform dotnet apache ignite internal table line apache ignite internal table table getpartitionassignmentasync buildagent work module platform dotnet apache ignite internal table line apache ignite internal table table colocationhash itransaction transaction buildagent work module platform dotnet apache ignite internal table line apache ignite internal compute compute tablename tkey key serializerhandlerfunc unit string jobclassname object args buildagent work module platform dotnet apache ignite internal compute line apache ignite internal compute compute tablename iignitetuple key unit string jobclassname object args buildagent work module platform dotnet apache ignite internal compute line apache ignite test compute computetests testexecutecolocatedupdatestablecacheontabledrop buildagent work module platform dotnet apache ignite test compute line apache ignite test compute computetests testexecutecolocatedupdatestablecacheontabledrop buildagent work module platform dotnet apache ignite test compute line nunit framework internal taskawaitadapter nunit framework internal messagepumpstrategy nomessagepumpstrategy awaiter nunit framework internal asynctosyncadapter invoke nunit framework internal command testmethodcommand context nunit framework internal command testmethodcommand context nunit framework internal commands nunit framework internal commands delegatingtestcommand context action action code relate change	['.net', 'ignite-3']	3	1	Resolved	83	['ignite', 'work', 'thin', 'fix', 'change', 'use', 'currently', 'support', 'api', 'implementation']
13534660	IGNITE	reduce write amplification rocksdb partition storage	currently commit operation rocksdb storage look like code java val data wasteful end write twice solution add level indirection datum code java rowid index tableid partid rowid timestamp dataid tableid partid rowid dataid txid committableid commitpartid datum dataid payload code dataid unique like idea auto incremente key persist late value way main idea dataid change commit datum mean generate rowid txid example rowid like unique value mandatory partition prefix probably table prefix	['ignite-3']	3	4	Resolved	80	['like', 'java', 'change', 'example', 'currently', 'add', 'index', 'method', 'use', 'configuration']
13546860	IGNITE	calcite engine dependency common codec require function	function soundex require common codec dependency dependency include explicitly dependency list add calcite library folder build test run transitive dependency trigger problem query fail run ignite start binary release package	['calcite', 'calcite3-required', 'ise']	3	1	Resolved	9	['ignite', 'type', 'exception', 'work', 'java', 'configuration', 'start', 'fail', 'error', 'create']
13595441	IGNITE	calcite engine cache compile expression correlated variable different data type	reproducer code java public void testcorrelatesdifferentdatatype string type new string integer tinyint try table integer table type values values select finally table table code fail noformat cause classcastexception class byte cast class integer byte integer module loader bootstrap source noformat	['calcite', 'ise']	3	1	Resolved	46	['type', 'class', 'fail', 'java', 'cause', 'new', 'method', 'thin', 'fix', 'use']
12778149	IGNITE	cache manager switch cache statisticsenable property globaly	care new node join grid new node statisticsenable opposite value nod grid	['iep-6']	3	3	Closed	15	['new', 'change', 'index', 'update', 'start', 'add', 'support', 'thin', 'use', 'method']
13425208	IGNITE	error create java virtual machine	code java apache module cli init creating directory binaries directory apache module cli target ignite bin work directory apache module cli target ignite work config directory apache module cli target ignite config log directory apache module cli target ignite log installing ignite snapshot apache ignite successfully initialize use ignite node start command start new local node apache module cli node start node apache example config ignite start new ignite node start node read log detail apache module cli target ignite log apache module cli cat apache module cli target ignite log unrecognized option open error create java virtual machine error fatal exception occur program exit code	['ignite-3']	1	1	Resolved	9	['ignite', 'type', 'exception', 'work', 'java', 'configuration', 'start', 'fail', 'error', 'create']
13545708	IGNITE	support conditional schema update install	currently catalog allow install schema update unconditional need way install schema update conditionally like late index state install schema update chane return false	['ignite-3']	3	4	Resolved	156	['index', 'update', 'implement', 'method', 'configuration', 'support', 'thin', 'use', 'change', 'add']
