id	project_name	assignee_id	processed_title	processed_description	processed_labels	priority_id	type_id	status_name
13370387	FLINK	5351	add documentation new window tvf base operation	version support window tvf base aggregation topn add documentation need restructure query page	['pull-request-available']	3	7	Closed
13379431	FLINK	5351	fail concurrentmodificationexception	code java error upsertkafkatableitcase time elapse error concurrentmodificationexception method code	['test-stability']	3	1	Closed
13339708	FLINK	5351	fix generate plan join changelog source update	instance	['pull-request-available', 'test-stability']	3	1	Closed
13007621	FLINK	5351	add possibility column name	debug maybe visualization future shell good possibilty name table column moment user idea table column name need match pojo field example suggestion code schema typeinformation type typeinformation type string string code	['starter']	3	2	Resolved
13298583	FLINK	5351	refactor baserow use rowkind instead byte header	pre step refactor setheader setrowkind update exist code send insert delete message instead message possible support	['pull-request-available']	3	7	Closed
13296436	FLINK	5351	refactor planner connector use new datum structure	refactor exist code use new datum structure interface issue split small subtask necessary	['pull-request-available']	3	7	Closed
13272974	FLINK	5351	type precision execute sql client blink planner	create table sql client blink planner noformat create table int varchar filesystem csv schema true xxxxxxx noformat table description look good noformat flink sql describe root int string select query fail noformat flink sql select error execute sql statement reason codegenexception incompatible type expression result type type result type noformat	['pull-request-available']	3	1	Resolved
13225682	FLINK	5351	introduce unbounded streaming inner left right join operator	operator responsible unbounded streaming inner left right join optimize follow case join key equality condition primary key efficient state layout input primary key join key primary key come efficient state layout input primary key default implementation	['pull-request-available']	3	4	Closed
13262640	FLINK	5351	array value account	use check equality value object howeveer value object array object lead wrong result	['pull-request-available']	3	1	Resolved
13243703	FLINK	5351	fail travis	fail travis code failure error expect code	['test-stability']	1	1	Resolved
13260687	FLINK	5351	support parse watermark statement sql ddl	support parse watermark syntax sql ddl implement flink sql parser module watermark syntax follow watermark columnname validation parse example referenced rowtime field exist support reference nested field rowtime field	['pull-request-available']	3	7	Resolved
13528993	FLINK	5351	execution logic showoperation tableenvironmentimpl	implement executableoperation execution logic	['pull-request-available']	3	7	Closed
13250410	FLINK	5351	fix tablefactory work ddl contain timestamp date time type	currently blink planner convert ddl tableschema new type system datatypes underlie typeinformation types make exist connector implementation kafka csv etc work accept old typeinformations types simple solution encode datatypes timestamp timestamp translate property convert old typeinformation types fix factory	['pull-request-available']	2	1	Resolved
13310359	FLINK	5351	init lookup join fail use udf lookup table	throw exception code cause scala matcherror character set class scala code sql code sql select join usertable hello jark code use function rexcall match rexinputref cause error myabe shoud add return skip	['pull-request-available']	3	1	Closed
13341006	FLINK	5351	confuse table source table sink factory identifier	create table source face follow exception code java cause validationexception multiple factory identifi odps implement dynamictablefactory find classpath ambiguous factory class code table source factory identifier table sink factory identifier confuse cause line factory connectoroption factory factoryclas connectoroption understand change aim display well exception message need change logic select proper exception message little bit	['pull-request-available']	1	1	Closed
13248367	FLINK	5351	ddl support csv tablefactory csv require	ddl support key property contain number old csv validator require validation exception	['pull-request-available']	2	1	Resolved
13290971	FLINK	5351	add documentation grouping set cube support streaming mode	grouping set cube support streaming mode blink planner miss add feature documentation confuse user note support blink planner old planner	['pull-request-available']	3	4	Resolved
13277861	FLINK	5351	set default planner sql client blink planner	discuss mailing list change default planner blink planner sql cli	['pull-request-available']	3	4	Resolved
13313012	FLINK	5351	deprecate api	past release community focus new sql ddl feature api maintain long time see bug issue api api receive refactoring release deprecate connect api recommend user use instead remove refactor exist connect api release api break	['pull-request-available']	3	4	Closed
13231910	FLINK	5351	synchronize late documentation change chinese document	commit documentation synchronize chinese document pull request synchronize late change chinese document	['pull-request-available']	4	7	Closed
13280358	FLINK	5351	sql run stream environment produce exception batch env run normally	summary sql run batch environment normally stream environment exception like error execute sql statement reason validationexception field name unique found duplicate sql create table int int int int int int int thousand int twothousand int fivethous int tenthous int odd int int varchar varchar varchar source column create table int source column select select select	['pull-request-available']	3	1	Resolved
13296434	FLINK	5351	add new datum structure interface table common	add new datum structure interface table common planner connector refactoring happen separate issue	['pull-request-available']	3	7	Closed
13248892	FLINK	5351	fix transformation name set blink planner	currently transformation name set blink planner example lookupjoin transformation use lookupjoin directly lose lot informatoion	['pull-request-available']	3	1	Resolved
13312940	FLINK	5351	jdbcfulltest fail compile	master code info error compilation error info error flink connector flink connector jdbc src test java org apache flink connector jdbc internal find symbol symbol variable location variable type object error flink connector flink connector jdbc src test java org apache flink connector jdbc internal incompatible type infer functional interface descriptor jdbcbatchingoutputformat statementexecutorfactory info error info info info reactor summary info info force shade success info flink success info flink annotation success info flink test util parent success info flink test util junit success info flink metric success info flink metric core success info flink core success info flink java success info flink queryable state success info flink queryable state client java success info flink filesystem success info flink hadoop success info flink runtime success min info flink scala success info flink mapr success info flink filesystem flink hadoop shaded success info flink base success info flink hadoop success info flink presto success info flink swift hadoop success info flink oss hadoop success info flink azure hadoop success info flink optimizer success info flink streaming java success info flink client success info flink test util success info flink runtime web success min info flink example success info flink example batch success info flink connector success info flink hadoop compatibility success info flink state backend success info flink statebackend rocksdb success info flink test success info flink streaming scala success info flink hcatalog success info flink table success info flink table common success info flink table api java success info flink table api java bridge success info flink table api scala success info flink table api scala bridge success info flink sql parser success info flink library success info flink cep success info flink table planner success min info flink sql parser hive success info flink table runtime blink success info flink table planner blink success min info flink metric jmx success info flink format success info flink json success info flink connector kafka base success info flink avro success info flink csv success info flink connector success info flink connector success info flink connector elasticsearch base success info flink connector success info flink connector success info flink connector success info flink connector hbase success info flink hadoop bulk success info flink orc success info flink orc nohive success info flink parquet success info flink connector hive success info flink connector jdbc failure info flink connector rabbitmq skipped info flink connector twitter skipped info flink connector nifi skipped info flink connector cassandra skipped info flink connector filesystem skipped info flink connector kafka skipped info flink connector gcp pubsub skipped info flink connector kinesis skipped info flink sql connector skipped info flink connector base skipped info flink sql connector skipped info flink sql connector skipped info flink sql connector skipped info flink sql connector kafka skipped info flink sql connector skipped info flink sql connector skipped info flink sql connector skipped info flink sql connector skipped info flink avro confluent registry skipped info flink sequence file skipped info flink compress skipped info flink sql orc skipped info flink sql parquet skipped info flink example streaming skipped info flink example table skipped info flink example build helper skipped info flink example streaming twitter skipped info flink example streaming state machine skipped info flink example stream gcp pubsub skipped info flink container skipped info flink queryable state runtime skipped info flink meso skipped info flink kubernete skipped info flink yarn skipped info flink gelly skipped info flink gelly scala skipped info flink gelly example skipped info flink external resource skipped info flink external resource gpu skipped info flink metric dropwizard skipped info flink metric graphite skipped info flink metric influxdb skipped info flink metric prometheus skipped info flink metric statsd skipped info flink metric datadog skipped info flink metric skipped info flink cep scala skipped info flink table uber skipped info flink table uber blink skipped info flink python skipped info flink sql client skipped info flink state processor api skipped info flink parent skipped info flink api skipped info flink lib skipped info flink uber skipped info flink scala shell skipped info flink dist skipped info flink yarn test skipped info flink end end test skipped info flink cli test skipped info flink parent child classloade test program skipped info flink parent child classloade test lib package skipped info flink dataset allround test skipped info flink dataset fine grain recovery test skipped info flink datastream allround test skipped info flink batch sql test skipped info flink stream sql test skipped info flink bucketing sink test skipped info flink distribute cache blob skipped info flink high parallelism iteration test skipped info flink stream stateful job upgrade test skipped info flink queryable state test skipped info flink local recovery allocation test skipped info flink test skipped info flink test skipped info flink quickstart skipped info flink quickstart java skipped info flink quickstart scala skipped info flink quickstart test skipped info flink confluent schema registry skipped info flink stream state ttl test skipped info flink sql client test skipped info flink streaming file sink test skipped info flink state evolution test skipped info flink rocksdb state memory control test skipped info flink end end test common skipped info flink metric availability test skipped info flink metric reporter prometheus test skipped info flink heavy deployment stress test skipped info flink connector gcp pubsub emulator test skipped info flink streaming kafka test base skipped info flink streaming kafka test skipped info flink streaming test skipped info flink streaming test skipped info flink plugin test skipped info dummy skipped info dummy skipped info flink tpch test skipped info flink streaming kinesis test skipped info flink test skipped info flink end end test common kafka skipped info flink tpcd test skipped info flink netty shuffle memory control test skipped info flink python test skipped info flink statebackend heap spillable skipped info flink contrib skipped info flink connector wikiedit skipped info flink test skipped info flink doc skipped info flink walkthrough skipped info flink walkthrough common skipped info flink walkthrough table java skipped info flink walkthrough table scala skipped info flink walkthrough datastream java skipped info flink walkthrough datastream scala skipped info info build failure info info total time min info finish info final memory info error fail execute goal maven compiler testcompile default testcompile project flink connector compilation failure compilation failure error flink connector flink connector jdbc src test java org apache flink connector jdbc internal find symbol error symbol variable error location variable type object error flink connector flink connector jdbc src test java org apache flink connector jdbc internal incompatible type infer functional interface descriptor jdbcbatchingoutputformat statementexecutorfactory error help error error stack trace error run maven switch error run maven switch enable debug log error error information error possible solution read follow article error help error error correct problem resume build command error mvn flink connector code	['test-stability']	1	1	Closed
13295288	FLINK	5351	refactor retraction rule support infer changelogmode	current retraction machanism support message kind introduce message kind user insert delete order support refactor current retraction rule support changelogmode inference previous node attach accmode trait retraction rule propose design infer changelogmode trait node design documentation	['pull-request-available']	3	7	Closed
13285715	FLINK	5351	expressionreducer escape reduce string value	expressionreducer escape reduce string value escaping happen code generation output result inccorect problem line guess simple example reproduce problem code java val long string val datum new mutable long string  datum def test unit val val sqlquery mytable val result val sink new testingappendsink code output code java code mention user mailing list	['pull-request-available']	2	1	Resolved
13217573	FLINK	5351	add language switch sidebar flink document	add language switch similar project webpage add switch version support chinese language want expose switch satisfy translation coverage	['pull-request-available']	3	7	Closed
13312938	FLINK	5351	collectionexecutortest fail compile		['pull-request-available']	1	4	Closed
13571580	FLINK	5351	add special thank page flink website	issue aim add special thank page flink website honor appreciate company organization sponsor machine service project discussion thread	['pull-request-available']	3	2	Open
13223246	FLINK	5351	introduce tableimpl remove table flink table planner blink	merge table interface add flink table api java classpath conflict table flink table planner blink result ide error test fail local look good mvn verify issue table flink table planner blink extend table flink table api java rename tableimpl leave method implementation logicalnode refactore	['pull-request-available']	3	4	Closed
13287576	FLINK	5351	nullpointerexception	run code nullpointerexception null snapshot snapshot snapshot flink snapshot flink snapshot flink snapshot flink snapshot flink snapshot code	['pull-request-available', 'test-stability']	3	1	Resolved
13273224	FLINK	5351	improve schema derivation avro format	json csv oldcsv support true schema table schema avro format user pass avro schema file define format schema explicitly think drop true default behavior	['pull-request-available']	3	7	Closed
13335154	FLINK	5351	implement cumulative windowing window aggregate operator	support cumulative window exist window aggregate operator windowoperator	['pull-request-available']	3	7	Closed
13248473	FLINK	5351	set parallelism table sink operator input transformation parallelism	currently lot tablesink connector use setparallelism explicitly use default parallelism environment parallelism input transformation example global aggregation parallelism case lead data reorder result incorrect result	['pull-request-available']	2	1	Resolved
12987796	FLINK	5351	add basic stream table api example	table api offer streaming feature runnable example show convert union filter project stream table api	['starter']	3	2	Resolved
13335940	FLINK	5351	write table rowtime column type kafka fail classcastexception	try write table kafka json format rowtime attribute type job fail noformat classcastexception timestampdata cast long noformat look relevant code deal long type timestamp sinkoperator	['pull-request-available']	2	1	Closed
13238749	FLINK	5351	introduce partitionabletablesource partition pruning	datum source partitionable storage hive hdfs druid query need read small subset total datum use partition information prune skip file irrelevant user query query optimization time execution time reduce obviously especially large partitioned table	['pull-request-available']	3	2	Closed
13285095	FLINK	5351	blink planner produce wrong aggregate result state clean	port blink planner state clean happen processing time case retraction arrive state clean change new accumulator create invalid retraction message emit change drop retraction message accumulator exist line miss groupaggfunction code null accumulator create new accumulator retraction message happen retraction message message key state clean return accumulate message firstrow true accumulator firstrow false code bug verify spot look code	['pull-request-available']	2	1	Resolved
13339476	FLINK	5351	outdated sql doc aggregate function merge	java doc user docs merge method aggregation udf describe optional group accumulator instance accumulator instance function implement data stream session window grouping aggregate datum set group nowadays method require case stumble hop window streaming code mergedacconheap mergedaccexternaltypes mergedacconheap false mergedacconheap true mergedaccexternaltypes mergedacconheap true code	['pull-request-available']	3	1	Closed
13268598	FLINK	5351	improve schema derivation csv json format	currently need define schema format ddl decriptor api ticket derive schema default behavior compatibility previous version support explicitly declare format schema	['pull-request-available']	3	7	Resolved
13353502	FLINK	5351	implement mini batch optimize slicing window aggregate operator	support cumulative window current cumulative window efficient slice share leverage slicing idea propose design doc slicing optimize implementation hop cumulative tumble window introduce managedmemory base mini batch optimization slicing window aggregate operator tremendously reduce accessing state high throughtput latency loss	['pull-request-available']	3	7	Closed
13296762	FLINK	5351	introduce new hbase connector new property key	new hbase connector use new interface propose dynamictablesource dynamictablesink factory new propose key connector	['pull-request-available']	3	7	Closed
13230519	FLINK	5351	asyncwaitoperator deep copy streamelement object reuse enable	currently asyncwaitoperator directly input streamelement streamelementqueue object reuse enable streamelement reuse mean element streamelementqueue modify result output asyncwaitoperator wrong easy way fix deep copy input streamelement object reuse enable like	['pull-request-available', 'stale-assigned']	3	1	Closed
13237194	FLINK	5351	introduce new interface source sink blink runner work	order support blink batch temporal table join need new interface introduce inputformattablesource add isbounded interface streamtablesource inputformattablesource extend streamtablesource expose getinputformat remove batchtablesource streamtablesource blink planner support blink flink planner introduce outputformattablesink outputformattablesink extend streamtablesink expose getoutputformat remove batchtablesink blink planner support blink flink planner introduce lookupabletablesource remove lookupabletablesource lookupconfig blink planner support blink planner expose gettablestat tablesource support blink flink planner	['pull-request-available']	3	2	Closed
13260688	FLINK	5351	add watermark information tableschema	discuss watermark information tableschema expose connector vis need introduce watermarkspec class describe watermark information	['pull-request-available']	3	7	Resolved
13283636	FLINK	5351	unable use watermark depend flink planner blink planner	run follow code module flink example table module code java license apache software foundation asf contributor license agreement notice file distribute work additional information copyright ownership asf license file apache license version license use file compliance license obtain copy license require applicable law agree writing software distribute license distribute basis warranty condition kind express imply license specific language govern permission limitation license package import timecharacteristic import streamexecutionenvironment import environmentsettings import streamtableenvironment javadoc public class tableapiexample args exception public static void arg throw exception streamexecutionenvironment bsenv eventtime environmentsettings bssetting streamtableenvironment bstableenv bssetting create table status direction watermark interval kafka universal update mode code hit following error code java exception thread main calcitecontextexception line column line column unknown identifier thread main calcitecontextexception line column line column unknown identifier method sqlvalidatorexception unknown identifier method code	['pull-request-available']	1	1	Resolved
13320159	FLINK	5351	minibatch work source	follow table api streaming job stick enable mini batching code streamexecutionenvironment env environmentsettings setting streamtableenvironment tableenv setting disable mini batching completely result configuration tableconf true latency phase strategy create table location string population int connector kafka topic format csv early offset create table connector print like exclude option tableenv code pre populated kafka topic call element code code	['pull-request-available']	1	1	Closed
13221348	FLINK	5351	support code generation blink build function operator	support code generation build function operator support operator issue aim complement function operator support flink sql inlclude concat like substring upper lower	['pull-request-available']	3	2	Closed
13290444	FLINK	5351	improve default flush strategy elasticsearch sink work box	currently elasticsearch sink provide flush option code java action size code optional default value flink flush action flush size default value elasticsearch client result surprising behavior result output default user report wait record record testing potential problem production low job soem datum long time visible elasticsearch propose default flush interval row size sink flush apply new sink option code action size code	['usability']	2	4	Closed
13314196	FLINK	5351	fix statemigrationexception incompatible	find sql job functionality provide blink planner job state retrieve incompatible state serializer fact compatible error log display like panel title serverid desc serverid quantity info task serverid desc serverid oid quantity switch running failed runtimeexception error get state cause statemigrationexception new state serializer incompatible careful debugging find issue compatibility check type serializer short checkpointe flink serialize sortedmapserializer create sortedmapserializersnapshot object original comparator encapsulate object restoration object read restore normal construction retractabletopnfunction instance comparator provide flink argument later valuestatedescriptor act like key state store come problem newly restore flink program try access state getstate previously mention valuestatedescriptor state backend firstly detect provide comparator state descriptor compatible snapshot eventually logic go equal method retractabletopnfunction comparatorwrapper class equal method code snippet code java return code debug find class comparator snapshot class comparator provide new job method return false actually compatible act code generator generate independently corresponding varaible comparator highly likely different believe implementation equal method flaw address later release	['pull-request-available']	3	1	Closed
13335158	FLINK	5351	support window tvf base window aggreagte planner	support window tvf base window aggreagte planner introduce new physical node streamexecwindowpropertyaggregate streamexecwindowassigner optimize streamexecgroupwindowaggregate possible	['pull-request-available']	3	7	Closed
