id	project_name	assignee_id	processed_title	processed_description	processed_labels	priority_id	type_id	status_name
13552048	SPARK	6681	sbt doc command execute successfully java	code java error sourcecode git spark sbt pick error loading source file sourcecode git spark sbt common kvstore src main java org apache spark util kvstore error loading source file sourcecode git spark sbt common kvstore src main java org apache spark util kvstore error loading source file sourcecode git spark sbt common kvstore src main java org apache spark util kvstore error loading source file sourcecode git spark sbt common kvstore src main java org apache spark util kvstore error loading source file sourcecode git spark sbt common kvstore src main java org apache spark util kvstore error loading source file sourcecode git spark sbt common kvstore src main java org apache spark util kvstore error loading source file sourcecode git spark sbt common kvstore src main java org apache spark util kvstore error loading source file sourcecode git spark sbt common kvstore src main java org apache spark util kvstore error loading source file sourcecode git spark sbt common kvstore src main java org apache spark util kvstore error loading source file sourcecode git spark sbt common kvstore src main java org apache spark util kvstore error loading source file sourcecode git spark sbt common kvstore src main java org apache spark util kvstore error loading source file sourcecode git spark sbt common kvstore src main java org apache spark util kvstore error loading source file sourcecode git spark sbt common kvstore src main java org apache spark util kvstore error loading source file sourcecode git spark sbt common kvstore src main java org apache spark util kvstore error loading source file sourcecode git spark sbt common kvstore src main java org apache spark util kvstore error construct javadoc information error building index package class error standard doclet version lts error building tree package class error sourcecode git spark sbt common kvstore src main java org apache spark util kvstore error head sequence compare implicit precede heading error serialization error sourcecode git spark sbt common kvstore target api org apache spark util kvstore error generating sourcecode git spark sbt common kvstore target api org apache spark util kvstore error generating sourcecode git spark sbt common kvstore target api org apache spark util kvstore error generating sourcecode git spark sbt common kvstore target api org apache spark util kvstore error generating sourcecode git spark sbt common kvstore target api org apache spark util kvstore error generating sourcecode git spark sbt common kvstore target api org apache spark util kvstore error generating sourcecode git spark sbt common kvstore target api org apache spark util kvstore error generating sourcecode git spark sbt common kvstore target api org apache spark util kvstore error generating sourcecode git spark sbt common kvstore target api org apache spark util kvstore error generating sourcecode git spark sbt common kvstore target api org apache spark util kvstore error generating sourcecode git spark sbt common kvstore target api org apache spark util kvstore error generating sourcecode git spark sbt common kvstore target api org apache spark util kvstore error generating sourcecode git spark sbt common kvstore target api org apache spark util kvstore package error generating sourcecode git spark sbt common kvstore target api org apache spark util kvstore package error generating sourcecode git spark sbt common kvstore target api constant error generating sourcecode git spark sbt common kvstore target api serialize error generating sourcecode git spark sbt common kvstore target api overview error building index class error generating sourcecode git spark sbt common kvstore target api allclasse error generating sourcecode git spark sbt common kvstore target api allpackage error generating sourcecode git spark sbt common kvstore target api index error generating sourcecode git spark sbt common kvstore target api error generating sourcecode git spark sbt common kvstore target api help error error warn javadoc exit exit code error error error error error error error error error error error error sbt error scala error error error sbt error error sbt error sbt error sbt error sbt error error error error error error error kvstore compile doc error total time complete sep	['pull-request-available']	4	7	Resolved
13540299	SPARK	6681	log plan change execution test fail	run build sbt clean sql test extendedsqltest slowsqltest code java dump query execution info file dump query execution info exist file dump query execution info non exist folder dump query execution info invalid path dump query execution info file explainmode format limit number field sql config check maximum field restriction tostring exception error handling clone query plan different stage log plan change execution failed logevent false code run build sbt sql testonly queryexecutionsuite issue need investigate	['pull-request-available']	3	1	Resolved
13553635	SPARK	6681	use pattern match type checking conversion	refer jep example code java obj instanceof string string str string obj code replace code java obj instanceof string str code new code look compact	['pull-request-available']	4	7	Resolved
13550448	SPARK	6681	downgrade scala maven plugin	scala maven plugin version later try automatically append option scala compilation argument specify user try add option scala version high try append option scala version append output version scala addition option cause issue mention option strong compilation restriction ensure bytecode format api code compatible specify version java api sun package export java directbuffer zoneinfo streamdecoder make invisible compile different version discussion scala community submit issue scala maven plugin community discuss possibility add additional setting control addition option apache spark short term suggest downgrade scala maven plugin version avoid automatic add option scala compilation argument long term reduce use api export compatibility compilation option	['pull-request-available']	3	4	Resolved
13555753	SPARK	6681	clean deprecated api usage relate seqops	method transform trait seqops deprecate method reversemap trait seqops deprecate method union trait seqops deprecate code java warn sourcecode git spark sbt mllib src main scala org apache spark classification method transform trait seqops deprecate use mapinplace indexedseq instead warn applicable filter warning cat deprecation site origin warn numcoefficientset warn code	['pull-request-available']	3	7	Resolved
13553325	SPARK	6681	replace	code java proxy class generate name module encapsulate accessible code outside module throw illegalaccessexception call inaccessible proxy class use class invocationhandler create proxy instance instead package module membership proxy class public static class loader class interface throw illegalargumentexception code	['pull-request-available']	4	7	Resolved
13592847	SPARK	6986	deprecate geterrorclass sparkthrowable	follow conclusion deprecate geterrorclass method sparkthrowable add new method getcondition replacement geterrorclass	['pull-request-available']	3	7	Resolved
13210240	SPARK	6986	use proleptic gregorian calendar	spark previous version use hybrid calendar julian gregorian date timestamp parsing function expression ticket aim switch spark proleptic gregorian calendar use class introduce java timestamp date manipulation purpose switch proleptic gregorian calendar conform sql standard suppose calendar release note spark switch proleptic gregorian calendar parsing formatting convert date timestamp extract sub component like year day etc use java api class package base iso chronology docs api java time chrono previous version spark perform operation hybrid docs api java util julian gregorian change impact result date timestamp october gregorian	['release-notes']	3	14	Resolved
13562286	SPARK	6986	sessionholder throw exception internalerror	need throw sparkexception return internalerror sessionholder user internal error	['pull-request-available']	3	1	Resolved
13563541	SPARK	6986	handle non existent error class	check existence error class scala connect client convert error proto spark exception error class exist use legacy error class allow avoid internal error client receive non existent error class connect server	['pull-request-available']	3	4	Open
13568684	SPARK	6986	wrong error message incorrect ansi interval	spark sql recognise ansi interval output wrong pattern particular ansi interval example recognise year month interval say day time interval code sql spark sql default select interval year month interval string match year month format interval day hour cast interval year month line pos sql select interval year month code	['pull-request-available']	4	1	Resolved
13561281	SPARK	6986	require error class analysisexception	modify analysisexception accept error class instead error message create exception	['pull-request-available']	3	7	Resolved
13213473	SPARK	6986	add benchmark xorshiftrandom	currently benchmark xorshiftrandom mixed implementation need extract code create separate benchmark	['low-hanging-fruit']	4	7	Resolved
13564722	SPARK	6986	add dayname function	add function dayname return letter abbreviation give date timestamp spark apis scala python connect similar jira project spark issue allissue	['pull-request-available']	3	4	Resolved
13591397	SPARK	6986	detect unused message parameter	pass error message parameter place holder message format match code maintainability perspective nice detect case run test example error message format look like code message cast sqlstate code pass message parameter extra parameter code scala messageparameter map expression long sourcetype string targettype long cast unused parameter detail implicit cast code	['pull-request-available']	4	7	Resolved
13568223	SPARK	6986	check sparkunsupportedoperationexception instead unsupportedoperationexception	use checkerror test sparkunsupportedoperationexception exception instead unsupportedoperationexception sql project	['pull-request-available']	3	7	Resolved
13595197	SPARK	6986	rename errorclass condition error json format	rename errorclass condition error json format follow agreement	['pull-request-available']	3	7	Open
13557505	SPARK	6986	align codegen non codegen implementation encode	fix implementation codegen non codegen encode expression raise error invalid input charset	['pull-request-available']	3	1	Resolved
13290181	SPARK	6986	convert catalyst date timestamp java date timestamp local date time	default collect return timestamp date instance offset derive internal value catalyst timestamp date store microsecond epoch conversion internal value timestamp date base proleptic gregorian calendar convert resulted value year string produce timestamp date string julian calendar example code scala date row code fix internal catalyst value convert local date time gregorian calendar construct local date time resulted year month second julian calendar	['correctness']	3	7	Resolved
13562107	SPARK	6986	convert illegalstateexception internalerror session iterator	convert illegalstateexception class updatingsessionsiterator mergingsessionsiterator	['pull-request-available']	3	7	Resolved
13568460	SPARK	6986	replace illegalargumentexception sparkillegalargumentexception sql api	replace illegalargumentexception sparkillegalargumentexception sql api code base introduce new legacy error class prefix	['pull-request-available']	3	7	Resolved
13563071	SPARK	6986	pass message parameter metadata errorinfo	message parameter error class messageparameter field metadata errorinfo possible construct error have error class	['pull-request-available']	3	4	Resolved
13354124	SPARK	6986	load data refresh table cache	example portrait issue create source table code sql spark sql create table int int hive partitioned spark sql insert partition select spark sql table extended like partition default false partition value location maximgekk proj load data refresh cache spark warehouse code load datum source table cached destination table code sql spark sql create table int int hive partitioned spark sql insert partition select spark sql cache table spark sql select spark sql load data local inpath maximgekk proj load data refresh cache spark warehouse table partition spark sql select code query recently load datum source table	['correctness']	3	7	Resolved
13564771	SPARK	6986	port classifyexception jdbc dialect error class	port exist classifyexception method accept description new error class	['pull-request-available']	3	7	Resolved
13437045	SPARK	6986	test error class	add test error class queryexecutionerrorssuite test cover exception throw queryexecutionerror code scala def int throwable new code example test error class test check entire error message sqlstate define file error class	['starter']	4	7	Resolved
13559487	SPARK	6986	restrict charset encode	currently list supported charset encode stable fully depend jdk version user code work devop change java version spark cluster ticket aim restrict list supported charset code ascii code	['pull-request-available']	3	4	Resolved
13567717	SPARK	6986	deprecate	sql config allow use zero index set true user error code sql select hello illegal format argument index illegalformatargumentindexexception illegal format argument index code	['pull-request-available']	3	7	Resolved
13568983	SPARK	6986	raise spark exception error class config value check	currently spark throw illegalargumentexception checkvalue configbuilder need overload checkvalue throw sparkillegalargumentexception error class improve user experience spark sql impression spark error	['pull-request-available']	3	7	Resolved
13561237	SPARK	6986	replace illegalstateexception sql core	replace illegalstateexception sql core migration new error framework error class	['pull-request-available']	4	7	Resolved
13551893	SPARK	6986	respect hadooprdd	currently sql config influence rdd create spark sql filescanrdd impact hadooprdd newhadooprdd rdd separate core config inconsistency confuse user know implementation detail ticket aim eliminate inconsistency	['pull-request-available']	3	4	Resolved
13351211	SPARK	6986	alter table add partition refresh cache	example reproduce issue code sql spark sql create table col int int partition spark sql insert partition select spark sql cache table spark sql select spark sql table extend like partition default false partition value location maximgekk proj add partition refresh spark warehouse code add new partition copy exist code maximgekk proj add partition refresh spark warehouse maximgekk proj add partition refresh spark warehouse code add new partition select table code spark sql alter table add partition location maximgekk proj add partition refresh spark warehouse spark sql select code old datum	['correctness']	3	7	Resolved
13595302	SPARK	6986	require error class sparkexception	modify sparkexception accept error class instead error message create exception	['pull-request-available']	3	7	Open
13568578	SPARK	6986	check sparkillegalargumentexception instead illegalargumentexception catalyst	use checkerror test sparkillegalargumentexception exception instead illegalargumentexception catalyst project	['pull-request-available']	3	7	Resolved
13515717	SPARK	6986	min fail minimal timestamp	code demonstrate issue code python datetime import datetime timezone import timestamptype import function tzinfo traceback recent file line file maximgekk proj apache spark python pyspark sql line return file maximgekk proj apache spark python pyspark sql line head file maximgekk proj apache spark python pyspark sql line head return file maximgekk proj apache spark python pyspark sql line return file maximgekk proj apache spark python pyspark sql line collect return file maximgekk proj apache spark python pyspark line yield file maximgekk proj apache spark python pyspark line return file maximgekk proj apache spark python pyspark line load return encode encoding file maximgekk proj apache spark python pyspark sql line return lambda file maximgekk proj apache spark python pyspark sql line frominternal value file maximgekk proj apache spark python pyspark sql line file maximgekk proj apache spark python pyspark sql line frominternal return file maximgekk proj apache spark python pyspark sql line frominternal return valueerror year range code	['pull-request-available']	3	1	In Progress
13563270	SPARK	6986	replace unsupportedoperationexception sparkunsupportedoperationexception catalyst	replace unsupportedoperationexception sparkunsupportedoperationexception catalyst code base introduce new legacy error class prefix	['pull-request-available']	3	7	Resolved
13382768	SPARK	6986	support field year month interval type	extend yearmonthintervaltype support interval year interval month interval year month	['pull-request-available']	3	7	Resolved
13560348	SPARK	6986	restrict charset decode	currently list support charset decode stable fully depend jdk version user code work devop change java version spark cluster ticket aim restrict list supported charset code ascii code	['pull-request-available']	3	4	Resolved
13364523	SPARK	6986	difference result cast float timestamp	code portrait issue code sql spark sql create temp view select spark sql select spark sql select timestamp spark sql cache table spark sql select spark sql select timestamp code result cache view different cached view	['correctness']	3	1	Resolved
13564156	SPARK	6986	skip query context catch dataframe method	improve user experience spark dataframe dataset api provide precise context error catch dataframe query context skip dataframe dataset method	['pull-request-available']	3	4	Resolved
13560109	SPARK	6986	align codegen non codegen implementation stringdecode	fix implementation codegen non codegen stringdecode expression raise error invalid input charset	['pull-request-available']	3	1	Resolved
13562237	SPARK	6986	remove legacy datetime rebase sql config	remove deprecated sql config alternative config	['pull-request-available']	4	4	Resolved
13561188	SPARK	6986	replace illegalstateexception catalyst	replace illegalstateexception catalyst migration new error framework error class	['pull-request-available']	4	7	Resolved
13550393	SPARK	6986	unsupported map array constructor sql connect client	code demonstrate issue code scala code fail error code java info unsupportedoperationexception literal info array info argument info literal info integer info info info info support code	['pull-request-available']	3	1	Resolved
13287647	SPARK	6986	potential datum loss legacy application switch proleptic gregorian calendar	recently discover spark site lot datum contain date october issue site try upgrade spark change impact result date timestamp october gregorian quote recently discover large scale spark application rely date october case come recently application use commercial party library encode sensitive date insert library encode actual date date select library decode date original date encode value date include october application use specific unlikely date marker indicate unknown date lieu null site run problem component system upgrade use proleptic gregorian calendar spark application read file create upgrade component interpret encode marker date incorrectly vice versa datum mix calendar hybrid proleptic gregorian metadata indicate file calendar site enormous amount exist datum encode date scheme feasible solution relevant spark spark application use date encode scheme run trouble run spark application properly interpret date previously write spark spark version application write datum table mix calendar hybrid proleptic gregorian metadata indicate file use calendar similarly site run mixed spark version result datum write version interpret table mix calendar way detect file use calendar real life example case application enormous amount legacy datum encode date scheme feasible want consider configuration set allow user specify calendar store retrieve date timestamp value sure flag affect date timestamp relate function realize change far big add configuration setting quick example trouble happen real life case marker date spark noformat scala datum long scala noformat spark read legacy file noformat scala datum long scala noformat way hive similar problem hive switch hybrid calendar proleptic gregorian calendar upgrade headache relate date hive community follow change write date timestamp datum orc parquet avro file hive check configuration set determine calendar use write date timestamp datum orc parquet avro file hive store calendar type metadata read date timestamp datum orc parquet avro file hive check metadata calendar type read date timestamp datum orc parquet avro file lack calendar metadata hive behavior determine configuration setting allow hive read legacy datum note datum consist mix calendar type metadata good solution	['release-notes']	1	1	Resolved
13557356	SPARK	6986	enforce error class sub class analysisexception	error class sub class analysisexception mandatory enforce caller set simplify migration error class	['pull-request-available']	3	7	Resolved
13268879	SPARK	6986	remove sql config declare remove spark	need remove follow sql config	['release-notes']	4	4	Resolved
13566149	SPARK	6986	incorrect count dataframe load csv datasource	example portrait issue code java string string city string active string	['correctness', 'pull-request-available']	3	1	Resolved
13570968	SPARK	6986	split dataframesuite	split dataframesuite small test suite distribute test test suite improve maintainability speed execution	['pull-request-available']	3	6	Resolved
13595253	SPARK	6986	require error class sparkoutofmemoryerror	modify sparkoutofmemoryerror accept error class instead error message create exception	['pull-request-available']	3	7	Resolved
13549931	SPARK	6986	reflect fail internal error null class method	example demonstrate issue code sql spark sql default select uuid string spark sql phase analysis fail internal error hit bug spark spark plugin use report bug correspond community vendor provide stack trace code	['pull-request-available']	3	1	Resolved
13561144	SPARK	6986	migrate catalognotfoundexception error class	migrate exception catalognotfoundexception error class prohibit creation catalognotfoundexception error class introduce new error class create catalognotfoundexception new error class	['pull-request-available']	3	7	Resolved
13198740	SPARK	6986	write file text datasource	text base datasource like csv json text produce file partition introduce additional overhead open read file current implementation outputwriter output stream create eagerly record write stream creation postpone write	['release-notes']	4	4	Resolved
13563097	SPARK	6986	convert npe assert command internal error	handle npe assert eagerly execute command convert internal error	['pull-request-available']	3	4	Resolved
13549170	SPARK	6986	provide context dataset api error	sql failure provide nice error context failure noformat sparkarithmeticexception division zero use tolerate divisor return null instead necessary set false bypass error position noformat add similar user friendly error context dataset api consider follow spark app noformat import sparksession import object simpleapp def val spark import val noformat error context noformat exception thread main sparkarithmeticexception division zero use tolerate divisor return null instead necessary set false bypass error dataset div call noformat	['pull-request-available']	3	4	Resolved
13591601	SPARK	6986	rename errorclass checkerror	rename errorclass condition checkerror relate function follow agreement	['pull-request-available']	3	7	Resolved
13552786	SPARK	6986	refer unescaping rule expression description	update expression function description refer unescaping rule item regexp parameter describe confuse user	['pull-request-available']	4	20	Resolved
13562769	SPARK	6986	require error class sparkthrowable sub class	modify sparkthrowable sub class accept error class instead error message create exception	['pull-request-available']	3	7	Resolved
13557482	SPARK	6986	output stack trace callsite dataframe context	include available item callsite dataframe context simplify user issue	['pull-request-available']	3	4	Resolved
13561716	SPARK	6986	classify exception jdbc table catalog	handle exception jdbc driver convert analysisexception error class	['pull-request-available']	3	4	Resolved
