id	project_name	assignee_id	processed_title	processed_description	processed_labels	priority_id	type_id	status_name
12952965	SPARK	4739	python dataframe csv load large file write console ipython	spark master branch run following command large tab separate file content file write stderr code code sample output code error executor exception task stage tid textparsingexception error processing input length parsed input exceed maximum number character define parser setting identify line separator character parsed content cause error line separator parser setting set parse content privacy shake haptic interface manage privacy setting mobile location sharing application privacy shake haptic interface manage privacy setting mobile location sharing application international conference human computer interaction interact profiles bias technology acceptance studies social network services profile bias technology acceptance study social network service international conference human computer interaction interact web snippet international conference web information system technology webist interactive user interfaces neuroanatomy exploration interactive user interface neuroanatomy exploration internationa cause arrayindexoutofboundsexception error tasksetmanager task stage fail time abort job code small sample line datum get error soon sample start get error think spark platform output actual datum stderr decrease readability	['csv', 'csvparser', 'dataframe', 'pyspark']	3	1	Resolved
13559255	SPARK	4739	sparknosuchelementexception canonical error api	add sparknosuchelementexception canonical error api document properly	['pull-request-available']	4	4	Resolved
13564134	SPARK	4739	exclude unitt xml reporting python image	unitt xml reporting support hide real error code file spark spark python pyspark streaming test line testrunner file lib unitt line init file lib unitt line runtests file local lib dist package xmlrunner line run file lib unitt line return kwd file lib unitt line run file lib unitt line return kwd file lib unitt line run file lib unitt line return kwd file lib unitt line run file local lib dist package xmlrunner line stopt file local lib dist package xmlrunner line callback file local lib dist package xmlrunner line attributeerror xmltestresult object attribute mean code optional dependency testing exclude	['pull-request-available']	3	7	Resolved
13417574	SPARK	4739	switch default index distribute sequence default panda api spark	panda api spark currently set sequence rely send datum executor easily cause oom well switch distribute sequence type truly distribute datum change leverage default end user benefit lot performance improvement	['release-notes']	2	4	Resolved
13231019	SPARK	4739	create dataframe pyspark arraytype produce rows array	affect python create dataframe type true end row fill code java import arraytype integertype true code example consistently element code code happen type true	['correctness']	1	1	Resolved
13564143	SPARK	4739	run pypy python test independently	like terminate middle oom split	['pull-request-available']	4	6	Resolved
13313420	SPARK	4739	use iloc positional slicing instead direct slicing createdataframe arrow	use float index panda produce wrong result code import panda code direct slicing use value index index contain float code code	['correctness']	2	1	Resolved
13555804	SPARK	4739	make entire binder build fail fast set	binder build currently break like upload pyspark late pypi installation step slightly ignore failure	['pull-request-available']	3	2	Resolved
13243438	SPARK	4739	revisit python panda udf	past year panda udfs important change spark python datum science functionality evolve organically lead inconsistency confusion user document revisit udf definition naming result discussion xiangrui jin hyukjin reynold document new proposal	['release-notes']	1	4	Resolved
13577665	SPARK	4739	backward compatibility test spark connect	run spark connect server separately run spark connect server low version high version client opposite	['pull-request-available']	3	7	Resolved
13561085	SPARK	4739	test miss case sparksession		['pull-request-available']	4	7	Resolved
13568665	SPARK	4739	recover case	code import panda true false code code python pyspark sql panda userwarning createdataframe attempt arrow optimization set true reach error continue automatic fallback set false range arg zero traceback recent file line file python pyspark sql line createdataframe return type overload file python pyspark sql panda line createdataframe return schema timezone file python pyspark sql panda line start step start step valueerror range arg zero code code dataframe columns index code	['pull-request-available']	2	1	Resolved
13561097	SPARK	4739	fix output	return	['pull-request-available']	4	1	Resolved
13559809	SPARK	4739	skip python	code error traceback recent file spark spark python pyspark torch test line output true file spark spark python pyspark torch line run return file spark spark python pyspark torch line run output file spark spark python pyspark torch line output file spark spark python pyspark torch line return file spark spark python pyspark torch line raise runtimeerror runtimeerror torchdistributor fail training view stdout log detailed error message error traceback recent file spark spark python pyspark torch test line output true file spark spark python pyspark torch line run return file spark spark python pyspark torch line run output file spark spark python pyspark torch line output file spark spark python pyspark torch line return file spark spark python pyspark torch line raise runtimeerror runtimeerror torchdistributor fail training view stdout log detailed error message code	['pull-request-available']	4	7	Resolved
13559258	SPARK	4739	scala spark connect client	scala spark connect client	['pull-request-available']	3	2	Resolved
13584438	SPARK	4739	use sparksession sqlimplicit		['pull-request-available']	4	6	Resolved
13571080	SPARK	4739	suppress python exception pyspark python path	code scala table int json warn datasourcemanager skip lookup python data sources failure sparkexception error python worker homebrew caskroom miniconda base bin error find module specification modulenotfounderror module name pyspark code pyspark python path show warning message spark session initialization	['pull-request-available']	4	6	Resolved
13565742	SPARK	4739	refine error class python automatic sort function	inconsistency way automatically generate sort error class dev easier	['pull-request-available']	3	7	Resolved
13569980	SPARK	4739	increase timeout action kafkacontinuoustest	fail macos build	['pull-request-available']	4	6	Resolved
13558571	SPARK	4739	upgrade version appveyor		['pull-request-available']	3	7	Resolved
13559628	SPARK	4739	flaky python	code traceback recent file spark spark python pyspark test line file spark spark python pyspark line count return file spark spark python pyspark line sum return type value file spark spark python pyspark line fold val file spark spark python pyspark line collect file spark spark python lib line file spark spark python lib line raise error occur call sparkexception job abort stage failure task stage fail time recent failure lose task stage tid localhost executor driver sparkexception python worker exit unexpectedly crash cause sparkexception python worker exit unexpectedly crash cause eofexception handle exception exception occur traceback recent file spark spark python pyspark test line segmentation fault assertionerror regex match segmentation fault find error occur call sparkexception job abort stage failure task stage fail time recent failure lose task stage tid localhost executor driver sparkexception python worker exit unexpectedly scala sparkexception python worker exit unexpectedly org code flaky	['pull-request-available']	4	7	Resolved
13569791	SPARK	4739	use hash key properly sparkr build windows	cache	['pull-request-available']	3	4	Resolved
13569299	SPARK	4739	install proper python version sparkr windows build avoid warning	code traceback recent file line code error file line file line hyukjinkwon spark action file line hyukjinkwon spark action file line file line file line file line importerror import celltype type code	['pull-request-available']	3	6	Resolved
13569123	SPARK	4739	deflake interrupt tag	code interrupt tag failed code pass eventually return normally attempt time second failure message length instead expect length interrupted operation code	['pull-request-available']	3	6	Resolved
13579939	SPARK	4739	checkpoint localcheckpoint scala spark connect client	implement checkpoint localcheckpoint python spark connect client scala	['pull-request-available']	3	4	Resolved
13559251	SPARK	4739	upgrade cloudpickle	include official support python	['pull-request-available']	3	7	Resolved
13559626	SPARK	4739	fix doct python	code file spark spark python pyspark panda line failed example ordereddict expect got code	['pull-request-available']	4	7	Resolved
13560925	SPARK	4739	exclude generate file code coverage report	exclude	['pull-request-available']	3	7	Resolved
13105961	SPARK	4739	type conflict date timestamp date partition column	look bug resolve type conflict partition column find corner case case timestamp infer date type infer code val foo code code root integer nullable true date nullable true code case decimal infer integer infer code val decimal bar code code root integer nullable true decimal integer nullable true code look duplicate type resolution logic possible separate numeric precedence like comparison	['release-notes']	4	1	Resolved
13313142	SPARK	4739	pyspark beam pickling issue	pyspark monkeypatche namedtuple make difficult impossible depickle instance outside pyspark environment pyspark load environment time try pickle namedtuple able unpickle environment apache spark blob master python pyspark apply conflict directly try use beam non spark environment namingly flink dataflow make impossible use pipeline namedtuple load code python import collection import dill columninfo columninfo type columnname pytype disable ignore type comment type type pytype disable ignore type comment int code code python import pyspark import collection import dill columninfo columninfo type columnname pytype disable ignore type comment type type pytype disable ignore type comment int code second pickle object environment pyspark	['release-notes']	3	1	Resolved
13582814	SPARK	4739	add origin relationcommon protobuf defnition	add new protobuf message origin reuse definition relationcommon	['pull-request-available']	3	4	Resolved
13577917	SPARK	4739	different arrow version client server	code fail pythonexception exception throw python worker stack trace traceback recent file runner work spark spark python lib pyspark sql panda line return file pyarrow line file pyarrow line file pyarrow line file pyarrow line arrowinvalid integer value range exception direct cause follow exception traceback recent file runner work spark spark python lib pyspark line main process file runner work spark spark python lib pyspark line process outfile file runner work spark spark python lib pyspark sql panda line return stream file runner work spark spark python lib pyspark sql panda line batch iterator file runner work spark spark python lib pyspark sql panda line batch file runner work spark spark python lib pyspark sql panda line file runner work spark spark python lib pyspark sql panda line raise handle exception exception occur traceback recent file runner work spark python pyspark sql test panda line assertionerror exception throw convert panda series match exception throw python worker stack trace traceback recent file runner work spark spark python lib pyspark sql panda line return file pyarrow line file pyarrow line file pyarrow line file pyarrow line arrowinvalid integer value range exception direct cause follow exception traceback recent file runner work spark spark python lib pyspark line main process file runner work spark spark python lib pyspark line process outfile file runner work spark spark python lib pyspark sql panda line traceback recent file runner work spark python pyspark sql test panda line assertionerror exception throw convert panda series match exception throw python worker stack trace traceback recent file runner work spark spark python lib pyspark sql panda line hyukjinkwon spark action return file pyarrow line file pyarrow line file pyarrow line file pyarrow line arrowinvalid float value truncate convert exception direct cause follow exception traceback recent file runner work spark spark python lib pyspark line main process file runner work spark spark python lib pyspark line process outfile file runner work spark spark python lib pyspark sql panda line return stream file runner work spark spark python lib pyspark sql panda line batch iterator file runner work spark spark python lib pyspark sql panda line batch file runner work spark spark python lib pyspark sql panda line file runner work spark spark python lib pyspark sql panda line raise ser code code fail pythonexception exception throw python worker stack trace traceback recent file runner work spark spark python lib pyspark line main process file runner work spark spark python lib pyspark line process outfile file runner work spark spark python lib pyspark sql panda line return stream file runner work spark spark python lib pyspark sql panda line batch iterator file runner work spark spark python lib pyspark sql panda line series iterator file runner work spark spark python lib pyspark line mapper result udfs file runner work spark spark python lib pyspark line result udfs file runner work spark spark python lib pyspark line file runner work spark spark python lib pyspark line wrapper return kwargs file runner work spark python pyspark sql test panda line longtype handle exception exception occur traceback recent file runner work spark python pyspark sql test connect line file runner work spark python pyspark sql test panda line division modulo zero assertionerror division modulo zero match exception throw python worker stack trace traceback recent file runner work spark spark python lib pyspark line main process file runner work spark spark python lib pyspark line process outfile file runner work spark spark python lib pyspark sql panda line return stream file runner work spark spark python lib pyspark sql panda line batch iterator file runner work spark spark python lib pyspark sql panda line series iterator file runner work spark spark python lib pyspark line mapper result udfs file runner work spark spark python lib pyspark line result udfs file runner work spark spark python lib pyspark line file runner work spark spark python lib pyspark line wrapper return kwargs file runner work spark python pyspark sql test panda line longtype code	['pull-request-available']	3	7	Resolved
13563827	SPARK	4739	log exception fail lookup python data sources		['pull-request-available']	4	7	Resolved
13559991	SPARK	4739	mockdf planonlytestfixture	dependency spark connect run test code run test executable code show error code file python pyspark panda test connect line import reusedconnecttestcase file python pyspark testing line class testcase pysparkerrortestutils file python pyspark testing line planonlytestfixture class nameerror dataframe define code actionable	['pull-request-available']	4	6	Resolved
13569416	SPARK	4739	skip schedule sparkr windows fork repository default	consistent schedule build	['pull-request-available']	4	6	Resolved
13597313	SPARK	4739	use late python dependencie python job	fail apparently different grpc version legitimate failure fix target test different dependency version target well test purpose	['pull-request-available']	3	7	Resolved
13581856	SPARK	4739	settable	downstream user implement	['pull-request-available']	3	4	Resolved
13559135	SPARK	4739	improve error message relate argument type cute rollup groupby pivot	code traceback recent file line file pyspark sql connect line cube raise pysparktypeerror pysparktypeerror argument cube column str get float code code help method cube module columnorname groupeddata method dataframe instance create multi dimensional cube current specify column allow aggregation perform versionadde versionchange code col	['pull-request-available']	4	4	Resolved
13174834	SPARK	4739	complex type binary type memory partition pruning work miss upper low bound case	example array low upper bound column batch null look wrongly filter datum code scala import import scala val dataframe arraycol array scala scala code	['correctness']	2	1	Resolved
13551815	SPARK	4739	remove workaround dateformatter add	drop jdk need workaround anymore	['pull-request-available']	3	7	Resolved
13551814	SPARK	4739	comment unused jdk relate dev run	code set env pull request build test title ghprbpulltitle test java code need anymore	['pull-request-available']	3	7	Resolved
13561098	SPARK	4739	fix output	code scala code	['pull-request-available']	4	1	Resolved
13551813	SPARK	4739	remove workaround jdk	drop jdk need workaround anymore	['pull-request-available']	3	7	Resolved
13581131	SPARK	4739	support interrupttag interruptall stream query	spark connect interrupt api interrupt streaming query support	['pull-request-available']	3	4	Resolved
13574955	SPARK	4739	add	add miss pypi package	['pull-request-available']	3	1	Resolved
13025234	SPARK	4739	test java unidoc build jenkins master builder	fix unidoc build java easy break great add build spark master builder jenkins easy identify pr break doc build	['jenkins']	3	6	Resolved
13558944	SPARK	4739	reenable releasesession test case		['pull-request-available']	3	7	Resolved
13588534	SPARK	4739	embed script level parse logic sparksubmitcommandbuilder	embed logic script jvm	['pull-request-available']	3	7	Resolved
13596102	SPARK	4739	pysaprk connect test pass optional dependency		['pull-request-available']	3	7	Resolved
13578848	SPARK	4739	fix python build		['pull-request-available']	3	6	Resolved
13551575	SPARK	4739	refine docstre count	refine docstring function count provide example groupby	['pull-request-available']	3	7	Resolved
13553214	SPARK	4739	fix import accord pyspark core		['pull-request-available']	3	4	Resolved
13580092	SPARK	4739	remove obsolete workflow	need anymore	['pull-request-available']	3	4	Resolved
13562042	SPARK	4739	support	stat pythondatasent pythondatareceive pythonnumrowsreceive	['pull-request-available']	4	7	Resolved
13560378	SPARK	4739	test invalid error class		['pull-request-available']	4	7	Resolved
13562050	SPARK	4739	pin bundler version	code requirement satisfied support ruby rubygems try instal gem install bundler bundler require ruby version current ruby version code	['pull-request-available']	3	4	Resolved
13585611	SPARK	4739	spark replace rdd read write api invocation dataframe read write api	spark replace rdd read write api invocation dataframe read write api motivation databrick runtime rdd read write api issue certain storage type require account key dataframe read write api work	['pull-request-available']	3	4	Resolved
13574216	SPARK	4739	separate pure python packaging	initial version	['pull-request-available']	3	7	Resolved
13568532	SPARK	4739	remove pin version torch python support	basically revert	['pull-request-available']	3	7	Resolved
13414942	SPARK	4739	use python standard string formatter sql api pyspark	similar aim add python string formatter support api	['release-notes']	3	4	Resolved
13375470	SPARK	4739	sql dataframereader unescapedquotehandling parameter misdocumente	unescapedquotehandling parameter dataframereader correctly document appear twice look like overwrite intend option view instance error occur useful query appear bug introduce	['starter']	3	20	Resolved
13279420	SPARK	4739	publicly document option	add new option appear document expect fact option intend user document add new documentation page option	['release-notes']	4	4	Resolved
13588345	SPARK	4739	update spark shell documentation spark connect	documentation update	['pull-request-available']	3	7	Resolved
13569120	SPARK	4739	upgrade python maven build	code error library load local opt gettext lib referenced runner hostedtoolcache bin reason try local opt gettext lib file volumes preboot cryptexes usr local opt gettext lib file local opt gettext lib file local lib file lib file dyld cache line abort trap ensurepip code	['pull-request-available']	3	7	Resolved
13551824	SPARK	4739	remove test classloader workaround sbt build	revert need anymore drop jdk	['pull-request-available']	4	7	Resolved
13579918	SPARK	4739	fix lint scala scalafmt detect properly	code mvn scalafmt format false true false connector connect common connector connect server connector connect client jvm code fail code info scalafmt result unformatted info detail info require formatting info format info format info format info format info format info format info format info format info format info format info format info format info format info format info format info format info format info format info format info format info format info format info format info format info format info format info format info format info format info format info format info format info format info format info format code output format change scalafmt version upgrade	['pull-request-available']	3	1	Resolved
13579001	SPARK	4739	fix nest array respect legacy conf inferarraytypefromfirstelement	code true array code infer integer array	['pull-request-available']	3	1	Resolved
13558575	SPARK	4739	proper dependency requirement message spark connect	code pyspark local code improve error message code userwarning fail initialize spark session initialize spark session traceback recent file line spark file sql line getorcreate import sparksession remotesparksession file sql connect line import sparkconnectclient channelbuilder file sql connect line import noqa file sql connect client line import modulenotfounderror module name google code code userwarning fail initialize spark session initialize spark session traceback recent file line spark file sql line getorcreate import sparksession remotesparksession file sql connect line import sparkconnectclient channelbuilder file sql connect line import noqa file sql connect client line import modulenotfounderror module name code	['pull-request-available']	3	4	Resolved
13551820	SPARK	4739	remove lang scala library add jdk workaround	add code lang scala library code jdk work	['pull-request-available']	4	7	Resolved
13553212	SPARK	4739	fix import accord		['pull-request-available']	3	4	Resolved
13562030	SPARK	4739	refactor python data source instance load	instance instead	['pull-request-available']	3	7	Resolved
13559994	SPARK	4739	split schedule python build	python build fail code spark spark python pyspark panda pandasapionsparkadvicewarne load datum driver memory result panda series expect small pandasapionsparkadvicewarning spark spark python pyspark testing futurewarning assertpandasonsparkequal remove spark use instead spark spark python pyspark panda pandasapionsparkadvicewarne load datum driver memory result panda dataframe expect small pandasapionsparkadvicewarning error statusco test failure log error run spark spark python run test pyspark panda connect executable receive return code error process complete exit code code suspect oom split build	['pull-request-available']	3	7	Resolved
13204256	SPARK	4739	remove disallow multiple spark context	multiple spark context discourage warn year ago cause arbitrary mysterious error case honestly know spark allow	['release-notes']	4	4	Resolved
13558315	SPARK	4739	restore documentation api	documentation mistakenly go exist	['pull-request-available']	3	1	Resolved
