id	project_name	assignee_id	processed_title	processed_description	processed_labels	priority_id	type_id	status_name
12724413	FLINK	8669	add documentation pojo expression key	java api documentation need extend reflect extension add basically expression key pojo object select public field pojo key name	['starter']	3	7	Resolved
13342678	FLINK	8669	rework standalone deployment documentation page	similar need update standalone deployment documentation page additionally need verify state documentation work	['pull-request-available']	3	7	Closed
13318752	FLINK	8669	update version aw support use default constructor webidentitytokencredentialsprovider	background flink kubernetes platform access aws service taskmanager jobmanager iam roles service accounts configure property use credential provider webidentitytokencredentialsprovider issue taskmanager jobmanager start complain webidentitytokencredentialsprovider public constructor container come solution currently credential class flink hadoop get aws java sdk core dependency flink base flink base version aws support default constructor webidentitytokencredentialsprovider provide aws version onward	['pull-request-available']	4	4	Closed
13492486	FLINK	8669	allow minicluster pluginmanager use metric reporter	currently minicluster metric reporter load plugin support null gets pass null pluginmanager think generally valuable allow pass pluginmanager minicluster open	['pull-request-available']	3	4	Closed
13286918	FLINK	8669	streaming bucketing end end test noclassdeffounderror	nightly cron job fail code run streaming bucketing end end test travis build apache flink flink end end test test script temp test flink dist directory travis build apache flink flink dist target snapshot bin snapshot set ssl internal jdk dynamic san dns travis job certificate add keystore certificate add keystore certificate reply instal keystore mac verify set ssl rest jdk dynamic san dns travis job certificate add keystore certificate add keystore certificate reply instal keystore mac verify mutual ssl auth false start cluster start standalonesession daemon host travis job start taskexecutor daemon host travis job wait dispatcher rest endpoint come wait dispatcher rest endpoint come wait dispatcher rest endpoint come wait dispatcher rest endpoint come wait dispatcher rest endpoint come dispatcher rest endpoint info taskexecutor run travis job start taskexecutor daemon host travis job info taskexecutor run travis job start taskexecutor daemon host travis job info taskexecutor run travis job start taskexecutor daemon host travis job number run task manager number run task manager number run task manager reach noclassdeffounderror org apache hadoop conf configuration method method cause classnotfoundexception configuration job run wait job complete checkpoint output receive potentially indicate stall build wrong build check detail adjust build configuration build terminate code	['test-stability']	4	1	Closed
13336345	FLINK	8669	invalid command flink end end test readme	apache flink tree master flink end end test refer flink end end test run pre commit file long exist	['pull-request-available']	4	1	Closed
12731999	FLINK	8669	material section project website	suggest add material section new project website update logo etc allow people material project flink addition think menu entry project source code unnecessary link github main page want rename github	['documentation', 'easyfix', 'starter']	4	4	Resolved
13299145	FLINK	8669	system space leave device misc profile free azure builder	build free azure builder fail code exception system space leave device system source system flushwritebuffer system flushtodisk system flushstream boolean flushencoder system diagnostic textwritertracelisten flush system diagnostics tracesource flush microsoft visualstudio services agent tracemanager dispose microsoft visualstudio services agent tracemanager dispose microsoft visualstudio services agent hostcontext dispose microsoft visualstudio services agent hostcontext dispose microsoft visualstudio services agent worker program args error report diagnostic log examine log detail vst system space leave device system source system flushwritebuffer system flushtodisk system flushstream boolean flushencoder system diagnostic textwritertracelisten flush microsoft visualstudio services agent hosttracelistener source traceeventtype eventtype microsoft visualstudio services agent hosttracelistener eventcache string source traceeventtype eventtype string message system diagnostics tracesource eventtype string message microsoft visualstudio services agent worker worker pipein string pipeout microsoft visualstudio services agent worker program context string args system space leave device system source system flushwritebuffer system flushtodisk system flushstream boolean flushencoder system diagnostic textwritertracelisten flush microsoft visualstudio services agent hosttracelistener source traceeventtype eventtype microsoft visualstudio services agent hosttracelistener eventcache string source traceeventtype eventtype string message system diagnostics tracesource eventtype string message microsoft visualstudio services agent trace exception microsoft visualstudio services agent worker program context string args job run agent azure pipelines run long maximum time minute information azure pipelines respond cancelation request code run	['pull-request-available']	3	1	Resolved
13367302	FLINK	8669	fail hang	mapohl fail exclusively able reproduce locally have defaultscheduler enable test infinite loop code flink info taskexecutor register task send final execution state fail jobmanager task source custom source sink unnamed flink debug sharedslot return logical slot shared slot flink debug sharedslot release share slot externally flink debug defaultdeclarativeslotpool free reserved slot flink debug sharedslot release shared slot flink debug adaptivescheduler transition state executing restart flink info executiongraph job flink streaming job switch state running cancelling flink info executiongraph source custom source sink unnamed switch run canceling flink info executiongraph source custom source sink unnamed switch run canceling flink info executiongraph source custom source sink unnamed switch run canceling flink debug taskexecutor find task stop execution flink debug taskexecutor find task stop execution flink debug taskexecutor find task stop execution flink info executiongraph source custom source sink unnamed switch cancel canceled flink debug executiongraph ignore transition vertex source custom source sink unnamed execution failed cancel flink debug sharedslot return logical slot shared slot flink debug sharedslot release share slot externally flink debug defaultdeclarativeslotpool free reserved slot flink debug sharedslot release shared slot flink debug adaptivescheduler run newresourcesavailable actual state restart resourceconsumer flink info executiongraph discard result produce task execution flink info executiongraph source custom source sink unnamed switch cancel canceled flink debug executiongraph ignore transition vertex source custom source sink unnamed execution failed cancel flink debug sharedslot return logical slot shared slot flink debug sharedslot release share slot externally flink debug defaultdeclarativeslotpool free reserved slot flink debug sharedslot release shared slot flink debug adaptivescheduler run newresourcesavailable actual state restart resourceconsumer flink info executiongraph discard result produce task execution flink info executiongraph source custom source sink unnamed switch cancel canceled flink debug executiongraph ignore transition vertex source custom source sink unnamed execution failed cancel flink debug sharedslot return logical slot shared slot flink debug sharedslot release share slot externally flink debug defaultdeclarativeslotpool free reserved slot flink debug sharedslot release shared slot flink debug adaptivescheduler run newresourcesavailable actual state restart resourceconsumer flink info executiongraph job flink streaming job switch state cancelling canceled flink debug executiongraph executiongraph reach terminal state canceled flink info checkpointcoordinator stop checkpoint coordinator job flink info executiongraph discard result produce task execution flink debug taskexecutor find task stop execution flink debug taskexecutor find task stop execution flink debug adaptivescheduler ignore schedule action expect state actual state flink debug defaultdeclarativeslotpool declare new resource requirement job require resource acquire resource flink debug taskexecutor find task stop execution flink debug adaptivescheduler transition state restarting waitingforresource flink debug taskexecutor find task stop execution flink debug taskexecutor find task stop execution sigint handler warn testsignalhandler received signal sigint shut request flink debug adaptivescheduler transition state waitingforresource creatingexecutiongraph flink debug taskexecutor find task stop execution jobmanager future info adaptivescheduler run initialization master job flink streaming job flink debug taskexecutor find task stop execution jobmanager future info adaptivescheduler successfully run initialization master jobmanager future debug adaptivescheduler add vertex job graph flink streaming job jobmanager future debug executiongraph attach topologically sort vertex exist job graph vertex intermediate result jobmanager future debug executiongraph connect executionjobvertex source custom source sink unnamed predecessor flink debug taskexecutor find task stop execution flink debug taskexecutor find task stop execution jobmanager future info defaultexecutiontopology build pipeline region jobmanager future debug adaptivescheduler successfully create execution graph job graph flink streaming job jobmanager future warn metricgroup collision group contain metric totalnumberofcheckpoint metric jobmanager flink streaming job flink debug executiongraph ignore transition vertex source custom source sink unnamed execution failed cancel jobmanager future warn metricgroup collision group contain metric numberofinprogresscheckpoint metric jobmanager flink streaming job jobmanager future warn metricgroup collision group contain metric numberofcompletedcheckpoint metric jobmanager flink streaming job jobmanager future warn metricgroup collision group contain metric numberoffailedcheckpoint metric jobmanager flink streaming job jobmanager future warn metricgroup collision group contain metric lastcheckpointrestoretimestamp metric jobmanager flink streaming job jobmanager future warn metricgroup collision group contain metric lastcheckpointsize metric jobmanager flink streaming job jobmanager future warn metricgroup collision group contain metric lastcheckpointduration metric jobmanager flink streaming job jobmanager future warn metricgroup collision group contain metric lastcheckpointprocesseddata metric jobmanager flink streaming job flink debug executiongraph ignore transition vertex source custom source sink unnamed execution failed cancel jobmanager future warn metricgroup collision group contain metric lastcheckpointpersisteddata metric jobmanager flink streaming job jobmanag future warn metricgroup collision group contain metric lastcheckpointexternalpath metric jobmanager flink streaming job jobmanag future info adaptivescheduler state backend configure default hashmap jobmanag future debug adaptivescheduler configuration storage set current session fall default checkpointstorage type user strongly encourage explicitly set configuration understand application checkpointe snapshot fault tolerance jobmanag future info adaptivescheduler checkpoint storage set jobmanager flink debug executiongraph ignore transition vertex source custom source sink unnamed execution failed cancel jobmanag future warn metricgroup collision group contain metric restartingtime metric jobmanager flink streaming job jobmanag future warn metricgroup collision group contain metric downtime metric jobmanager flink streaming job jobmanag future warn metricgroup collision group contain metric uptime metric jobmanager flink streaming job jobmanag future debug checkpointcoordinator status shared state registry job restore jobmanag future info checkpointcoordinator checkpoint find restore jobmanag future debug checkpointcoordinator reset master hook flink info executiongraph job flink streaming job switch state create running flink debug defaultallocatedslotpool reserve free slot allocation flink debug sharedslot allocate logical slot shared slot flink debug defaultallocatedslotpool reserve free slot allocation flink debug sharedslot allocate logical slot shared slot flink debug defaultallocatedslotpool reserve free slot allocation flink debug sharedslot allocate logical slot shared slot flink debug defaultallocatedslotpool reserve free slot allocation flink debug sharedslot allocate logical slot shared slot flink debug adaptivescheduler successfully reserve assign require slot executiongraph flink debug adaptivescheduler transition state creatingexecutiongraph executing flink info executiongraph source custom source sink unnamed switch created deploying flink info executiongraph deploy source custom source sink unnamed attempt attempt localhost allocation flink info executiongraph source custom source sink unnamed switch created deploying flink info executiongraph deploy source custom source sink unnamed attempt attempt localhost allocation flink info executiongraph source custom source sink unnamed switch created deploying flink info executiongraph deploy source custom source sink unnamed attempt attempt aedd localhost allocation flink info taskslottableimpl activate slot flink info taskslottableimpl activate slot flink info executiongraph source custom source sink unnamed switch created deploying flink info executiongraph deploy source custom source sink unnamed attempt attempt aedd localhost allocation flink debug taskexecutorlocalstatestoresmanager find exist local state store allocation flink debug taskexecutorlocalstatestoresmanager find exist local state store allocation flink info taskexecutor receive task source custom source sink unnamed deploy slot allocation flink info taskslottableimpl activate slot flink info taskexecutor receive task source custom source sink unnamed deploy slot allocation source custom source sink unnamed info task source custom source sink unnamed switch created deploying source custom source sink unnamed debug task create filesystem stream leak safety net task source custom source sink unnamed deploying flink debug taskexecutorlocalstatestoresmanager find exist local state store allocation source custom source sink unnamed info task source custom source sink unnamed switch created deploying source custom source sink unnamed debug task create filesystem stream leak safety net task source custom source sink unnamed deploying flink info taskslottableimpl activate slot transientblobcache shutdown hook info transientblobcache shut blob cache taskexecutorlocalstatestoresmanager shutdown hook info taskexecutorlocalstatestoresmanager shut taskexecutorlocalstatestoresmanager flink debug taskexecutorlocalstatestoresmanager find exist local state store allocation flink info taskexecutor receive task source custom source sink unnamed deploy slot allocation flink info taskexecutor receive task source custom source sink unnamed deploy slot allocation permanentblobcache shutdown hook info permanentblobcache shut blob cache source custom source sink unnamed info task source custom source sink unnamed switch created deploying source custom source sink unnamed info task loading jar file task source custom source sink unnamed deploying source custom source sink unnamed info task loading jar file task source custom source sink unnamed deploying source custom source sink unnamed debug task create filesystem stream leak safety net task source custom source sink unnamed deploying source custom source sink unnamed debug task get user code class loader task library cache manager take millisecond source custom source sink unnamed debug task get user code class loader task library cache manager take millisecond source custom source sink unnamed info task loading jar file task source custom source sink unnamed deploying source custom source sink unnamed debug task get user code class loader task library cache manager take millisecond source custom source sink unnamed info task register task network source custom source sink unnamed deploying source custom source sink unnamed info task register task network source custom source sink unnamed deploying source custom source sink unnamed info task register task network source custom source sink unnamed deploying source custom source sink unnamed info streamtask state backend configure default hashmap source custom source sink unnamed info streamtask state backend configure default hashmap source custom source sink unnamed info streamtask state backend configure default hashmap source custom source sink unnamed debug streamtask configuration storage set current session fall default checkpointstorage type user strongly encourage explicitly set configuration understand application checkpointe snapshot fault tolerance source custom source sink unnamed info streamtask checkpoint storage set jobmanager source custom source sink unnamed debug streamtask configuration storage set current session fall default checkpointstorage type user strongly encourage explicitly set configuration understand application checkpointe snapshot fault tolerance source custom source sink unnamed info streamtask checkpoint storage set jobmanager source custom source sink unnamed debug streamtask configuration storage set current session fall default checkpointstorage type user strongly encourage explicitly set configuration understand application checkpointe snapshot fault tolerance source custom source sink unnamed info task source custom source sink unnamed switch created deploying source custom source sink unnamed info streamtask checkpoint storage set jobmanager source custom source sink unnamed debug task create filesystem stream leak safety net task source custom source sink unnamed deploying source custom source sink unnamed info task loading jar file task source custom source sink unnamed deploying source custom source sink unnamed debug task get user code class loader task library cache manager take millisecond source custom source sink unnamed info task register task network source custom source sink unnamed deploying source custom source sink unnamed info streamtask state backend configure default hashmap source custom source sink unnamed debug streamtask configuration storage set current session fall default checkpointstorage type user strongly encourage explicitly set configuration understand application checkpointe snapshot fault tolerance source custom source sink unnamed info streamtask checkpoint storage set jobmanager filechannelmanagerimpl shutdown hook info filechannelmanagerimpl filechannelmanager remove spill file directory folder flink taskexecutorlocalstatestoresmanager shutdown hook info taskexecutorlocalstatestoresmanager shut taskexecutorlocalstatestoresmanager iomanagerasync shutdown hook debug iomanager shut manager iomanagerasync shutdown hook debug iomanager shut manager source custom source sink unnamed info task source custom source sink unnamed switch deploying running source custom source sink unnamed info task source custom source sink unnamed switch deploying running source custom source sink unnamed debug streamtask initialize source custom source sink unnamed source custom source sink unnamed debug streamtask initialize source custom source sink unnamed source custom source sink unnamed info task source custom source sink unnamed switch deploying running source custom source sink unnamed info task source custom source sink unnamed switch deploying running source custom source sink unnamed debug streamtask initialize source custom source sink unnamed source custom source sink unnamed debug streamtask initialize source custom source sink unnamed flink info executiongraph source custom source sink unnamed switch deploying running flink info executiongraph source custom source sink unnamed switch deploying running flink info executiongraph source custom source sink unnamed switch deploying running flink info executiongraph source custom source sink unnamed switch deploying running source custom source sink unnamed debug streamtask invoke source custom source sink unnamed source custom source sink unnamed debug streamtask invoke source custom source sink unnamed source custom source sink unnamed debug streamtask invoke source custom source sink unnamed source custom source sink unnamed debug backendrestorerprocedure create operator state backend state source custom source sink unnamed debug streamtask invoke source custom source sink unnamed source custom source sink unnamed debug backendrestorerprocedure create operator state backend state source custom source sink unnamed debug backendrestorerprocedure create operator state backend state source custom source sink unnamed debug backendrestorerprocedure create operator state backend state source custom source sink unnamed warn task source custom source sink unnamed switch running fail failure cause runtimeexception test error instance expect source custom source sink unnamed warn task source custom source sink unnamed switch running fail failure cause runtimeexception test error instance expect source custom source sink unnamed warn task source custom source sink unnamed switch running fail failure cause runtimeexception test error instance expect source custom source sink unnamed info task free task resource source custom source sink unnamed source custom source sink unnamed debug task release task source custom source sink unnamed network resource state failed source custom source sink unnamed info task free task resource source custom source sink unnamed source custom source sink unnamed info task free task resource source custom source sink unnamed source custom source sink unnamed debug task release task source custom source sink unnamed network resource state failed source custom source sink unnamed warn task source custom source sink unnamed switch running fail failure cause runtimeexception test error instance expect source custom source sink unnamed debug task release task source custom source sink unnamed network resource state failed source custom source sink unnamed info task free task resource source custom source sink unnamed source custom source sink unnamed debug task release task source custom source sink unnamed network resource state failed filecache shutdown hook info filecache remove file cache directory folder flink dist source custom source sink unnamed debug task ensure filesystem stream close task source custom source sink unnamed fail source custom source sink unnamed debug task ensure filesystem stream close task source custom source sink unnamed fail flink info taskexecutor register task send final execution state fail jobmanager task source custom source sink unnamed flink info taskexecutor register task send final execution state fail jobmanager task source custom source sink unnamed flink info executiongraph source custom source sink unnamed switch running failed localhost runtimeexception test error instance expect code	['pull-request-available', 'test-stability']	2	1	Closed
13468525	FLINK	8669	flink parquet compile mac rosetta	compile flink snapshot fail mac apple silicon rosetta translation layer automatically download file actually copy read error code error fail execute goal protobuf maven test compile default project flink parquet error occur invoke protoc error execute process run program rmetzger project flink flink format flink parquet target protoc plugin osx bad cpu type executable help code	['pull-request-available']	3	7	Closed
