id	project_name	assignee_id	processed_title	processed_description	processed_labels	priority_id	type_id	status_name
13335325	FLINK	10239	update deadlock break algorithm cover case	current deadlock breakup algorithm fail cover following case paste image go introduce new deadlock breakup algorithm cover	['pull-request-available']	3	7	Closed
13398489	FLINK	10239	internal server error quit select query sqlclient	release testing reveal internal server error report quit select statement sql client detail reproduce comment jira browse code warn collectresultfetcher exception occur fetch query result executionexception restclientexception internal server error flink flink flink flink flink sql cause restclientexception internal server error code	['pull-request-available']	3	1	Closed
13528332	FLINK	10239	introduce cdc sink table store	directly consume change flink cdc connector need special cdc sink flink table store	['pull-request-available']	3	7	Closed
13517803	FLINK	10239	table store hive catalog throw classnotfoundexception custom present	hive custom present conf create table store hive catalog flink follow exception throw code cause classnotfoundexception class defaultmetastorefilterhookimpl find shade shade shade table store hive snapshot table store hive snapshot method table store hive snapshot table store hive snapshot table store hive snapshot table store hive snapshot table store hive snapshot table store hive snapshot table store hive snapshot table store hive snapshot table store snapshot table store snapshot table store snapshot table store snapshot table api java table api java table api java sql code contain property name default value defaultmetastorefilterhookimpl hive package table store shade class loader find original class need remove relocation hive class	['pull-request-available']	3	1	Closed
13445089	FLINK	10239	table store throw nullpointerexception push notequal predicate column consist null	run follow flink sql reproduce issue code flink sql create table double path store info execute statement succeed flink sql insert value double double info submit sql update statement cluster info sql update statement successfully submit cluster job flink sql select error execute sql statement reason executionexception nullpointerexception code exception stack code cause nullpointerexception table store snapshot table store snapshot table store snapshot table store snapshot code	['pull-request-available']	3	1	Closed
13392326	FLINK	10239	add flink migrationversion	currently large migrationversion need new version add serializer compatibility test state work release manager	['pull-request-available']	3	4	Closed
13427126	FLINK	10239	implement projectabledecodingformat avro bulk format	currently bulkdecodingformat avro implement projectabledecodingformat reader read unused column need implement projectabledecodingformat optimize reading avro file	['pull-request-available']	3	4	Closed
13440133	FLINK	10239	fix table store connector throw classnotfoundexception rowdatapartitioncomputer	cause currently table store exclude file connector dependency shading follow code code exclude class package exclude class sub package correct excluding pattern code code change check test near future	['pull-request-available']	3	7	Closed
13513547	FLINK	10239	rename latest compact compact table store	discuss dev mailing thread go rename value table store specifically rename late compact rename compact user understand snapshot produce matter batch job streaming job	['pull-request-available']	3	4	Closed
13472200	FLINK	10239	throw exception intentionally new snapshot commit restore	currently snapshot commit notifycheckpointcomplete job fail successful checkpoint notifycheckpointcomplete snapshot commit job restart writer start need read late snapshot build late structure lsm tree step happen concurrently writer late snapshot fix problem throw exception intentionally new snapshot commit restore way job forcefully restart likely writer late snapshot	['pull-request-available']	3	4	Closed
13383835	FLINK	10239	nullpointerexception cast string literal date time	sql code java create table int score int address string time date timestamp connector datagen create table time date timestamp connector print insert select case null end case null end case null end code exception code java runtimeexception instantiate generate class runtimeexception instantiate generate class invocationtargetexception source morecause nullpointerexception source code	['pull-request-available']	3	1	Closed
13481412	FLINK	10239	introduce mergefunction compaction	need introduce special mergefunction produce changelog	['pull-request-available']	3	7	Closed
13305196	FLINK	10239	add specialized collecting iterator	add specialized collecting iterator need implement algorithm legacy planner datum structure like resettableexternalbuffer blink planner implement algorithm legacy planner legacy planner use current collect implementation	['pull-request-available']	3	7	Closed
13424812	FLINK	10239	fail azure	code java jan error time elapse failure jan assertionerror value different actual running jan jan jan jan jan jan method jan jan jan jan jan jan jan jan jan jan jan jan jan jan jan jan jan jan jan jan jan jan jan jan jan jan jan jan jan jan jan jan jan jan jan jan jan jan jan jan jan jan jan jan jan jan jan jan jan jan jan jan jan jan jan jan jan jan jan jan code	['pull-request-available', 'stale-assigned', 'test-stability']	2	1	Closed
13437402	FLINK	10239	use instead file table property manage table	currently want set compression method file store need use well use directly like filesystem connector	['pull-request-available']	3	7	Closed
13305837	FLINK	10239	fail expect	code info run streamnetworkbroadcastthroughputbenchmarktest timeoutexception interruptedexception error test run failure error skip time elapse method info run streamnetworkthroughputbenchmarktest code	['test-stability']	1	1	Resolved
13369265	FLINK	10239	resulttype generatedexpression stringcallgen compatible definition flinksqloperatortable	add follow test case tableenvironmentitcase reproduce bug code scala def mytest unit table null code exception stack code codegenexception mismatch function argument data type actual argument type string code return type inference substr flinksqloperatortable result type generatedexpression	['pull-request-available']	3	1	Closed
13368368	FLINK	10239	pushfilterintotablesourcescanrule fail deal null	add follow test case pushfilterintotablesourcescanruletest reproduce bug code java public void mytest string ddl create table mtable string string connector value bound true mview select end select mview null code exception stack code validationexception datum type string null support null value code bug relate commit commit hotfix relate issue add notnull return value	['pull-request-available']	3	1	Closed
13335390	FLINK	10239	optimize parallelism calculate hivetablesource check file number	current implementation calculate parallelism directly use number split createinputsplit costly read datum source file especially table partition number file large hive table maintain number file table obvious number split number file try fetch number file cost number file exceed maximum parallelism directly use maximum parallelism call createinputsplit significant optimization current flink tpcds benchmark create table file partition optimization improve performance benchmark	['pull-request-available']	3	4	Closed
13429298	FLINK	10239	introduce well expire strategy	add snapshot file manifest add table snapshot well expire strategy instead scan file snapshot	['pull-request-available']	3	7	Closed
13448416	FLINK	10239	searchargumenttopredicateconverter handle partial filter	example slect accord reasonable path condition able push table store currently throw unsupportedoperationexception result push	['pull-request-available']	3	7	Closed
13406713	FLINK	10239	compare random string throw nullpointerexception	add follow test case calcitcase reproduce issue code scala def mytest unit val datum utc val dataid val ddl table mytable ltz connector value datum dataid bound true ltz uuid mytable code exception stack code runtimeexception fail fetch result method cause ioexception fail fetch job execution result cause executionexception jobexecutionexception job execution fail cause jobexecutionexception job execution fail cause jobexception recovery suppress norestartbackofftimestrategy method scala scala scala scala scala cause nullpointerexception source code generate follow code cast string code java timezone code return null accept primitive long value cause issue need check result totimestamp	['pull-request-available']	3	1	Closed
13388934	FLINK	10239	collect sink operator factory support configure max byte batch	current collectsinkoperatorfactory support max byte batch configuration production user provide ability configurable	['pull-request-available']	3	4	Closed
13379544	FLINK	10239	lookup join condition fail filter record	add follow test case tableenvironmentitcase reproduce bug code scala def mytest unit val val table varchar timestamp proc proctime connector value datum bound true val val table varchar timestamp connector value datum bound true val join varchar varchar code result code abc code obviously incorrect generate operator follow code java public class extend tablefunctioncollector genericrowdata new joinedrowdata new joinedrowdata private static final timezone timezone shanghai private timestampdata timestamp private timestampdata localtimestamp private int date private final binarystringdata public reference throw exception public void configuration parameter throw exception public void record throw exception rowdata rowdata getinput rowdata rowdata record binarystringdata boolean timestampdata boolean timestampdata boolean boolean binarystringdata boolean binarystringdata boolean binarystringdata boolean boolean null binarystringdata binarystringdata null boolean timestampdata null boolean binarystringdata null false binarystringdata date null null false null binarystringdata null binarystringdata false null null null null null public void close throw exception code member variable date initialize use cause bug forget use generate collect method	['pull-request-available']	3	1	Closed
13427379	FLINK	10239	support projection pushdown key value sst file reader	projection pushdown optimization source optimization avoid read useless column improve performance	['pull-request-available']	3	7	Closed
13409604	FLINK	10239	batch sql file sink forget close output stream	try write large avro file hdfs discover display file size hdfs extremely small copy file local yield correct size create flink job read avro file hdfs job finish output record file size flink get hdfs small file size output format create finish bulkwriter accord java doc bulk writer close output stream leave framework	['pull-request-available']	3	1	Closed
13438552	FLINK	10239	disable rolling file write level sst file	level sst file sorted run write rolling file decrease number sorted run	['pull-request-available']	3	7	Closed
13447860	FLINK	10239	refactor recordreader recorditerator table store generic type	like introduce tableread class file store user class provide iterator rowdata instead need iterator keyvalue rowdata	['pull-request-available']	3	7	Closed
13360062	FLINK	10269	add sqlexpression table common	introduce dedicated function definition use sql expression table api usability clear maven module design well add dedicated sqlexpression table common allow catalog specify unresolved sql expression dependency table api furthermore add sql specific function new schema class	['pull-request-available']	3	7	Closed
13321301	FLINK	10269	add	statementset solve use case pure sql table api pipeline currently way create statementset datastream api job propose follow api code streamstatementset return stream specific set streamstatementset extend statementset attache optimize statement set datastream pipeline attachasdatastream unit code example look like code streamexecutionenvironment env streamtableenvironment tenv tenv continue operation code	['pull-request-available', 'usability']	3	7	Closed
13288321	FLINK	10269	preserve nullability nested type	currently flinktypefactory preserve nullability attribute handle nested type table function return row null loose information row build function collect result mismatch mention	['pull-request-available']	3	7	Closed
13409386	FLINK	10269	validate partition column resolvedcatalogtable	currently partition column validate exist schema	['pull-request-available']	3	7	Closed
13269870	FLINK	10269	relax structured type constraint	mention order allow type extraction structured type register catalog need relax structured type concept inline anonymous structured type identify object identifi catalog fully qualified implementation class order support case class immutable type relax constraint enforce default constructor alternative have constructor fully assign field parameter name type code generation implementation create instance default constructor relatively easy	['pull-request-available']	3	7	Closed
13373881	FLINK	10269	type mismatch declare column	follow schema resolve currently code datatypes code lead code watermark output type different input time file type code	['pull-request-available']	2	7	Closed
13381722	FLINK	10269	add possibility build function specializedfunction	miss piece avoid code generation develop build function core operation cast equals etc use code generation build function able use core operation need generate code possible build function specializedfunction	['auto-unassigned', 'pull-request-available']	3	7	Closed
13195911	FLINK	10269	interval join produce wrong result type scala api	stream scala case class typeinformation fall generictype process function result bad performance union datastream union method datastream type check equality example code java object test def unit val env val ordera beer diaper rubber val orderb new pen new rubber new beer val orderc order order override def order right order ctx order unit case class long product string int code exception code java exception thread main illegalargumentexception union stream different type generictype long product string integer	['pull-request-available']	3	1	Closed
13366301	FLINK	10269	create utility create datastream api datatype schema	define follow behavior support utility type system table api powerful datastream api use typeextraction enable replace generictypeinfo meaningful datatype support immutable pojo structuredtype instead rawtype lists arraytypes instead rawtypes perform verification base available typeinformation type coercion explicitly specify schema datastream happen datastream datatypes bigint user specify desire data type explicitly expect correctness allow define attribute streamrecord timestamp exist watermark allow reorder field similar functionality expression base api consistent api user place definition time attribute arbitrary location exist field time attribute way regular ddl watermark assign implicitly	['pull-request-available']	3	7	Closed
13363717	FLINK	10269	datatypeextractor extract wrong field order	following test reproduce problem code java emit result public static class extend tablefunction private static final long serialversionuid public void str collect str str str str str str code code scala def unit val util streamtestutil long val function new function val sql mytable lateral code code output plan bigint integer integer integer integer integer integer mytable source code note problem legacy register function becuase use typeinformation problem create function syntax use typeinference note problem exist late master branch think problem lay line order field name alphabetical	['pull-request-available']	2	1	Closed
13171689	FLINK	10269	end end test sql client unified source sink format	resolve add end end test sql client test perform follow step json datum kafka submit execute insert statement read kafka connector json format etl write kafka avro format validate avro datum	['pull-request-available']	1	7	Resolved
13142467	FLINK	10269	add support insert sql client	current design sql client embed mode support long running query useful simple job express single sql statement submit sql statement store file long run query	['pull-request-available']	3	7	Resolved
13244959	FLINK	10269	allow switch planner sql client	resolve enable switch planner sql client execution property kind new feature postpone feature freeze relocation create merge conflict	['pull-request-available']	1	2	Closed
13432422	FLINK	10269	support new type inference scala table api table function	currently distinguish old new type inference scala table api function register catalog inline support	['pull-request-available']	3	7	Closed
13001945	FLINK	10269	clearly define sql operator table	currently use set support operation actually support functioncatalog return operator test document	['starter']	3	4	Resolved
13089438	FLINK	10269	merge flink project flink core	issue remove flink module merge test flink core flink runtime ensure possibility pass explicit type information datastream api fallback tycho compiler approach hacky work anymore commit remove reference doc quickstart	['pull-request-available']	3	4	Resolved
13391864	FLINK	10269	use layered configuration executor planner	configuration story flink consistent moment ideally layered approach pipeline executor datastream api table api store configuration add global configuration request big change like avoid point instead partially follow approach add access config low layer access global configuration plan require access property store	['pull-request-available']	3	7	Closed
13367033	FLINK	10269	add new	implement accord	['pull-request-available']	3	7	Closed
13003279	FLINK	10269	fix flaky test	test non deterministic code scalarfunctionstest scalarfunctionstest time elapse sec character set collate null expect source code	['starter']	3	1	Resolved
13425423	FLINK	10269	introduce contextresolvedfunction similar contextresolvedtable	planner currently unable distinguish temporary function persist function problem similar contextresolvedtable try solve	['pull-request-available']	3	7	Closed
13309174	FLINK	10269	update method	update method provide good summary string particular fix follow issue changeflag accord row describe entry changelog visible row insert delete update change indicate nested row old implementation visible nest row exist miss start end boundary indicate positioned row name row accord visible row operate base position base field mode indicate nested array map list old implementation array map list represent wrong formatting programming language use space comma	['pull-request-available']	3	7	Closed
13234504	FLINK	10269	remove row interval type	row interval type add additional complexity prevent sql query support count window regular bigint type sufficient represent count	['pull-request-available']	3	7	Closed
13299144	FLINK	10269	improve fieldsdatatype	problem fieldsdatatype method getfielddatatype order field store logical type couple location iterate name logical type datatypes code final rowtype rowtype rowtype final string fieldname final typeinformation fieldtypes code	['pull-request-available']	4	7	Closed
13367784	FLINK	10269	add supportssourcewatermark ability interface	add dedicated function watermark definition currently generated watermark strategy invalid exception throw function implementation integrate concept deeply interface instead need implement expression analyze utility source propose follow interface code supportssourcewatermark void applysourcewatermark code	['pull-request-available']	3	7	Closed
13391510	FLINK	10269	simplify blinkexecutorfactory stack	blinkexecutorfactory stack use old table factory stack need anymore old planner remove simplify logic	['pull-request-available']	3	7	Closed
13080698	FLINK	10269	add support tableapi	detail	['starter']	3	7	Resolved
13398213	FLINK	10269	let sinkupsertmaterializer emit instead	currently sinkupsertmaterializer able emit emit result changelog incorrect strictly speak valid treat similar change downstream operator	['pull-request-available']	1	1	Closed
12719957	FLINK	10269	hadoop compatibility refactore extend support new java api	require stratosphere stratosphere jira browse description find stratosphere stratosphere jira browse complete hadoop compatibility package refactore adapt new java api record specific class separate record package throw later new word count example show use input output format test case use word count example test implementation import github url create twalthr label enhancement java api user satisfaction milestone release unplanned create thu cest state open	['github-import']	3	4	Closed
13322483	FLINK	10269	update documentation user define aggregate function	documentation need update function support new type inference	['pull-request-available']	3	7	Closed
13441362	FLINK	10269	sql cast bigint return wrong result	code sql flink sql select cast tinyint cast smallint cast int cast bigint cast float cast double error execute sql statement reason numberformatexception input string invalid character find source code set cast behavior legacy get null result code flink sql set cast behaviour enable info session property set flink sql select cast tinyint cast smallint cast int cast bigint cast float cast double error execute sql statement reason tableexception column null null value write set job configuration null suppress exception drop record silently source source code result postgres code select cast int cast bigint cast float row code	['pull-request-available']	2	1	Closed
13389854	FLINK	10269	expose consistent globaldataexchangemode	table api make globaldataexchangemode configurable mode table api batch mode streamgraph configure datastream api batch mode vote unify exchange mode api complex sql pipeline behave identical streamtableenvironment tableenvironment feedback get far safe option run pipeline successfully limited resource quote previous history like default value pipeline find time insufficient resource deployment hang typical use batch job small resource run large parallelism batch job granularity failover relate datum process single task small datum fast fault tolerance scenario run small resource large parallelism little little slowly run later switch default value blocking find well block shuffle implementation slow run speed test tpc take time quote quote problem change default value datastream batch mode think well default option quote case configurable datastream api user specific table api option obsolete	['pull-request-available']	3	7	Closed
13303064	FLINK	10269	support inline structured type	location code base support structured type runtime treat row type final work need support structured type stack start inline structured type register structured type catalog cover different issue inline structured type prerequisite enable aggregate function	['pull-request-available']	3	7	Closed
13318705	FLINK	10269	fix scala code example udf type inference annotation	scala code example udf type inference project flink flink doc dev table function inference correct example follow functionhint annotation code scala input output code need change code scala input new output new code	['pull-request-available']	3	1	Closed
13296431	FLINK	10269	add ability interface table source sink	add ability interface mention supportswatermarkpushdown supportsprojectionpushdown exist interface	['pull-request-available']	3	7	Closed
13283964	FLINK	10269	fully support raw type api	currently table api expose way create raw type datatypefactory reason raw type need resolve later stage similar user define type need resolve catalog api change introduction abstractdatatype high type resolve unresolved data type introduction class name datatypes unresolved type helper class method construct unresolved type type safe need well support blink planner	['pull-request-available']	3	7	Closed
13377609	FLINK	10269	drop usage batchtableenvironment old planner python	major cleanup python module drop support batchtableenvironment old planner remove usage dataset batchtableenvironment legacy planner executionenvironment note batch processing possible unified	['pull-request-available']	3	7	Closed
13317406	FLINK	10269	invalid error message overloaded method parameter	function overload evaluation method argument name lead confusing error message type miss code cause validationexception invalid input argument expect signature test catalog common frame omit cause validationexception invalid input argument common frame omit code	['pull-request-available']	3	7	Closed
12979735	FLINK	10269	fieldparsers support string	order parse csv file new table api convert row row object support null value filedparser implementation support emptry string set parser state parseerrorstate example floatparser doubleparser respect constraint	['csvparser', 'table-api']	3	1	Resolved
13382142	FLINK	10269	remove blink suffix table module	order reduce confusion blink remove term blink follow module code flink table planner blink flink table runtime blink flink table uber blink code discussion perform refactoring old module content new module link old module case sure git history	['pull-request-available']	3	7	Closed
13175092	FLINK	10269	support custom flinkkafkapartitioner kafka table sink factory	currently kafka table sink factory support custom flinkkafkapartitioner need use case	['pull-request-available']	3	7	Resolved
13216882	FLINK	10269	create blink sql planner runtime module	mention create separate module perform blink sql merge issue create table planner blink table runtime blink module	['pull-request-available']	3	2	Closed
