id	project_name	assignee_id	processed_title	processed_description	processed_labels	priority_id	type_id	status_name
13294350	FLINK	8669	run kubernetes test fail invalid name minikube	test run log output code java run run kubernetes test vst flink end end test test script temp test flink dist directory vst flink dist target snapshot bin snapshot flink dist directory vst flink dist target snapshot bin snapshot docker version build docker compose version build instal minikube total receive xferd average speed time time time current dload upload total spend leave speed local cluster name minikube fix run minikube start starting minikube minikube ubuntu driver base user configuration driver require conntrack instal kubernetes version local cluster name minikube fix run minikube start local cluster name minikube fix run minikube start command fail retrying local cluster name minikube fix run minikube start starting minikube minikube ubuntu driver base user configuration driver require conntrack instal kubernetes version local cluster name minikube fix run minikube start local cluster name minikube fix run minikube start command fail retrying local cluster name minikube fix run minikube start starting minikube minikube ubuntu driver base user configuration driver require conntrack instal kubernetes version local cluster name minikube fix run minikube start local cluster name minikube fix run minikube start command fail retrying command fail time start minikube aborting connection server refuse specify right host port connection server refuse specify right host port connection server refuse specify right host port stopping minikube local cluster name minikube fix run minikube start command sudo minikube stop fail retrying local cluster name minikube fix run minikube start command sudo minikube stop fail retrying local cluster name minikube fix run minikube start command sudo minikube stop fail retrying command sudo minikube stop fail time stop minikube aborting fail test script contain error checking error error log file check exception exception log file checking non file grep vst flink dist target snapshot bin snapshot file directory non file fail run kubernetes test fail minute second test exit exit code stat vst flink dist target snapshot bin snapshot file directory publish log debug log artifact compress build artifact tar remove lead member name vst flink end end test vst flink end end test artifact flink taskexecutor daemon stop host standalonesession daemon stop host exit code run	['pull-request-available', 'test-stability']	3	1	Closed
13423033	FLINK	8669	build linux image apache flink	building flink image linux trivial support upstream docker image support frocksdb build image locally easily possible docker buildx feature build system official docker image likely support arm arch improvement allow support development testing apple base system arm architecture cloud provider aws graviton	['pull-request-available']	3	4	Closed
13356470	FLINK	8669	add declarativescheduler waitingforresource state	subtask add declarative scheduler add waitingforresource state flink include test wait resource required resource declare scheduler wait requirement fulfil set resource stabilise	['pull-request-available']	3	7	Closed
13503396	FLINK	8669	bump maven shade plugin	propose relocate dependency flink kubernete possible problem maven shade plugin mvn install work need mvn clean install solve issue release maven shade plugin upgrade shade plugin solve problem unblock relocation	['pull-request-available']	3	11500	Closed
13243397	FLINK	8669	add note pubsub connector documentation beta status	review decide add note documentation page connector consider beta community	['pull-request-available']	3	4	Resolved
13337848	FLINK	8669	local recovery sticky scheduling end end test fail report error properly	instance code java error fail execute goal maven surefire test end end test project flink end end test hbase test failure error error refer vst flink end end test flink end end test hbase target surefire report individual test result error refer dump file exist error fork terminate properly say goodbye crash call error command vst flink end end test flink end end test hbase target lib jvm hotspot jre bin java vst flink end end test flink end end test hbase target surefire vst flink end end test flink end end test hbase target surefire error error occur start fork check output log error process exit code error crash test error sqlclienthbaseitcase error surefirebooterforkexception fork terminate properly say goodbye crash call error command vst flink end end test flink end end test hbase target lib jvm hotspot jre bin java vst flink end end test flink end end test hbase target surefire vst flink end end test flink end end test hbase target surefire error error occur start fork check output log error process exit code error crash test error sqlclienthbaseitcase error error error error error error error error error error error error error error error error error error error error method error error error error error error error error help code	['pull-request-available', 'test-stability']	1	4	Closed
12719785	FLINK	8669	replace avro serialization kryo	import github url create rmetzger label java api milestone release unplanned create tue mar cet state open	['github-import']	2	1	Resolved
13290270	FLINK	8669	improve test failure error reporting	purpose change improve error reporting test log upload test fail bash test fail coredump dumpstream etc include log upload logs scan exception exception checking turn	['pull-request-available']	3	4	Resolved
13333949	FLINK	8669	time	log exception code error zookeeperleaderelectionitcase time elapse error timeoutexception condition meet give timeout method code	['test-stability']	2	1	Closed
13296031	FLINK	8669	build fail corrupt stdout directly write	kafka gelly library noformat warning corrupt stdout directly write native stream fork jvm faq web page dump file flink connector flink connector kafka target surefire noformat follow noformat error error error error error error error error error error error error error error error error error error method error error error error error error error error help error error stack trace error run maven switch error run maven switch enable debug log error error information error possible solution read follow article error help noformat	['pull-request-available', 'test-stability']	2	1	Closed
13328411	FLINK	8669	find log prohibit string	code error find file flink yarn test target flink yarn test fifo flink yarn test fifo logdir prohibit string exception start excerpt code	['pull-request-available', 'test-stability']	3	1	Closed
13357936	FLINK	8669	add test statewithexecutiongraph	ticket add dedicated test statewithexecutiongraph class follow	['pull-request-available']	3	7	Closed
13289338	FLINK	8669	maven central connection timeout azure pipeline	test stage invoke maven additional dependency download fail build ticket google mirror possible example fail test failure look like code error fail execute goal project flink hadoop resolve dependency project flink hadoop snapshot transfer artifact flink shaded central request org apache flink flink shade flink shade central fail connection reset help code	['pull-request-available']	2	1	Closed
12720081	FLINK	8669	webclient message	submit kmeans job web client get follow exception error occur invoke program program plan fetch program silently swallow control flow exception programinvocationexception program plan fetch program silently swallow control flow exception problem main method return print message intuitive look log import github url create rmetzger label milestone release create tue jun cest state open	['github-import']	3	1	Resolved
13376787	FLINK	8669	adaptive scheduler cancel restart job	job state restarting issue cancel rpc follow exception relevant trace code cause illegalstateexception assume run execution graph code trace report code resthandlerexception job cancellation fail cancellation fail cause flinkexception cancellation fail scala scala scala scala scala cause illegalstateexception assume run execution graph method code sorry poor stack trace formatting coped stack trace cancel state assume transition executing executiongraph running opinion job cancellable time example job stick restart loop cancel way retrie exhaust	['pull-request-available']	2	1	Closed
13336879	FLINK	8669	upgrade new	user report dependency vulnerability affect try upgrade version new	['pull-request-available']	2	4	Closed
13318752	FLINK	8669	update version aw support use default constructor webidentitytokencredentialsprovider	background flink kubernetes platform access aws service taskmanager jobmanager iam roles service accounts configure property use credential provider webidentitytokencredentialsprovider issue taskmanager jobmanager start complain webidentitytokencredentialsprovider public constructor container come solution currently credential class flink hadoop get aws java sdk core dependency flink base flink base version aws support default constructor webidentitytokencredentialsprovider provide aws version onward	['pull-request-available']	4	4	Closed
13329990	FLINK	8669	flink dist build locally new maven version	flink dist fail non maven version ban dependency message code info maven enforcer enforce ban unsafe snakeyaml flink warning rule banneddependencie fail message find ban dependency snakeyaml use mvn dependency tree locate source ban dependency info info reactor summary flink snapshot error fail execute goal maven enforcer enforce ban unsafe snakeyaml project flink enforcer rule fail look specific message explain rule fail help code	['pull-request-available']	1	1	Closed
13240859	FLINK	8669	yarnsessioncapacityscheduleritcase fail non prohibit exception	yarnsessioncapacityscheduleritcase fail non prohibit exception code java info executiongraph reduce switch running failed flinkexception long allocate job flinkexception long allocate job scala scala scala scala info executiongraph job flink java job fri jun utc switch state running failing flinkexception long allocate job	['test-stability']	2	1	Closed
13335303	FLINK	8669	test fail azure emulatedpubsubsourcet	link code java error test run failure error skip time elapse method error emulatedpubsubsinkt time elapse expect port map expect error run nullpointer error run checkpubsubemulatortest nullpointer info error emulatedfulltopologytest error run emulatedfulltopologytest expect port map expect error run missing pubsubhelper error run emulatedfulltopologytest nullpointer info error emulatedpubsubsinkt error run emulatedpubsubsinktest expect port map expect error run nullpointer error run emulatedpubsubsinktest nullpointer info error emulatedpubsubsourcet error run emulatedpubsubsourcetest expect port map expect error run nullpointer error run emulatedpubsubsourcetest nullpointer info info code	['pull-request-available', 'test-stability']	1	1	Closed
13356475	FLINK	8669	add declarativescheduler fail state	subtask add declarative scheduler add fail state flink include test fail unrecoverable fault occur scheduler stop executiongraph cancel	['pull-request-available']	3	7	Closed
12719627	FLINK	8669	integrate runtime metric statistic	engine collect job execution statistic accumulator total number input output record operator histogram input output ratio udf call histogram number input record reduce cogroup udf histogram number output record udf histogram time spend udf call number local remote byte read accumulator stat available user execution webfrontend purpose feature ease performance debugging parallel job detect datum skew possible deactivate activate gathering statistic import github url create fhueske label enhancement runtime user satisfaction create tue feb cet state open	['github-import']	3	2	Closed
13468525	FLINK	8669	flink parquet compile mac rosetta	compile flink snapshot fail mac apple silicon rosetta translation layer automatically download file actually copy read error code error fail execute goal protobuf maven test compile default project flink parquet error occur invoke protoc error execute process run program rmetzger project flink flink format flink parquet target protoc plugin osx bad cpu type executable help code	['pull-request-available']	3	7	Closed
13337178	FLINK	8669	automatically run basic notice file check	release manually validate notice file accord wiki page time consume task ensure module deploy shaded dependency maven central properly document dependency notice file like add tool flink check shade dependency mention notice file need perform manual check tool catch common severe difficult find problem	['pull-request-available']	3	4	Closed
13309727	FLINK	8669	yarn session log contain config set	flink print code set hadoop conf set code run flink yarn set hadoop classpath return configuration directory need anymore suggest revisit log message behavior misleading	['pull-request-available', 'usability']	3	4	Closed
13076769	FLINK	8669	elasticsearch release artifact publish maven central	release artifact elasticsearch connector publish maven central elasticsearch require java minimum release need build java	['flink-rel-1.3.1-blockers']	1	1	Resolved
13344781	FLINK	8669	flink docker properly prune tag	output contain tag	['pull-request-available']	2	1	Closed
13310147	FLINK	8669	checkpubsubemulatortest fail azure	code java main info checkpubsubemulatort wait receive essage main info checkpubsubemulatort timeout shutdown timeoutexception time wait innerservice stopping reach terminal state current state main info gcloudemulatormanager error test run failure error skip time elapse code	['pull-request-available']	2	1	Closed
13346419	FLINK	8669	miss docker image release	image flink miss docker hub result kubernetes deployment documentation example work	['pull-request-available']	1	1	Closed
13343324	FLINK	8669	broken link	remove page link page dev project dev batch hadoop connector hive	['pull-request-available']	2	1	Closed
13307739	FLINK	8669	test native integration	test flink native integration session mode application mode custom flink image custom configuration log property	['pull-request-available', 'release-testing']	2	7	Closed
13310438	FLINK	8669	avro confluent schema registry nightly end end test unstable kafka cluster start second	code run avro confluent schema registry nightly end end test vst flink end end test test script temp test flink dist directory vst flink dist target snapshot bin snapshot downloading kafka total receive xferd average speed time time time current dload upload total spend leave speed downloading confluent total receive xferd average speed time time time current dload upload total spend leave speed waiting broker waiting broker waiting broker waiting broker wait broker waiting broker wait broker waiting broker wait broker wait broker waiting broker waiting broker wait broker wait broker wait broker waiting broker wait broker wait broker waiting broker wait broker wait broker waiting broker waiting broker wait broker wait broker wait broker waiting broker wait broker waiting broker waiting broker waiting broker wait broker waiting broker waiting broker waiting broker waiting broker waiting broker wait broker waiting broker waiting broker wait broker waiting broker wait broker wait broker wait broker waiting broker waiting broker wait broker waiting broker wait broker waiting broker wait broker waiting broker waiting broker waiting broker waiting broker wait broker waiting broker kafka cluster start second print kafka log code lot log output analyze	['pull-request-available', 'test-stability']	3	1	Closed
13533001	FLINK	8669	azure warning space leave device	run warning code loaded image confluentinc loaded image testcontainer applylayer exit status stdout stderr write lib module space leave device exit code finish restore docker image code	['build-stability', 'pull-request-available']	3	1	Closed
13293813	FLINK	8669	java profile set hadoop switch azure	context azure setup appear equivalent java profile set hadoop switch hadoop result sqlclientkafkaitcase run quote	['pull-request-available']	3	4	Resolved
12986476	FLINK	8669	clifrontendyarnaddressconfigurationtest pick wrong address travis	code expect code build personal branch happen master	['test-stability']	3	1	Resolved
13287779	FLINK	8669	execute end end test azp	ensure execute end end test azp sure test reference split reference run nightly test script sure java test execute	['pull-request-available']	3	7	Resolved
13300458	FLINK	8669	mvn exit exit code library test job	apache flink apache maven report build success exit code code info flink state processor api success info info build success info info total time min info finish info final memory info warning requested profile hadoop activate exist mvn exit exit code try kill watchdog code	['test-stability']	2	1	Resolved
13292119	FLINK	8669	streaming bucketing end end test output hash mismatch	output mismatch failure report ticket code number produce value truncating bucket truncating bucket truncating bucket truncating bucket truncating bucket truncating bucket truncating bucket truncating bucket number produce value cancelling job cancel job waiting job reach terminal state cancel job reach terminal state cancel job cancel time verify fail bucketing sink output hash mismatch got expect head hexdump actual stopping taskexecutor daemon pid host stopping standalonesession daemon pid host stopping taskexecutor daemon pid host skipping taskexecutor daemon pid run anymore skip taskexecutor daemon pid run anymore skipping taskexecutor daemon pid run anymore stop taskexecutor daemon pid host stop taskexecutor daemon pid host fail test script contain error checking log skip fail streaming bucketing end end test fail minute second test exit exit code code	['pull-request-available', 'test-stability']	1	1	Resolved
13255281	FLINK	8669	maven instruction cover shade special case	build flink maven extra care take ensure shading work expect dependency graph immutable result downstream module like flink dist unaltered set dependency bundle module regardless bundle result dependency bundle multiple time original relocated version instruction build flink maven project flink flink docs master flinkdev shading correctly point flink dist build separately filesystem rely flink hadoop shaded affect	['pull-request-available']	3	4	Closed
13293736	FLINK	8669	hang	logs code java main runnable thread state runnable method lock object lock appinputstream source source lock lock inputstreamreader lock inputstreamreader method thread runnable code	['pull-request-available', 'test-stability']	2	1	Closed
13288852	FLINK	8669	disable jdk docker test azp	build log jni error occur check installation try exception thread main unsupportedclassversionerror org apache flink client cli clifrontend compile recent version java runtime class file version version java runtime recognize class file version method method run job fail code	['pull-request-available']	3	1	Resolved
13387573	FLINK	8669	compile flink macos chip	flink currently compile macos silicon true recent version master problem potentially easy fix instal node separately update relevant use new version node get error deprecate feature support new node surface easy resolve success complex dependency protobuf long term objective use contribute flink help issue willing modification submit change pull request shepherd release compilation macos priority look virtual machine solution instead feedback appreciate thank osama	['pull-request-available']	4	1	Closed
13394871	FLINK	8742	hide configuration api doc	feature upcoming release hide related config option like checkpointingoptions api check python scala api documentation	['pull-request-available']	2	7	Closed
13413442	FLINK	8742	add changelogbackend documentation	currently changelog backend hide user documentation wise feature ready follow need document general description page configuration page statechangelogoption fsstatechangelogoption uploader metric page	['pull-request-available']	3	7	Resolved
13399887	FLINK	8742	boundedsourceitcase hang azure		['test-stability']	3	1	Closed
13436935	FLINK	8742	notify checkpointstrategy checkpoint completion abortion	notification incremental snapshot strategy replace state handle placeholder	['pull-request-available', 'stale-assigned']	3	7	In Progress
13427582	FLINK	8742	changelog non deterministic recovery priorityqueue state	currently log separate operation specify element poll recovery record poll replay deterministic order element equal priorityis specify example timerheapinternaltimer compare timestamp equal result polling timer queue wrong order drop timer fire timer fail materialization enable heap state backend memory base implementation propose solution replace poll remove operation base equality	['pull-request-available']	3	1	Resolved
13479477	FLINK	8742	fix log defaultcompletedcheckpointstore		['pull-request-available']	4	4	Resolved
13525410	FLINK	8742	partiallyfinishedsourcesitcase hang checkpoint fail	build run timeout base stacktrace report cause apache flink apache code main wait condition thread state sleep method source code apache flink apache code main wait condition thread state sleep method method code sound odd base code analysis unlikely cause issue min timeout related code apache flink blob flink test src test java org apache flink test checkpointe util find responsible past concurrent test cause issue investigation lose time timeout reveal adaptivescheduleritcase take finish build apache flink apache code feb error pick feb info run adaptivescheduleritcase feb info test run failure error skip time elapse adaptivescheduleritcase code	['pull-request-available', 'test-stability']	3	1	Resolved
13348970	FLINK	8742	update signature	remove unused postcleanup argument add javadoc checkpointscleaner	['pull-request-available']	4	4	Resolved
13306013	FLINK	8742	memory threshold ignore channel state	config parameter threshold ignore channel state cause subtask file checkpoint regardless size channel state subtask cause slow cleanup delay checkpoint problem call flush actually flush datum disk javadoc complete flush mean datum necessarily persistent datum persistence assume call close sync possible solution flush lead data loss wrapping stream change behavior wrap fscheckpointstateoutputstream prevent flush	['pull-request-available']	2	1	Closed
13426956	FLINK	8742	changelog illegalargumentexception throw	code illegalargumentexception	['pull-request-available']	3	1	Resolved
13360271	FLINK	8742	add local recovery support adaptive scheduler	local recovery mean failure able use state taskmanager instead load distribute storage mean scheduler need know state locate schedule task accordingly adaptive scheduler currently respect location state failure require loading state distribute storage add feature allow enable local recovery sticky scheduling end end test adaptive scheduler	['auto-deprioritized-major', 'auto-deprioritized-minor', 'auto-unassigned', 'pull-request-available']	3	4	Resolved
13305181	FLINK	8742	subsume checkpoint channel state mode	channel state handle underlie stream create discard delete reference state handle	['pull-request-available']	2	1	Closed
13311386	FLINK	8742	test crash exit code	code java warning requested profile skip webui build activate exist error fail execute goal maven surefire test integration test project flink connector test failure error error refer flink connector flink connector target surefire report individual test result error refer dump file exist error executionexception fork terminate properly say goodbye crash call error command flink connector flink connector target lib jvm openjdk jre bin java flink connector flink connector target surefire flink connector flink connector target surefire error error occur start fork check output log error process exit code error crash test error error surefirebooterforkexception executionexception fork terminate properly say goodbye crash call error command flink connector flink connector target lib jvm openjdk jre bin java flink connector flink connector target surefire flink connector flink connector target surefire error error occur start fork check output log error process exit code error crash test error error error error error error error error error error error error error error error error error error error error error error method error error error error error error error error cause surefirebooterforkexception fork terminate properly say goodbye crash call error command flink connector flink connector target lib jvm openjdk jre bin java flink connector flink connector target surefire flink connector flink connector target surefire error error occur start fork check output log error process exit code error crash test error error error error error error error error error error help error error stack trace error run maven switch error run maven switch enable debug log error error information error possible solution read follow article error help error error correct problem resume build command error mvn flink connector mvn exit exit code code environment issue start	['pull-request-available', 'test-stability']	1	1	Closed
13373051	FLINK	8742	channel state iterator access concurrently proper synchronization	channelstatewriter add input output datum write dedicated thread datum pass closeableiterator case call task thread lead double release buffer	['pull-request-available']	2	1	Closed
13362862	FLINK	8742	incremental snapshot heap base state backend	umbrella ticket	['auto-deprioritized-major', 'auto-unassigned', 'stale-assigned']	3	2	Open
13336925	FLINK	8742	fail nullpointerexception	code error partitionrequestclientfactoryt time elapse code	['pull-request-available', 'test-stability']	3	1	Resolved
