id	project_name	assignee_id	processed_title	processed_description	processed_labels	priority_id	type_id	status_name
13196125	FLINK	10066	connection leak partition discovery disabled open throw exception	scenario reproduce issue partition discovery disable open method throw exception broker ssl authorization deny request scenario run method execute result call cause connection leak kafkaconsumer initialize close cause outage bring kafka cluster high parallelism job get restart failure loop	['pull-request-available']	3	1	Resolved
13379458	FLINK	10066	breaking highavailabilityservices interface add new method	introduce new method interface method default implementation currently break change flink allow implement custom service interface suggest add default implementation method	['pull-request-available']	2	1	Closed
13425117	FLINK	10066	kuberneteshighavailabilityrecoverfromsavepointitcase testrecoverfromsavepoint fail azure	code java jan info run kuberneteshighavailabilityrecoverfromsavepointitcase jan error test run failure error skip time elapse failure kuberneteshighavailabilityrecoverfromsavepointitcase jan error time elapse error jan timeoutexception jan jan jan jan method jan jan jan jan jan jan jan jan jan jan jan jan jan jan jan jan jan jan jan jan jan jan jan jan jan jan jan jan jan jan jan jan jan jan jan jan jan jan jan jan jan jan jan jan jan jan jan jan jan info jan info result jan info jan error error jan error timeout jan info jan error test run failure error skip code	['pull-request-available', 'test-stability']	2	1	Closed
13259527	FLINK	10066	introduce	suggest extend dispatcherrunner interface return shut future idea shut future gets complete runner intend shut owner	['pull-request-available']	4	4	Closed
13254104	FLINK	10066	yarnpriorityschedulingitcase fail hadoop	yarnpriorityschedulingitcase early exit beforeclass run hadoop version low afterclass method yarntestbase handle case fail npe code error yarnpriorityschedulingitcase error run assumptionviolated priority scheduling error run yarnpriorityschedulingitcase nullpointer code	['test-stability']	2	1	Resolved
13396341	FLINK	10066	fail azure	code aug error test run failure error skip time elapse aug aug aug aug method aug aug aug aug aug aug aug aug aug aug aug aug aug code	['pull-request-available', 'test-stability']	3	1	Closed
13195631	FLINK	10066	cogroupconnectedcomponentsitcase deadlocke travis	cogroupconnectedcomponentsitcase deadlock travis look iteration gets stick wait get proper notification indicate bug iteration implementation relate	['pull-request-available', 'test-stability']	1	1	Closed
13139093	FLINK	10066	clusterentrypoint shut non blocking	clusterentrypoint shut method non blocking way use common fork join pool shutdownandterminate cluster entrypoint dispatcher terminate	['flip-6']	3	4	Closed
13137173	FLINK	10066	add minidispatcher job mode	order properly support job mode need minidispatcher start pre initialize jobgraph launch single jobmanagerrunner job job complete minidispatcher run detached mode minidispatcher terminate	['flip-6']	3	2	Closed
13259516	FLINK	10066	pass ioexecutor abstractdispatcherresourcemanagercomponentfactory	clusterentrypoint start ioexecutor executor dispatcherresourcemanagercomponent give dispatcherresourcemanagercomponentfactory order prepare component use ioexecutor suggest pass ioexecutor dispatcherresourcemanagercomponentfactory	['pull-request-available']	4	4	Closed
13178303	FLINK	10066	use executorthreadfactory instead defaultthreadfactory restserver client	instead defaultthreadfactory use executorthreadfactory use fatalexitexceptionhandler default uncaught exception handler guard uncaught exception simply terminate jvm	['pull-request-available']	3	4	Closed
13259895	FLINK	10066	extract jobgraphwriter jobgraphstore	order follow isp suggest extract jobgraphwriter interface jobgraphstore background future dispatcher need recover job anymore know recovery related method jobgraphstore instead method need know putjobgraph removejobgraph releasejobgraph	['pull-request-available']	4	4	Closed
13528327	FLINK	10239	support copy filestoretable late schema	capture schema change cdc sink flink table store able use late schema time require copy late schema create late schema	['pull-request-available']	3	7	Closed
13431423	FLINK	10239	allow manifestfile write list manifestfilemeta multiple file	currently produce single file matter large give manifestfilemeta list batch job likely produce lot change list long need allow produce multiple file effective merging filtering	['pull-request-available']	3	7	Closed
13437402	FLINK	10239	use instead file table property manage table	currently want set compression method file store need use well use directly like filesystem connector	['pull-request-available']	3	7	Closed
13481412	FLINK	10239	introduce mergefunction compaction	need introduce special mergefunction produce changelog	['pull-request-available']	3	7	Closed
13438057	FLINK	10239	reuse fileformat instead decodingformat encodingformat ensure thread safety	testing table store face follow warning message code memorymanagerimpl owner thread expect local committer task thread get task thread code orcbulkwriterfactory thread safe keep writeroption class member create writer writeroption object thread safe reuse fileformat instead ensure thread safety	['pull-request-available']	3	7	Closed
13486027	FLINK	10239	extract changelog file	currently changelog file store extra file datafilemeta compaction changelog introduce add extra file statistic different correspond merge tree file need extract changelog file	['pull-request-available']	3	7	Closed
13424812	FLINK	10239	fail azure	code java jan error time elapse failure jan assertionerror value different actual running jan jan jan jan jan jan method jan jan jan jan jan jan jan jan jan jan jan jan jan jan jan jan jan jan jan jan jan jan jan jan jan jan jan jan jan jan jan jan jan jan jan jan jan jan jan jan jan jan jan jan jan jan jan jan jan jan jan jan jan jan jan jan jan jan jan jan code	['pull-request-available', 'stale-assigned', 'test-stability']	2	1	Closed
13449759	FLINK	10239	refactor flink connector table store filestoretable	prepare filestoretable rowdata reading writing time refactor flink connector table store filestoretable	['pull-request-available']	3	7	Closed
13473986	FLINK	10239	add tez execution engine test table store hive connector	table store hive connector suppose support tez engine current test run need add tez test	['pull-request-available']	3	4	Closed
13505880	FLINK	10239	allow filestorescan read incremental change overwrite snapshot table store	currently abstractfilestorescan read incremental change append snapshot overwrite snapshot user append new record table change discover compact job source overwritten partition compact	['pull-request-available']	3	7	Closed
13370364	FLINK	10239	pushfilterintotablesourcescanrule fail deal expression	add follow test case pushfilterintolegacytablesourcescanruletest reproduce bug pushfilterintotablesourcescanruletest extend class test code scala def mytest unit mytable alice bob dave code exception stack code assertionerror character set character set character set method code filter calcite require condition flat simplify condition construct filter	['pull-request-available']	3	1	Closed
13432794	FLINK	10239	apply key value filter filestorescanimpl	implement sst file statistic apply key value filter filestorescanimpl	['pull-request-available']	3	7	Closed
13450194	FLINK	10239	check hive ddl table store schema create table	table store schema support use schema ground truth hive ddl check	['pull-request-available']	3	7	Closed
13517439	FLINK	10239	table store hive catalog support specify custom hive metastore client	currently hive metastore client class hard code hivecatalog user want specify custom hive metastore client read write hive compliant storage	['pull-request-available']	3	4	Closed
13450116	FLINK	10239	optimize lot parameter	current treatment expand multiple equal join perform particularly parameter need introduce predicate handle case separately	['pull-request-available']	3	4	Closed
13528326	FLINK	10239	support migrating state different instance tablewriteimpl abstractfilestorewrite	currently table tablewrite flink table store fixed schema consume schema change flink table store cdc sink ability change schema streaming job require pause store state tablewrite create tablewrite new schema recover state new tablewrite	['pull-request-available']	3	7	Closed
13409604	FLINK	10239	batch sql file sink forget close output stream	try write large avro file hdfs discover display file size hdfs extremely small copy file local yield correct size create flink job read avro file hdfs job finish output record file size flink get hdfs small file size output format create finish bulkwriter accord java doc bulk writer close output stream leave framework	['pull-request-available']	3	1	Closed
13492154	FLINK	10239	preaggregationitcase lastvalueaggregation preaggregationitcase lastnonnullvalueaggregation unstable	preaggregationitcase lastvalueaggregation preaggregationitcase lastnonnullvalueaggregation need sure order input datum determine default parallelism filestoretableitcase order input datum change test	['pull-request-available']	3	1	Closed
13493693	FLINK	10239	table store sink continuously fail try add file add snapshot commit slow	table store sink continuously fail try add file add snapshot commit slow bug method find identifi remove identifier map different snapshot identifier example append commit follow compact commit identifier need use set check identifier snapshot commit fast identifi check job restart happen snapshot committing slow multiple identifier check identifier mistakenly keep	['pull-request-available']	3	1	Closed
13438557	FLINK	10239	exit face expired file	currently possible check expired snapshot throw filenotexists exception face expired file exit	['pull-request-available']	3	7	Closed
13495169	FLINK	10239	explicitly throw exception table store sink unaligned checkpoint enable	currently table store sink support unaligned checkpoint exception explicitly throw throw exception user change configuration	['pull-request-available']	3	4	Closed
13482491	FLINK	10239	avoid manifest corruption incorrect checkpoint recovery	job run checkpoint user recover old checkpoint checkpoint sink current fts cause manifest corruption duplicate file commit avoid corruption storage robust	['pull-request-available']	1	1	Closed
13385745	FLINK	10239	clean old implementation code splitting	step clean old implementation code splitting	['pull-request-available']	3	7	Closed
13389284	FLINK	10239	javacodesplitt split code projectioncodegenerator	javacodesplitt split method return value add comment javacodesplitter projectioncodegenerator need method return value	['pull-request-available']	3	7	Closed
13429298	FLINK	10239	introduce well expire strategy	add snapshot file manifest add table snapshot well expire strategy instead scan file snapshot	['pull-request-available']	3	7	Closed
13398489	FLINK	10239	internal server error quit select query sqlclient	release testing reveal internal server error report quit select statement sql client detail reproduce comment jira browse code warn collectresultfetcher exception occur fetch query result executionexception restclientexception internal server error flink flink flink flink flink sql cause restclientexception internal server error code	['pull-request-available']	3	1	Closed
13515681	FLINK	10239	add documentation write table store	table store support write need add documentation	['pull-request-available']	3	4	Closed
13528340	FLINK	10239	remove schemaid constructor filestorecommitimpl manifestfile table store	schema change ctas streaming job schema snapshot manifest file change remove constructor calculate real fly	['pull-request-available']	3	7	Closed
13383835	FLINK	10239	nullpointerexception cast string literal date time	sql code java create table int score int address string time date timestamp connector datagen create table time date timestamp connector print insert select case null end case null end case null end code exception code java runtimeexception instantiate generate class runtimeexception instantiate generate class invocationtargetexception source morecause nullpointerexception source code	['pull-request-available']	3	1	Closed
13244889	FLINK	10239	add test longhashpartition stringcallgen equalisercodegenerator	add test longhashpartition stringcallgen equalisercodegenerator	['pull-request-available', 'stale-assigned']	10200	11500	Reopened
13268491	FLINK	10239	add api fetch datum client	currently unconvinient user fetch datum flink job specify sink expclitly fetch datum sink api write hdfs sink read datum hdfs time user want datum process want necessary flink provide api purpose apis helpful	['pull-request-available', 'usability']	3	2	Resolved
13494210	FLINK	10239	old record overwrite new record table store snapshot committing slow	consider following scenario snapshot commit slow writer produce record checkpoint produce record checkpoint close produce record checkpoint reopen read late sequence number disk snapshot checkpoint commit sequence number read small scenario record checkpoint overwrite record checkpoint large sequence number	['pull-request-available']	3	1	Closed
13338948	FLINK	10239	consider datastreamscanprovider	consider sourceprovider datastreamscanprovider provide datastream sourcetransformation chainable source need consideration	['pull-request-available']	3	1	Closed
13406713	FLINK	10239	compare random string throw nullpointerexception	add follow test case calcitcase reproduce issue code scala def mytest unit val datum utc val dataid val ddl table mytable ltz connector value datum dataid bound true ltz uuid mytable code exception stack code runtimeexception fail fetch result method cause ioexception fail fetch job execution result cause executionexception jobexecutionexception job execution fail cause jobexecutionexception job execution fail cause jobexception recovery suppress norestartbackofftimestrategy method scala scala scala scala scala cause nullpointerexception source code generate follow code cast string code java timezone code return null accept primitive long value cause issue need check result totimestamp	['pull-request-available']	3	1	Closed
13368505	FLINK	10239	pushfilterintolegacytablesourcescanrule fail deal interval type	add follow test case pushfilterintolegacytablesourcescanruletest reproduce bug code scala def testwithinterval unit val schema tableschema datatypes string datatypes string val data schema mtable isbounde true datum mtable code exception stack code validationexception datum type interval null conversion class duration support value literal class bigdecimal method code deal interval type	['pull-request-available']	3	1	Closed
13471993	FLINK	10239	lsm tree structure incorrect multiple job commit bucket	currently filestorecommitimpl check conflict check file go delete compaction consider job commit lsm tree time compaction conflict detect delete level file produce level file key range file overlap correct lsm tree structure	['pull-request-available']	1	1	Closed
13509819	FLINK	10239	change table property key add default startup mode table store	introduce time travel reading table store batch job reading mode similar timestamp startup mode streaming job timestamp streaming job consume incremental datum history datum support startup mode batch streaming job batch job timestamp startup mode produce record snapshot specify timestamp stream job behavior change previously order use timestamp startup mode user specify millis little inconvenient introduce default startup mode behavior base execution environment configuration way use timestamp startup mode user specify milli	['pull-request-available']	3	4	Closed
13296755	FLINK	10239	improve handling unexpected input	bashjavautil return multiple line result avoid bashjavautil twice format check extractexecutionparam line incorrect instead code bash echo error unexpected result echo error line bashjavautil output expect execution result follow prefix echo output exit code code bash tail code	['pull-request-available']	3	4	Closed
13522413	FLINK	10239	table store hive catalog throw classnotfoundexception validwriteidlist certain environment	table store hive catalog throw classnotfoundexception validwriteidlist certain environment need package hive storage api dependency	['pull-request-available']	3	1	Closed
13337822	FLINK	10239	apply joinderivenullfilterrule join reorder	joinderivenullfilterrule filter null join key prevent datum skew join currently rule apply join reorder join reorder join key input change need apply rule	['pull-request-available']	3	4	Closed
13318621	FLINK	10239	release newly allocate segment throw exception	following code code java list newbucketsegments new try int numallocatedsegment require numallocatedsegment throw new memoryallocationexception int neednumfromfreesegment require int end neednumfromfreesegment end catch memoryallocationexception allocate page page require reservednumbuffer throw new eofexception code newly allocate memory segment temporarily store newbucketsegment give hash table memoryallocationexception happen segment return memory pool cause follow exception stack trace code runtimeexception memoryallocationexception allocate page table snapshot table snapshot table snapshot source snapshot snapshot snapshot snapshot snapshot snapshot snapshot snapshot snapshot flink snapshot flink snapshot suppress runtimeexception return memory clean page table snapshot table snapshot table snapshot source table snapshot snapshot snapshot snapshot snapshot flink snapshot flink snapshot cause memoryallocationexception allocate page snapshot table snapshot cause memoryreservationexception allocate byte byte remain snapshot snapshot snapshot table snapshot code return segment memory pool throw exception	['pull-request-available']	3	1	Closed
13505885	FLINK	10239	introduce compactfilestoresource compact job table store	ticket create compactfilestoresource flink source separate compact job behavior source sketch follow batch compact job source produce record contain partition bucket current table stream compact job source produce record contain modify partition bucket snapshot source monitor newly create snapshot	['pull-request-available']	3	7	Closed
13430382	FLINK	10239	add statistic collect sst file	currently field statistic collect sst file statistic filter operation well performance format like orc record statistic file header special format need read directly file need collect statistic hand	['pull-request-available']	3	7	Closed
13427379	FLINK	10239	support projection pushdown key value sst file reader	projection pushdown optimization source optimization avoid read useless column improve performance	['pull-request-available']	3	7	Closed
13245744	FLINK	10239	add test complex datum format	currently test guard complex datum format example nested row generic array generic map	['pull-request-available']	4	4	Resolved
13472200	FLINK	10239	throw exception intentionally new snapshot commit restore	currently snapshot commit notifycheckpointcomplete job fail successful checkpoint notifycheckpointcomplete snapshot commit job restart writer start need read late snapshot build late structure lsm tree step happen concurrently writer late snapshot fix problem throw exception intentionally new snapshot commit restore way job forcefully restart likely writer late snapshot	['pull-request-available']	3	4	Closed
13336872	FLINK	10239	return number row large	return number row large suggest introduce treat small large input different way small input use precise large input copy old approximated implementation temporary solution fix revert commit	['pull-request-available']	3	1	Closed
13254315	FLINK	10239	provide api convert flink table java list blink planner	nice convert flink table java list datum manipulation client execution flink job flink planner convert flink table dataset use blink planner api edit currently unconvinient user fetch datum flink job specify sink expclitly fetch datum sink api write hdfs sink read datum hdfs time user want datum process want necessary flink provide api purpose apis helpful	['pull-request-available']	3	4	Closed
13444550	FLINK	10239	implement filter pushdown tablestorehivestoragehandler	filter pushdown critical optimization source decrease number record read hive provide hivestoragepredicatehandler interface purpose need implement interface tablestorehivestoragehandler	['pull-request-available']	3	7	Closed
13245743	FLINK	10239	fix serializer snapshot recovery basearray basemap serializer	basearray basemap serializer element key value serializer store config snapshot restore basearray basemap serializer snapshot element key value serializer incorrect situation happen user use custom kryo serializer element key value serializer	['pull-request-available']	3	1	Resolved
13447860	FLINK	10239	refactor recordreader recorditerator table store generic type	like introduce tableread class file store user class provide iterator rowdata instead need iterator keyvalue rowdata	['pull-request-available']	3	7	Closed
13505879	FLINK	10239	modify compact interface tablewrite filestorewrite support normal compaction table store	currently compact interface tablewrite filestorewrite trigger compaction separate compact job perform compaction perform normal compaction like current table store sink need modify compact interface tablewrite filestorewrite support normal compaction	['pull-request-available']	3	7	Closed
13393002	FLINK	10239	select varbinary int compile	run sql select varbinary int error code runtimeexception instantiate generate class method cause flinkruntimeexception invalidprogramexception table program compile bug file issue cause uncheckedexecutionexception invalidprogramexception table program compile bug file issue cause invalidprogramexception table program compile bug file issue cause compileexception line column applicable constructor method find actual parameter byte messagedigest candidate public static binarystringdata binarystringdata string throw nosuchalgorithmexception public static binarystringdata binarystringdata messagedigest code	['pull-request-available']	3	1	Closed
13369265	FLINK	10239	resulttype generatedexpression stringcallgen compatible definition flinksqloperatortable	add follow test case tableenvironmentitcase reproduce bug code scala def mytest unit table null code exception stack code codegenexception mismatch function argument data type actual argument type string code return type inference substr flinksqloperatortable result type generatedexpression	['pull-request-available']	3	1	Closed
13381823	FLINK	10239	timestampadd type throw codegenexception	add follow test case calcitcase reproduce issue code scala def mytest unit seq code exception stack code codegenexception incompatible type expression result type false false null timestampdata long timestampdata null type null result type null code return timestamp type time unit write timestamp add function correct return type	['auto-unassigned', 'pull-request-available']	3	1	Closed
13505886	FLINK	10239	refactor storecompactoperator accept record contain partition bucket table store	ticket refactor storecompactoperator accept record contain partition bucket table store old alter table compact disable ticket restriction	['pull-request-available']	3	7	Closed
13305988	FLINK	10239	collectresultfetcher fail eofexception aggregatereducegroupingitcase	code error aggregatereducegroupingitcase time elapse error runtimeexception fail fetch result method cause eofexception code	['pull-request-available', 'test-stability']	1	1	Closed
13515484	FLINK	10239	fix unsupportedfilesystemschemeexception write table store oss engine	currently write table store table oss engine example spark follow exception occur code warn tasksetmanager lose task stage tid executor runtimeexception fail find late snapshot cause unsupportedfilesystemschemeexception find file system implementation scheme oss scheme directly support flink follow flink oss hadoop ensure plugin reside subfolder plugin directory information want use hadoop file system scheme add scheme configuration fallback filesystem list supported file system code	['pull-request-available']	3	1	Closed
13361926	FLINK	10239	flink sql csv file input job hang	extension actually get job stick cancellation following sql client configure sql client default run parallelism execute follow statement code create table airport airport string city string state country latitude double null longitude double null primary key enforced connector filesystem path kaggle flight delay format csv comment true parse error true literal create table flight year month day tinyint airline smallint month day smallint int month day smallint smallint smallint smallint distance smallint smallint smallint diverted boolean cancelled boolean smallint smallint smallint smallint smallint connector filesystem path kaggle flight delay flight format csv literal select airport state select airport state count order count desc rownum flight airport group airport state rownum code result show cli quit result view job stuck cancelling tms shut task react cancel signal appear log code warn task task source airport airport state airport state react cancel signal second stick method method error taskexecutor task exit gracefully second flinkruntimeexception task exit gracefully second flink error taskmanagerrunner fatal error occur execute taskmanager shut flinkruntimeexception task exit gracefully second flink code	['auto-deprioritized-major', 'pull-request-available']	4	1	Closed
13392326	FLINK	10239	add flink migrationversion	currently large migrationversion need new version add serializer compatibility test state work release manager	['pull-request-available']	3	4	Closed
