id	project_name	assignee_id	processed_title	processed_description	processed_labels	priority_id	type_id	status_name
13312940	FLINK	5351	jdbcfulltest fail compile	master code info error compilation error info error flink connector flink connector jdbc src test java org apache flink connector jdbc internal find symbol symbol variable location variable type object error flink connector flink connector jdbc src test java org apache flink connector jdbc internal incompatible type infer functional interface descriptor jdbcbatchingoutputformat statementexecutorfactory info error info info info reactor summary info info force shade success info flink success info flink annotation success info flink test util parent success info flink test util junit success info flink metric success info flink metric core success info flink core success info flink java success info flink queryable state success info flink queryable state client java success info flink filesystem success info flink hadoop success info flink runtime success min info flink scala success info flink mapr success info flink filesystem flink hadoop shaded success info flink base success info flink hadoop success info flink presto success info flink swift hadoop success info flink oss hadoop success info flink azure hadoop success info flink optimizer success info flink streaming java success info flink client success info flink test util success info flink runtime web success min info flink example success info flink example batch success info flink connector success info flink hadoop compatibility success info flink state backend success info flink statebackend rocksdb success info flink test success info flink streaming scala success info flink hcatalog success info flink table success info flink table common success info flink table api java success info flink table api java bridge success info flink table api scala success info flink table api scala bridge success info flink sql parser success info flink library success info flink cep success info flink table planner success min info flink sql parser hive success info flink table runtime blink success info flink table planner blink success min info flink metric jmx success info flink format success info flink json success info flink connector kafka base success info flink avro success info flink csv success info flink connector success info flink connector success info flink connector elasticsearch base success info flink connector success info flink connector success info flink connector success info flink connector hbase success info flink hadoop bulk success info flink orc success info flink orc nohive success info flink parquet success info flink connector hive success info flink connector jdbc failure info flink connector rabbitmq skipped info flink connector twitter skipped info flink connector nifi skipped info flink connector cassandra skipped info flink connector filesystem skipped info flink connector kafka skipped info flink connector gcp pubsub skipped info flink connector kinesis skipped info flink sql connector skipped info flink connector base skipped info flink sql connector skipped info flink sql connector skipped info flink sql connector skipped info flink sql connector kafka skipped info flink sql connector skipped info flink sql connector skipped info flink sql connector skipped info flink sql connector skipped info flink avro confluent registry skipped info flink sequence file skipped info flink compress skipped info flink sql orc skipped info flink sql parquet skipped info flink example streaming skipped info flink example table skipped info flink example build helper skipped info flink example streaming twitter skipped info flink example streaming state machine skipped info flink example stream gcp pubsub skipped info flink container skipped info flink queryable state runtime skipped info flink meso skipped info flink kubernete skipped info flink yarn skipped info flink gelly skipped info flink gelly scala skipped info flink gelly example skipped info flink external resource skipped info flink external resource gpu skipped info flink metric dropwizard skipped info flink metric graphite skipped info flink metric influxdb skipped info flink metric prometheus skipped info flink metric statsd skipped info flink metric datadog skipped info flink metric skipped info flink cep scala skipped info flink table uber skipped info flink table uber blink skipped info flink python skipped info flink sql client skipped info flink state processor api skipped info flink parent skipped info flink api skipped info flink lib skipped info flink uber skipped info flink scala shell skipped info flink dist skipped info flink yarn test skipped info flink end end test skipped info flink cli test skipped info flink parent child classloade test program skipped info flink parent child classloade test lib package skipped info flink dataset allround test skipped info flink dataset fine grain recovery test skipped info flink datastream allround test skipped info flink batch sql test skipped info flink stream sql test skipped info flink bucketing sink test skipped info flink distribute cache blob skipped info flink high parallelism iteration test skipped info flink stream stateful job upgrade test skipped info flink queryable state test skipped info flink local recovery allocation test skipped info flink test skipped info flink test skipped info flink quickstart skipped info flink quickstart java skipped info flink quickstart scala skipped info flink quickstart test skipped info flink confluent schema registry skipped info flink stream state ttl test skipped info flink sql client test skipped info flink streaming file sink test skipped info flink state evolution test skipped info flink rocksdb state memory control test skipped info flink end end test common skipped info flink metric availability test skipped info flink metric reporter prometheus test skipped info flink heavy deployment stress test skipped info flink connector gcp pubsub emulator test skipped info flink streaming kafka test base skipped info flink streaming kafka test skipped info flink streaming test skipped info flink streaming test skipped info flink plugin test skipped info dummy skipped info dummy skipped info flink tpch test skipped info flink streaming kinesis test skipped info flink test skipped info flink end end test common kafka skipped info flink tpcd test skipped info flink netty shuffle memory control test skipped info flink python test skipped info flink statebackend heap spillable skipped info flink contrib skipped info flink connector wikiedit skipped info flink test skipped info flink doc skipped info flink walkthrough skipped info flink walkthrough common skipped info flink walkthrough table java skipped info flink walkthrough table scala skipped info flink walkthrough datastream java skipped info flink walkthrough datastream scala skipped info info build failure info info total time min info finish info final memory info error fail execute goal maven compiler testcompile default testcompile project flink connector compilation failure compilation failure error flink connector flink connector jdbc src test java org apache flink connector jdbc internal find symbol error symbol variable error location variable type object error flink connector flink connector jdbc src test java org apache flink connector jdbc internal incompatible type infer functional interface descriptor jdbcbatchingoutputformat statementexecutorfactory error help error error stack trace error run maven switch error run maven switch enable debug log error error information error possible solution read follow article error help error error correct problem resume build command error mvn flink connector code	['test-stability']	1	1	Closed
13285715	FLINK	5351	expressionreducer escape reduce string value	expressionreducer escape reduce string value escaping happen code generation output result inccorect problem line guess simple example reproduce problem code java val long string val datum new mutable long string  datum def test unit val val sqlquery mytable val result val sink new testingappendsink code output code java code mention user mailing list	['pull-request-available']	2	1	Resolved
13296434	FLINK	5351	add new datum structure interface table common	add new datum structure interface table common planner connector refactoring happen separate issue	['pull-request-available']	3	7	Closed
13324639	FLINK	5351	hang	code kafka fetcher source currency source currency currency compute price price currency interval second price daemon runnable thread state runnable method lock object code	['test-stability']	2	1	Closed
13239460	FLINK	5351	carry primary key unique key information tableschema	primary key unique key standard meta information sql important information optimization example aggregateremove aggregatereducegrouping state layout optimization topn join issue want extend tableschema carry information primary key unique key tablesource declare meta information	['pull-request-available']	3	2	Closed
13471959	FLINK	6732	support predicate testing new column	currently add column filter cause error rowdatatoobjectarrayconverter number column correct binarytablestat support evolution short rowdata	['pull-request-available']	3	4	Closed
13468839	FLINK	6732	planner free flink table store codegen	currently table planner bundle flink table store codegen cause bundle jar big dependence planner code difficult compatible multiple version flink	['pull-request-available']	3	7	Closed
13238666	FLINK	6732	introduce basearray basemap reduce conversion overhead blink	currently internal datum format flink array binaryarray map binarymap user write udaf array parameter return value lead frequent conversion java array binaryarray conversion equivalent entire array copys time consume order avoid copy conversion basearray basemap introduce internal format basearray parent genericarray binaryarray provide read write operation array genericarray wrapper class java array internally wrap java array array store element internal datum format conversion avoid element type primitive type type consistent internally format externally format detail dataformatconverter benchmark performance udaf primitive array improve time	['pull-request-available']	3	1	Closed
13432559	FLINK	6732	introduce tablestore api refactor itcases	need refactor filestoreitcase sink interface datastream layer class complex build simple sql accomplish need think problem storesink expose api kind currently keyed confusing	['pull-request-available']	3	7	Closed
13222755	FLINK	6732	introduce streamoperatorfactory help table perform operator codegen	need codegen entire operator possible solution introduce operatorwrapper generate codegen sub operator operatorwrapper open proxy method sub operator introduce operatorwrapper result multiple virtual function call way introduce streamoperatorfactory runtime streamoperatorfactory create real operator invoke way redundant virtual test result performance improve introduction streamoperatorfactory benchmark simple query	['pull-request-available']	3	2	Closed
13450143	FLINK	6732	set hadoop filesystem orc reader	orc reader use hadoop filesystem orc writer use flink filesystem lead inconsistency possibly classloader loading issue unify set hadoop filesystem flink orc reader	['pull-request-available']	3	4	Closed
13509173	FLINK	6732	introduce predicate visitor	present predicate traverse place need visitor mode well traverse predicate	['pull-request-available']	3	4	Closed
13410771	FLINK	6732	time azp	test time azp code nov testtimedoutexception test time second nov nov nov method nov nov nov nov nov nov nov nov nov nov nov nov nov nov nov nov nov nov nov nov nov nov nov nov nov nov nov nov nov nov nov nov nov nov nov nov nov nov nov nov nov nov nov nov nov nov nov nov nov nov nov nov nov nov nov nov nov nov nov nov nov nov nov nov nov nov nov nov nov nov nov nov method nov nov nov nov nov nov nov nov nov nov nov nov nov nov code	['pull-request-available', 'test-stability']	2	1	Closed
13480780	FLINK	6732	overwrite input	currently datum trigger overwrite cause semantic sql correct	['pull-request-available']	3	1	Closed
13473756	FLINK	6732	throw well exception file find read	read file find file exist directly throw file find exception difficult user understand clear exception message file find read slow previous snapshot expire configure large retain speed read cause filenotfoundexception file exist table store snapshot table store snapshot	['pull-request-available']	1	4	Closed
13468477	FLINK	6732	add extrafile datafilemeta	code java class datafilemeta string filename store extra file extra file include etc list extrafile code extra file help use include index file changelog file etc	['pull-request-available']	3	2	Closed
13365473	FLINK	6732	refactor slicingwindowaggoperatorbuilder accept serializer instead logicaltype	slicingwindowaggoperatorbuilder accept logicaltypes well avoid logicaltype runtime operator function	['pull-request-available']	3	4	Closed
13259291	FLINK	6732	add hash distribution sort group dynamic partition insert	batchexecsinkrule static partition partitioned table add hash distribution sort grouping wrong group dynamic partition insert partition field static partition hash sort dynamic partition field instead partition field	['pull-request-available']	3	7	Closed
13241007	FLINK	6732	support intersect minu blink planner	support intersect minus replaceintersectwithsemijoinrule replaceminuswithantijoinrule replace intersect null aware semi join distinct aggregate need support intersect minus presto spark support think good rewrite design follow intersect input query code java select intersect select code rewrite query code java select select select select select true null union select null true group have code minus input query code java select select code rewrite query code java select select select select select vcol union select vcol group code	['pull-request-available']	3	2	Closed
13446520	FLINK	6732	change path root path table store	path easy bother user misinterpret path table let change root path clear	['pull-request-available']	3	4	Closed
13311655	FLINK	6732	flink sql connector hive module merge hive exec dependency	hive exec bundle jar merge bundle dependency hive exec	['pull-request-available']	1	1	Closed
13256249	FLINK	6732	operator use fraction decide manage memory allocate	operator allocate memory segment return operator reserve memory return step activate new fraction base manage memory	['pull-request-available']	3	7	Closed
13422119	FLINK	6732	init flink table store repository	create notice license maven tool release tool github build workflow	['pull-request-available']	3	7	Closed
13328749	FLINK	6732	introduce createbucketwriter bucketsbuilder	code java public abstract static class bucketsbuilder public abstract bucketwriter createbucketwriter throw ioexception code depend bucketwriter write compact file	['pull-request-available']	3	7	Closed
13336670	FLINK	6732	introduce file streaming compaction operator	introduce compactcoordinator compactoperator	['pull-request-available']	3	7	Closed
13219884	FLINK	6732	improve internal datum format	introduce abstract set internal datum format table runtime blink jira complement introduce decimal scale object specify user automatically bigdecimal introduce care specific type work serializer introduce lazybinaryformat exist format binary java object	['pull-request-available']	3	2	Closed
13271909	FLINK	6732	introduce unknown memory set table blink planner	set unknown resource set manage memory	['pull-request-available']	3	7	Closed
13481206	FLINK	6732	page exception sortbuffermemtable	partition partition writer seize memory following exception need sure writer memory start actually memory preempt writer problem contain preemptable memory	['pull-request-available']	3	1	Closed
13246709	FLINK	6732	blink planner support generic tablesource	exception user use table source like code java class extend code reason blink planner use typeextractor extract class tablesource use class dataformatconverter table source datatype return type need extract class tablesource use conversionclass datatype	['pull-request-available']	3	7	Resolved
13300233	FLINK	6732	integrate orc file system connector	integrate orc file system connector sql world user create file system table orc format ddl reading writing streaming writing rowdata sql datum format work introduce orcrowdatainputformat partition support introduce rowdatavectorizer introduce orcfilesystemformatfactory	['pull-request-available']	3	7	Closed
13226620	FLINK	6732	support sortaggregate hashaggregate operator run batch mode	batchexecsortaggregate batchexechashaggregate aggitcase	['pull-request-available']	3	2	Closed
13293216	FLINK	6732	parquet columnar row reader read footer wrong end	code java path splitlength code code java path splitstart splitlength code	['pull-request-available']	3	1	Resolved
13370533	FLINK	6732	value sort willl fail	select values order	['pull-request-available']	3	1	Closed
13527173	FLINK	6732	fix parquet stat extractor	bug parquet stat extractor decimal supports timestamp supports null nullcount support	['pull-request-available']	3	1	Closed
13222817	FLINK	6732	introduce projectioncodegenerator hashcodegenerator baserow	introduce efficient baserow operation project code generator field baserow generate new baserow hashcodegenerator calculate hash value base field baserow	['pull-request-available']	3	2	Closed
13524757	FLINK	6732	introduce streaming read atomic ensure split	currently stream source checkpoint time mean split checkpoint downstream intermediate state weird case ticket add streaming read atomic option enable return iterator instead record streaming read ensure checkpoint segmentation iterator consumption	['pull-request-available']	3	4	Closed
13280673	FLINK	6732	lastvalueaggfunctionwithordert compilation error incompatible type	lastvalueaggfunctionwithordertest fail compile late nightly build error code info error compilation error info error travis build apache flink flink table flink table planner blink src test java org apache flink table planner function aggfunction incompatible type inference variable incompatible bound equality constraint byte binarystring low bound byte binarystring code	['pull-request-available']	2	1	Closed
13244887	FLINK	6732	blink runner avoid stream operator implement boundedoneinput	accord boundedoneinput coexist checkpoint use boundedoneinput streaming mode	['pull-request-available']	2	1	Resolved
13239483	FLINK	6732	introduce typeinfo localdate localtime localdatetime	new type system table default class time type localdate situation need convert typeinformation todatastream need provide typeinformation support localdate introduce localtimetypeinfo introduce localdateserializer localtimeserializer localdatetimeserializer introduce localdatecomparator localtimecomparator localdatetimecomparator	['pull-request-available']	3	2	Closed
13480921	FLINK	6732	support create table store table store	support create table store table store sink table store code java set create temporary table word string connector datagen create table word string primary key enforced cnt bigint connector table store catalog test catalog default database test rename catalog database catalog table test insert select word count group word code source table store code java set create table word string primary key enforced cnt bigint connector table store catalog test catalog default database test catalog table test create temporary table word string connector print insert select word	['pull-request-available']	4	4	Closed
13351647	FLINK	6732	test failure	happen development branch change relate noformat error test run failure error skip time elapse method noformat	['test-stability']	3	1	Closed
13222260	FLINK	6732	enhance userdefinedfunction interface allow user define type	udf udtf access constant parameter value getreturntype similar feature hive code java input argument input argument pass eval method literal argument constant value pass getresulttype method non literal argument appear pass null instead argument argument function literal argument pass null non literal one argtypes class argument call eval method typeinformation result type null flink determine type public typeinformation argument class aggregatefunction decide user define input type argclasses code java return result type user define input give signature public typeinformation argtypes code	['pull-request-available']	3	4	Closed
13423185	FLINK	6732	dropdelete incorrect compactmanager outputlevel zero	output level zero file level drop delete	['pull-request-available']	3	1	Closed
13459243	FLINK	6732	rename schema tableschema	system use schema concept database schema class confuse case well rename tableschema	['pull-request-available']	3	4	Closed
13274302	FLINK	6732	message nomatchingtablefactoryexception tell user wrong	currently require property exist match nomatchingtablefactoryexception throw user idea know wrong pick good candidate print wrong print requiredcontext supportedpropertie different format way user know property requiredcontext lack property allow supportedpropertie	['pull-request-available']	1	1	Resolved
13336175	FLINK	6732	stable azure	instance code info result info error failure error expect info error test run failure error skip info info info reactor summary info info flink tool force shading success info flink test util success info flink test util junit success info flink queryable state success info flink filesystem azure hadoop success info flink example success info flink example batch success code	['pull-request-available']	1	1	Closed
13274700	FLINK	6732	better error message insert partition value	support insert partition value like insert mytable partition value jason throw exception schema match improve error message tell user support pattern	['pull-request-available']	3	1	Resolved
13483164	FLINK	6732	connection leak orc reader	orcfilestatsextractor forget close reader hadoopreadonlyfilesystem forget close fsdatainputstream need pocket test assert connection close	['pull-request-available']	1	1	Closed
13219188	FLINK	6732	table planner blink type table runtime blink	type runtime runtime code rely heavily type	['pull-request-available']	3	4	Closed
13310591	FLINK	6732	illegalargumentexception read filesystem partition table stream mode	illegalargumentexception read filesystem partition table stream mode code java cause illegalargumentexception fileinputformat multiple path support snapshot snapshot snapshot snapshot snapshot table snapshot table snapshot table snapshot table snapshot table snapshot table snapshot table snapshot table snapshot table snapshot table snapshot code read filesystem partition table maybe directory read continuousfilemonitoringfunction support multiple path use	['pull-request-available']	1	1	Closed
13440824	FLINK	6732	optimize async compaction mergetreewriter	currently compaction cause writer block impact logstore latency need decouple compact write compact completely asynchronous file lead unstable read file compaction processing speed writer need press writer stop parameter num sort trigger default	['pull-request-available']	3	4	Closed
13289467	FLINK	6732	hide hive version avoid user confuse	version yaml hivecatalog need consistent dependency version place version metastore version dependency version yaml hivecatalog user easy mistake	['pull-request-available']	3	1	Resolved
13305806	FLINK	6732	throw readable exception group map type	use flink blink planner submit batch sql job read hive table contain map type field aggregate sql create view aaa select create view select day itime uid abflag hdid country aaa left join lateral true view color group uid insert submit job exception occur programinvocationexception main method cause error scala matcherror map class logicaltyperoot method cause runtimeexception scala matcherror map class logicaltyperoot method cause scala matcherror map class logicaltyperoot find method hashcodefortype codegenutil class match map type fix def hashcodefortype ctx codegeneratorcontext logicaltype term string string match case boolean case map code add case tinyint job sumitte run exception occur runtimeexception instantiate generate class cause flinkruntimeexception invalidprogramexception table program compile bug file issue cause uncheckedexecutionexception invalidprogramexception table program compile bug file issue cause invalidprogramexception table program compile bug file issue cause compileexception line column method name compareto declare enclosing class supertype static import	['pull-request-available']	4	1	Closed
13522773	FLINK	6732	introduce time automatically delete expired partition	snapshot expiration introduce partition expiration automatically delete expired partition commit node	['pull-request-available']	3	4	Closed
13513318	FLINK	6732	refactor module documentation filesystem	flink table store filesystem flink table store filesystem flink table store oss hadoop flink table store oss introduce new page oss	['pull-request-available']	3	7	Closed
13435475	FLINK	6732	introduce blockingiterator help test	blockingiterator provide ability bring timeout block iterator use static cached executorservice limit number thread work inside type	['pull-request-available']	3	7	Closed
13279554	FLINK	6732	sql client require legacy blink planner classpath	sql client use directly internal class legacy planner work blink planner classpath internal class functionservice dependency introduce	['pull-request-available']	3	1	Closed
13288609	FLINK	6732	introduce writablevector abstract writing	need write vector parquet input stream need abstract vector writing future provide offheapvector	['pull-request-available']	3	7	Resolved
13505245	FLINK	6732	codegenloader fail temporary directory symlink		['pull-request-available']	3	1	Closed
