id	project_name	processed_title	processed_description	processed_labels	priority_id	type_id	status_name	topic_id	top_terms
13486530	ARROW	use bundle orc cmake	test cpp noformat building apache orc source cmake error specify link library target build project stack recent include noformat	['pull-request-available']	1	4	Resolved	34	['cpp', 'use', 'fail', 'error', 'run', 'return', 'pyarrow', 'add', 'support', 'file']
13281806	ARROW	build repository package	apache arrow archive keyring failure noformat apache arrow archive noformat apache arrow release failure noformat tmp rpm tmp line apache arrow file directory noformat	['pull-request-available']	3	4	Resolved	28	['file', 'package', 'fail', 'add', 'return', 'run', 'pyarrow', 'cpp', 'support', 'use']
13386954	ARROW	add csv writer documentation	new csv writer python possibly language documentation user check site probably believe csv writer	['pull-request-available']	3	4	Resolved	24	['add', 'error', 'fail', 'file', 'return', 'run', 'pyarrow', 'cpp', 'support', 'use']
13334145	ARROW	string split kernel propagate null correctly sliced input	sure specific test issue valid behavior write test following test fail code java bar foo null bar foo null option code follow output code java fail got foo bar foo null expect foo bar foo null code output array see unequal	['pull-request-available']	4	4	Resolved	21	['test', 'fail', 'run', 'pyarrow', 'cpp', 'error', 'return', 'add', 'support', 'file']
13398254	ARROW	deprecate parquet pseudo version	currently member enable hodgepodge feature actually add parquet format allow fine grain selection format version deprecate value add value	['pull-request-available']	3	3	Resolved	24	['add', 'error', 'fail', 'file', 'return', 'run', 'pyarrow', 'cpp', 'support', 'use']
13437567	ARROW	add support llvm	ubuntu ship llvm	['pull-request-available']	3	4	Resolved	9	['support', 'type', 'error', 'add', 'pyarrow', 'test', 'return', 'run', 'file', 'fail']
13283607	ARROW	support nest dictionary json integration format	disabled library implementation support dictionary dictionary ipc believe need integration test	['pull-request-available']	3	4	Resolved	9	['support', 'type', 'error', 'add', 'pyarrow', 'test', 'return', 'run', 'file', 'fail']
13368930	ARROW	fix compressed file reading stream end file	initially report arrow user mailing list private access actual file	['pull-request-available']	3	1	Resolved	28	['file', 'package', 'fail', 'add', 'return', 'run', 'pyarrow', 'cpp', 'support', 'use']
13298378	ARROW	prefer original mirror bundle thirdparty dependency	currently ursa lab mirror high priority consider original mirror reliable	['pull-request-available']	3	3	Resolved	68	['cpp', 'error', 'type', 'return', 'test', 'package', 'run', 'use', 'file', 'fail']
13307774	ARROW	pyarrow documentation pip nightlies reference location	pyarrow documentation give option nightly build use anaconda use pip anaconda command work command pip send user url sphinx doc need update correct url	['pull-request-available']	4	3	Resolved	73	['pyarrow', 'run', 'fail', 'add', 'return', 'support', 'cpp', 'test', 'file', 'error']
13365315	ARROW	extract ipcfragmentscanoption parquetfragmentscanoption	follow	['dataset', 'datasets', 'pull-request-available']	3	3	Resolved	68	['cpp', 'error', 'type', 'return', 'test', 'package', 'run', 'use', 'file', 'fail']
13102443	ARROW	fix valgrind warning cuda test possible	run cuda test fail big issue worth investigate	['pull-request-available']	3	1	Resolved	110	['run', 'test', 'fail', 'error', 'add', 'return', 'pyarrow', 'cpp', 'support', 'file']
13327731	ARROW	disable sphinx api documentation build take hour master	reason unclear build log suggest turn gets resolve	['pull-request-available']	3	3	Resolved	68	['cpp', 'error', 'type', 'return', 'test', 'package', 'run', 'use', 'file', 'fail']
13500690	ARROW	signature find call executeupdate flightsql prepared statement	hey folk hit signature find npe precondition prepare dml statement executeupdate prepare step work fine code precondition checknotnull arrowflightmetaimpl execute arrowflightmetaimpl execute avaticaconnection executequeryinternal avaticapreparedstatement executelargeupdate avaticapreparedstatement executeupdate code null situation call executequeryinternal null signature regardless signature prepared statement non null enjoy play flightsql far thank james	['pull-request-available']	3	1	Resolved	68	['cpp', 'error', 'type', 'return', 'test', 'package', 'run', 'use', 'file', 'fail']
13481159	ARROW	add substrait flight sql		['pull-request-available']	3	2	Resolved	24	['add', 'error', 'fail', 'file', 'return', 'run', 'pyarrow', 'cpp', 'support', 'use']
13139539	ARROW	python asv benchmark setup account library change	create helper script run currently define benchmark specific commit ensure run pristine date release build arrow dependency like parquet cpp commit	['pull-request-available']	3	1	Resolved	110	['run', 'test', 'fail', 'error', 'add', 'return', 'pyarrow', 'cpp', 'support', 'file']
13317047	ARROW	fix failure cause malforme repetition definition level	fix case discover oss fuzz	['pull-request-available']	3	1	Resolved	68	['cpp', 'error', 'type', 'return', 'test', 'package', 'run', 'use', 'file', 'fail']
13311142	ARROW	add	useful compute total data size binary array sample implementation code const return code	['pull-request-available']	4	4	Resolved	101	['package', 'return', 'pyarrow', 'file', 'test', 'run', 'add', 'type', 'error', 'use']
13433410	ARROW	clarify	java flight usage locations flightendpoint location field flightendpoint mean particular interpretation clear protocol comment	['pull-request-available']	3	4	Resolved	68	['cpp', 'error', 'type', 'return', 'test', 'package', 'run', 'use', 'file', 'fail']
13272600	ARROW	remove duplicate nightly job	run test push github actions	['pull-request-available']	3	4	Resolved	88	['test', 'run', 'add', 'support', 'return', 'pyarrow', 'cpp', 'fail', 'use', 'file']
13413192	ARROW	fix crash validate corrupt list array oss fuzz	find oss fuzz	['pull-request-available']	3	1	Resolved	68	['cpp', 'error', 'type', 'return', 'test', 'package', 'run', 'use', 'file', 'fail']
13244084	ARROW	bundle window wheel	window nightly wheel build fail probably cause hard tell error message importerror dll load fail specified module find descriptive theoretically affect release add	['pull-request-available']	3	1	Resolved	24	['add', 'error', 'fail', 'file', 'return', 'run', 'pyarrow', 'cpp', 'support', 'use']
13218810	ARROW	python build test mingw build	follow need arrow apache arrow file enable python test need revert suggestion use code java diff appveyor cpp build appveyor cpp build index appveyor cpp build appveyor cpp build set set set usebackq import sys set set set set dynload set package code suggestion currently trigger build error travis code java building cxx object src arrow cmakefiles ipc json building cxx object src arrow cmakefiles ipc building cxx object src arrow cmakefiles ipc metadata building cxx object src arrow cmakefiles ipc building cxx object src arrow cmakefiles ipc build target error goto additional investigation need	['pull-request-available']	3	6	Resolved	52	['cpp', 'error', 'test', 'package', 'use', 'file', 'run', 'return', 'add', 'pyarrow']
13419588	ARROW	glib add binding	currently possible pass option compute function	['pull-request-available']	4	4	Resolved	24	['add', 'error', 'fail', 'file', 'return', 'run', 'pyarrow', 'cpp', 'support', 'use']
13267691	ARROW	fedora cron job fail wrong fedora version	requested fedora version debian instead	['pull-request-available']	3	1	Resolved	17	['fail', 'run', 'cpp', 'test', 'error', 'return', 'pyarrow', 'add', 'support', 'file']
13388045	ARROW	use cmake path	find raw pkg config usage	['pull-request-available']	3	4	Resolved	34	['cpp', 'use', 'fail', 'error', 'run', 'return', 'pyarrow', 'add', 'support', 'file']
13340747	ARROW	ruby support type	implementation support need ensure ruby gobject binding	['pull-request-available']	3	4	Resolved	9	['support', 'type', 'error', 'add', 'pyarrow', 'test', 'return', 'run', 'file', 'fail']
13319515	ARROW	use archery changelog generator create release note website	previous changelog generation script remove	['pull-request-available']	3	4	Resolved	34	['cpp', 'use', 'fail', 'error', 'run', 'return', 'pyarrow', 'add', 'support', 'file']
13307004	ARROW	slice chunkedarray zero chunk segfaults	code python import pyarrow arr crash code	['pull-request-available']	2	1	Resolved	73	['pyarrow', 'run', 'fail', 'add', 'return', 'support', 'cpp', 'test', 'file', 'error']
13186689	ARROW	convenience api construct	motivate code example	['pull-request-available']	3	4	Resolved	68	['cpp', 'error', 'type', 'return', 'test', 'package', 'run', 'use', 'file', 'fail']
13274462	ARROW	packaging add conda packaging task python	conda forge support python build appropriate package	['pull-request-available']	3	4	Resolved	45	['file', 'package', 'add', 'cpp', 'error', 'test', 'run', 'support', 'return', 'use']
13310494	ARROW	appveyor test failure	introduce	['pull-request-available']	1	1	Resolved	5	['test', 'error', 'add', 'support', 'return', 'run', 'pyarrow', 'cpp', 'use', 'file']
13433913	ARROW	allow set thread pool size environment variable	discussion	['good-second-issue', 'pull-request-available']	3	4	Resolved	68	['cpp', 'error', 'type', 'return', 'test', 'package', 'run', 'use', 'file', 'fail']
13297910	ARROW	python add toggle	miss prior patch	['pull-request-available']	3	4	Resolved	24	['add', 'error', 'fail', 'file', 'return', 'run', 'pyarrow', 'cpp', 'support', 'use']
13292478	ARROW	rename gettargetinfos	sorry think irk new gettargetinfos spelling suggest gettargetinfo getfileinfo singular	['pull-request-available']	5	5	Resolved	68	['cpp', 'error', 'type', 'return', 'test', 'package', 'run', 'use', 'file', 'fail']
13239752	ARROW	work python	noformat python cpp build support traceback recent file cpp build support line file lib line load typeerror json object str byte noformat debian stretch ship python	['pull-request-available']	3	1	Resolved	33	['support', 'cpp', 'file', 'return', 'run', 'pyarrow', 'add', 'fail', 'test', 'use']
13474013	ARROW	exercise binary verification task nightly basis	discuss release release binary verification task exercise nightly basis cause require fix release catch prior release link relevant discussion dev topic account need download binary crossbow instead artifactory trigger verification task binary build task finish	['pull-request-available']	2	4	Resolved	68	['cpp', 'error', 'type', 'return', 'test', 'package', 'run', 'use', 'file', 'fail']
13237672	ARROW	printer show wrong value	example code type code think actual conversion correct printer go wrong give correct value code type dtype code	['pull-request-available']	4	1	Resolved	12	['type', 'support', 'fail', 'return', 'run', 'pyarrow', 'cpp', 'test', 'file', 'error']
13498762	ARROW	python remove gcc compatibility code	require compliant compiler support gcc anymore follow code probably simplify	['pull-request-available']	4	3	Resolved	9	['support', 'type', 'error', 'add', 'pyarrow', 'test', 'return', 'run', 'file', 'fail']
13135132	ARROW	python expose array buffer python user	amount convert list pyarrow buffer object	['pull-request-available']	3	4	Resolved	73	['pyarrow', 'run', 'fail', 'add', 'return', 'support', 'cpp', 'test', 'file', 'error']
13378290	ARROW	merge script test fail miss dependency	miss github update virtual environment host action machine	['pull-request-available']	3	1	Resolved	21	['test', 'fail', 'run', 'pyarrow', 'cpp', 'error', 'return', 'add', 'support', 'file']
13260141	ARROW	miss pyt dependency conda wheel build	multiple python packaging nightlie fail code fail task conda osx clang url conda osx clang url conda win url wheel url conda linux gcc url wheel osx url docker spark integration url wheel win url conda win url conda linux gcc url wheel url conda linux gcc url wheel win url wheel win url gandiva jar osx url conda osx clang url code miss recently introduce pyt lazy fixture test dependency code pyt pyarrow test session start platform linux python hypothesis profile default database example rootdir plugin collect item error deselecte skip select errors error collect test lib site package pyarrow test attributeerror module pyt attribute warning summary prefix lib site mark prefix lib site mark pytestunknownmarkwarning unknown typo register custom mark avoid warning detail pytestunknownmarkwarning doc interrupt error collection code	['pull-request-available']	3	4	Resolved	21	['test', 'fail', 'run', 'pyarrow', 'cpp', 'error', 'return', 'add', 'support', 'file']
13416172	ARROW	drop support centos	reach eol	['pull-request-available']	3	4	Resolved	9	['support', 'type', 'error', 'add', 'pyarrow', 'test', 'return', 'run', 'file', 'fail']
12947906	ARROW	consider add scalar type object model	python later analytic routine pass scalar value example array scalar require kind container system like language solve problem array analysis use case figure work well arrow	['analytics', 'pull-request-available']	3	2	Resolved	69	['support', 'type', 'error', 'use', 'return', 'run', 'pyarrow', 'cpp', 'test', 'file']
13427584	ARROW	update reverse dependency	reverse dependency rebuild arrow package update	['pull-request-available']	3	4	Resolved	116	['package', 'return', 'pyarrow', 'test', 'add', 'run', 'type', 'use', 'error', 'fail']
13395545	ARROW	concatenate dictionary segfault asan failure	noformat run addresssanitizer global buffer overflow address read size thread void char const sign char long int const lidavidm code upstream merge cpp src arrow util visit lidavidm code upstream merge cpp src arrow util visittypeinline lidavidm code upstream merge cpp src arrow operator lidavidm code upstream merge cpp src arrow util visit lidavidm code upstream merge cpp src arrow util visittypeinline lidavidm code upstream merge cpp src arrow operator lidavidm code upstream merge cpp src arrow util const const unsigned char const unsigned char long long long int const lidavidm code upstream merge cpp src arrow util concatenatedictionaryindices lidavidm code upstream merge cpp src arrow array visit lidavidm code upstream merge cpp src arrow array visittypeinline lidavidm code upstream merge cpp src arrow concatenate lidavidm code upstream merge cpp src arrow array const lidavidm code upstream merge cpp src arrow array const const const lidavidm code upstream merge cpp src arrow compute kernels const const const const lidavidm code upstream merge cpp src arrow compute kernels lidavidm code upstream merge cpp src arrow compute kernel void void char const lidavidm envs lib lidavidm envs lib lidavidm envs lib lidavidm envs lib lidavidm envs lib lidavidm envs lib main lidavidm envs lib linux gnu lidavidm code upstream merge build debug arrow compute vector locate byte right global variable define lidavidm code upstream merge cpp src arrow size ascii string summary addresssanitizer global buffer overflow lidavidm code upstream merge cpp src arrow util void char const sign char long int const shadow byte buggy address shadow byte legend shadow byte represent application byte addressable partially addressable heap leave redzone freed heap region stack leave redzone stack mid redzone stack right redzone stack return stack use scope global redzone global init order poison user container overflow array cookie intra object redzone asan internal leave alloca redzone right alloca redzone shadow gap fish job arrow compute vector terminate signal sigabrt abort noformat	['pull-request-available']	3	1	Resolved	68	['cpp', 'error', 'type', 'return', 'test', 'package', 'run', 'use', 'file', 'fail']
13144764	ARROW	multipleclient test hdfs test fail trunk	fail locally code run arrow hdfs failure value actual false expect true code	['pull-request-available']	2	1	Resolved	21	['test', 'fail', 'run', 'pyarrow', 'cpp', 'error', 'return', 'add', 'support', 'file']
13249219	ARROW	write directly	initial refactoring task enable arrow write layer access internal implementation detail discussion	['pull-request-available']	3	1	Resolved	68	['cpp', 'error', 'type', 'return', 'test', 'package', 'run', 'use', 'file', 'fail']
13361902	ARROW	expose originate fragment property scantask	generally useful debug trace scantasks remove explicit mapping michalursa arrow commit	['dataset', 'pull-request-available']	3	4	Resolved	68	['cpp', 'error', 'type', 'return', 'test', 'package', 'run', 'use', 'file', 'fail']
13283027	ARROW	link test	unity build beneficial reduce number test executable file compile reduce build time	['pull-request-available']	4	4	Resolved	57	['test', 'error', 'add', 'file', 'cpp', 'run', 'support', 'return', 'package', 'pyarrow']
13241736	ARROW	add daily weekly valgrind build	daily weekly valgrind build ursa lab machine check sanity code base asan ubsan build travis cover	['pull-request-available']	4	5	Resolved	24	['add', 'error', 'fail', 'file', 'return', 'run', 'pyarrow', 'cpp', 'support', 'use']
13236874	ARROW	crossbow support writing submit job definition yaml file	similar fashion like archery benchmark require consume command output buildbot build step	['pull-request-available']	3	4	Resolved	33	['support', 'cpp', 'file', 'return', 'run', 'pyarrow', 'add', 'fail', 'test', 'use']
13168279	ARROW	python write parquet crash write listarray list	write listarray contain list parquet pyarrow crash minimal code snippet reproduce crash code java import pyarrow pyarrow import parquet array type table listarray non list issue disappear	['parquet', 'pull-request-available']	3	1	Resolved	73	['pyarrow', 'run', 'fail', 'add', 'return', 'support', 'cpp', 'test', 'file', 'error']
13434357	ARROW	document historicallog debug	bufferledger historicallog record stack trace event buffer life allocate incremente decremente reference count somewhat implementation detail information useful debugging especially track memory leak document suitable warning stack trace useful appear accidentally truncate log fix	['pull-request-available']	3	4	Resolved	68	['cpp', 'error', 'type', 'return', 'test', 'package', 'run', 'use', 'file', 'fail']
13254506	ARROW	turn orc feature wheel building script	fail thrift appear	['nightly', 'pull-request-available', 'wheel']	1	1	Resolved	17	['fail', 'run', 'cpp', 'test', 'error', 'return', 'pyarrow', 'add', 'support', 'file']
13377637	ARROW	add variadic string join kernel	similar sql concat string array optional separator default string concatenate return string array example case input array separator input code array array foo bar push pop code return output code array foo bar push pop code accept scalar string recycle value	['pull-request-available']	3	2	Resolved	26	['package', 'return', 'pyarrow', 'test', 'add', 'run', 'type', 'use', 'error', 'fail']
13382163	ARROW	match needle haystack	noformat import pyarrow false true true noformat confirm pyarrow	['pull-request-available']	3	1	Resolved	73	['pyarrow', 'run', 'fail', 'add', 'return', 'support', 'cpp', 'test', 'file', 'error']
13249322	ARROW	unionarray invalid datum pass validation lead segfault	python create invalid unionarray code binary type value bind number child binary code conversion python lead segfault code segmentation fault core dump code hand explicit validation error code code validation raise error case validatevisitor unionarray call python api avoid create invalid array segfault	['pull-request-available']	3	1	Resolved	108	['error', 'test', 'support', 'add', 'return', 'run', 'pyarrow', 'cpp', 'use', 'file']
13322594	ARROW	port head method dataset scanner	add thing head method dataset nice expose python write relatively straightforward port assume	['dataset', 'pull-request-available']	3	4	Resolved	24	['add', 'error', 'fail', 'file', 'return', 'run', 'pyarrow', 'cpp', 'support', 'use']
13143795	ARROW	python consistent intuitive	thing bit odd frombuffer like instead	['pull-request-available']	3	4	Resolved	68	['cpp', 'error', 'type', 'return', 'test', 'package', 'run', 'use', 'file', 'fail']
13149473	ARROW	glib travis failure	result failure glib build travis build apache arrow test test list def datum value data nil nil travis build apache arrow test test list new gem gem gobject lib gobject introspection block gem gem gobject lib gobject introspection block level gem gem gobject lib gobject introspection invoke error argumenterror argument nil travis build apache arrow test test struct child nil nil travis build apache arrow test test struct new gem gem gobject lib gobject introspection block gem gem gobject lib gobject introspection block level gem gem gobject lib gobject introspection invoke error argumenterror argument nil code	['ci-failure', 'pull-request-available']	3	1	Resolved	5	['test', 'error', 'add', 'support', 'return', 'run', 'pyarrow', 'cpp', 'use', 'file']
13303675	ARROW	window wheel	window wheel need fix release	['pull-request-available']	3	1	Resolved	68	['cpp', 'error', 'type', 'return', 'test', 'package', 'run', 'use', 'file', 'fail']
13163376	ARROW	python experiment zero copy pickling	pep implementation ready pypi available backport add experimental support allow zero copy pickling arrow array column etc think mainly involve implement buffer class describe addition consumer api add pep arrow serialization layer avoid minimize copy serialize foreign object	['pull-request-available']	3	5	Resolved	24	['add', 'error', 'fail', 'file', 'return', 'run', 'pyarrow', 'cpp', 'support', 'use']
13183633	ARROW	python segfault list schema pass	code python datum schema schema schema code raise typeerror	['pull-request-available']	3	1	Resolved	68	['cpp', 'error', 'type', 'return', 'test', 'package', 'run', 'use', 'file', 'fail']
13500873	ARROW	flightsql error parameter ordinal range execute prepared stmt param	hey get parameter ordinal range error try set parameter return avaticapreparedstatement repro open flightsql jdbc connection sql query contain param insert user values foo error throw bit dig try identify potential cause meta signature pass avaticapreparedstatement creation parameter list cause bound error call newsignature take sql query newsignature create signature list happen line pass param schema result newsignature let know help narrow help fix james	['pull-request-available']	3	1	Open	2	['error', 'return', 'add', 'run', 'pyarrow', 'support', 'cpp', 'fail', 'test', 'use']
13280609	ARROW	update generate flatbuffer file	field add reflect generate code	['pull-request-available']	3	3	Resolved	24	['add', 'error', 'fail', 'file', 'return', 'run', 'pyarrow', 'cpp', 'support', 'use']
13388466	ARROW	require gobject introspection later	need flight test	['pull-request-available']	3	4	Resolved	5	['test', 'error', 'add', 'support', 'return', 'run', 'pyarrow', 'cpp', 'use', 'file']
13255974	ARROW	flight fail osx python wheel build	example failure code generate dyld library load local opt gperftool lib referenced local cellar bin reason image find protoc gen grpc plugin kill signal src arrow flight error delete file src arrow flight src arrow flight cmakefiles error wait unfinished job code suggest disable flight wheel build	['pull-request-available']	1	4	Resolved	16	['error', 'return', 'fail', 'package', 'file', 'pyarrow', 'add', 'run', 'cpp', 'use']
13368402	ARROW	add regex string match kernel	basic kernel regular expression	['pull-request-available']	3	2	Resolved	24	['add', 'error', 'fail', 'file', 'return', 'run', 'pyarrow', 'cpp', 'support', 'use']
13185372	ARROW	use coarser grain dispatch simd hash function	way dispatch hash function remnant impala codebase check cpuinfo iteration debug builds static member cause non determinism relate static member lifetime report propose refactor cpuinfo singleton pattern handle simd non simd dispatch high level low level like hopefully issue away	['pull-request-available']	3	4	Resolved	34	['cpp', 'use', 'fail', 'error', 'run', 'return', 'pyarrow', 'add', 'support', 'file']
13450327	ARROW	xsimd miss vcpkg build minimal example system package	test build vcpkg win noformat find configuration file package xsimd compatible request version follow configuration file consider accept crossbow crossbow arrow cpp window share xsimd version stack recent include noformat example cpp minimal build static system dependency noformat cmake error provide project ask cmake find package configuration file provide xsimd cmake find find package configuration file provide xsimd request version following name add installation prefix xsimd set directory contain file xsimd provide separate development package sdk sure instal stack recent include noformat test depsource system noformat cmake error provide project ask cmake find package configuration file provide xsimd cmake find find package configuration file provide xsimd request version following name add installation prefix xsimd set directory contain file xsimd provide separate development package sdk sure instal stack recent include noformat	['pull-request-available']	3	4	Resolved	45	['file', 'package', 'add', 'cpp', 'error', 'test', 'run', 'support', 'return', 'use']
13208358	ARROW	file create fresh conda environment windows	code conda create arrow dev conda forge solving environment fail packagesnotfounderror follow package available current channel rsync nomkl current channel search alternate channel provide conda package look navigate use search bar page code linux macos specific dependency	['pull-request-available']	3	1	Resolved	28	['file', 'package', 'fail', 'add', 'return', 'run', 'pyarrow', 'cpp', 'support', 'use']
13288983	ARROW	listbuilder finish fail underlying value builder	reproduction code java include include include int main bug append return code output noformat invalid resize resize line note fix look capacity length	['pull-request-available']	3	1	Resolved	3	['return', 'error', 'cpp', 'type', 'use', 'fail', 'file', 'run', 'test', 'support']
