id	project_name	processed_title	processed_description	processed_labels	priority_id	type_id	status_name	topic_id	top_terms
13375466	ARROW	python pyarrow dependency numpy throw error apple silicon compilation	team unable install old numpy version include specify apache arrow blob master python requirement wheel apple silicon machine build process throw number numpy compilation error able successfully install numpy possible bump numpy acceptable version number enable apple silicon installation thank	['build-failure']	4	1	Closed	108	['error', 'test', 'support', 'add', 'return', 'run', 'pyarrow', 'cpp', 'use', 'file']
13322791	ARROW	python fail install	team attempt migrate workload blocker pyarrow fail install pip install pyarrow fail build wheel correctly resolve noformat system processor perform test perform test failed arrow build warning level production cmake error message unsupported arch flag noformat possible build work edit force end architecture elaborate logic need pick correct extension number item discuss past jira github issue range simple fix cmake script elaborate fix cross product arch detection able discern project wish proceed aw push arm base instance heavily point advocate pick direction influx new issue	['pull-request-available']	3	1	Resolved	21	['test', 'fail', 'run', 'pyarrow', 'cpp', 'error', 'return', 'add', 'support', 'file']
13248880	ARROW	double close response stream	doput java double close metadata response stream service implementation send error channel flight implementation unconditionally try complete stream violate grpc semantic error completion send	['pull-request-available']	3	1	Resolved	108	['error', 'test', 'support', 'add', 'return', 'run', 'pyarrow', 'cpp', 'use', 'file']
13378193	ARROW	fix argument conda windows build	azure conda win azure conda win azure conda win azure conda win affect new error error get unexpected extra argument cpp	['pull-request-available']	3	3	Resolved	108	['error', 'test', 'support', 'add', 'return', 'run', 'pyarrow', 'cpp', 'use', 'file']
13159777	ARROW	python segmentation fault write listtype column parquet	context following currently deal sparse column serialization parquet case line column contain list get segmentation fault try write parquet those column fill list simple code snipet reproduce segmentation fault noformat import pyarrow import table table table segmentation fault noformat fix best jacques	['parquet', 'pull-request-available']	3	1	Resolved	73	['pyarrow', 'run', 'fail', 'add', 'return', 'support', 'cpp', 'test', 'file', 'error']
13188933	ARROW	add option csv reader dictionary encode individual column string binary column	dataset dictionary encode result drastically low memory usage subsequently well performance analytic difficulty dictionary encoding multithreaded conversion ideally end dictionary end option implement concurrent hashing scheme low cardinality dictionary overhead associate mutex contention meaningful high cardinality problem hash chunk separately normalize end guess crude concurrent hash table mutex protect mutation resize go outperform	['csv', 'dataset', 'pull-request-available']	3	2	Resolved	24	['add', 'error', 'fail', 'file', 'return', 'run', 'pyarrow', 'cpp', 'support', 'use']
13296666	ARROW	maybe initialize parquet writer	rtools build code building cxx object src parquet cmakefile file include arrow arrow cpp src arrow arrow arrow cpp src arrow arrow arrow cpp src parquet arrow arrow cpp src parquet arrow arrow arrow cpp src parquet arrow arrow arrow cpp src arrow member function virtual arrow arrow cpp src arrow warn uninitialized function uninitialized auto rexpr arrow arrow cpp src parquet arrow note declare bool code default value idk simple	['pull-request-available']	4	1	Resolved	58	['cpp', 'file', 'support', 'return', 'run', 'pyarrow', 'add', 'fail', 'test', 'use']
13188437	ARROW	python dictionary bind index create dictionaryarray pandas nan	minimal reproducer code python import panda import pyarrow code	['pull-request-available']	3	1	Resolved	73	['pyarrow', 'run', 'fail', 'add', 'return', 'support', 'cpp', 'test', 'file', 'error']
13382295	ARROW	gets stick infinite loop cause oom value fit single chunk	apology duplicate find relate create arrow table python api follow code run memory available resource box ram happen pyarrow run code pyarrow memory usage reach like appropriate ballpark table size code generate table single string column row string character long sure issue python related try replicate api code python import string import numpy import pyarrow alphabet col col table col code	['pull-request-available']	3	1	Resolved	73	['pyarrow', 'run', 'fail', 'add', 'return', 'support', 'cpp', 'test', 'file', 'error']
13346706	ARROW	read json list result invalid non nullable null type	arrow convert json parquet occasionally list json read json arrow table write parquet currently fail notice issue arrow code happen python minimal repro foo import import produce traceback recent file line env lib site package pyarrow line parquetwriter file env lib site package pyarrow line init parquet parquetwriter file line file pyarrow line arrowinvalid nulltype arrow field nullable	['json', 'pull-request-available']	3	1	Resolved	8	['pyarrow', 'package', 'file', 'type', 'error', 'return', 'fail', 'run', 'cpp', 'use']
13402386	ARROW	add function	arrow library tdigest kernel return array list binding find approximate median output difficult work nice create kernel wrap produce scalar output array group	['kernel', 'pull-request-available']	2	4	Resolved	3	['return', 'error', 'cpp', 'type', 'use', 'fail', 'file', 'run', 'test', 'support']
13220564	ARROW	incorrect dependency lead ninja evaluate step unnecessarily subsequent call	sure root cause step executing code ninja bin ccache bin wesm code arrow cpp build prefix src wesm cpp toolchain include src install include prefix src hadoop include install include wesm cpp toolchain include thrift wesm miniconda envs lib site package numpy core include wesm miniconda envs include noexcept type color unused variable omit frame pointer src arrow python cmakefiles src arrow python cmakefiles src arrow python cmakefiles arrow python bin ccache wesm miniconda envs bin cmake remove release bin ccache bin release src arrow python cmakefiles src arrow python cmakefiles src arrow python cmakefiles src arrow python cmakefiles src arrow python cmakefiles src arrow python cmakefiles src arrow python cmakefiles src arrow python cmakefiles src arrow python cmakefiles src arrow python cmakefiles src arrow python cmakefiles src arrow python cmakefiles src arrow python cmakefiles src arrow python cmakefiles src arrow python cmakefiles src arrow python cmakefiles bin ccache bin ranlib release bin ccache bin noexcept type color unused variable omit frame pointer release src arrow python cmakefiles src arrow python cmakefiles src arrow python cmakefiles src arrow python cmakefiles src arrow python cmakefiles src arrow python cmakefiles src arrow python cmakefiles src arrow python cmakefiles src arrow python cmakefiles src arrow python cmakefiles src arrow python cmakefiles src arrow python cmakefiles src arrow python cmakefiles src arrow python cmakefiles src arrow python cmakefiles src arrow python cmakefiles wesm code arrow cpp build wesm cpp toolchain lib release release prefix src wesm cpp toolchain lib wesm cpp toolchain lib wesm cpp toolchain lib wesm cpp toolchain lib wesm cpp toolchain lib wesm cpp toolchain lib wesm cpp toolchain lib wesm miniconda envs bin cmake release release release bin ccache bin noexcept type color unused variable omit frame pointer src arrow python cmakefiles arrow python python release arrow python test wesm code arrow cpp build wesm miniconda envs wesm cpp toolchain lib release release release wesm miniconda envs lib release wesm cpp toolchain lib wesm cpp toolchain lib wesm cpp toolchain lib wesm cpp toolchain lib wesm cpp toolchain lib wesm cpp toolchain lib release prefix src wesm cpp toolchain lib wesm cpp toolchain lib code	['pull-request-available']	3	1	Resolved	68	['cpp', 'error', 'type', 'return', 'test', 'package', 'run', 'use', 'file', 'fail']
13130737	ARROW	python test pandas master	see recently lot breakage pandas master annoyance user break build instead chain need add entry matrix run test pandas master run successfully	['pull-request-available']	3	4	Resolved	88	['test', 'run', 'add', 'support', 'return', 'pyarrow', 'cpp', 'fail', 'use', 'file']
13109566	ARROW	python use	addition make implementation simple benefit multithreaded conversion fast write speed	['pull-request-available']	3	4	Resolved	34	['cpp', 'use', 'fail', 'error', 'run', 'return', 'pyarrow', 'add', 'support', 'file']
13310682	ARROW	allow set grpc client option	way set generic grpc option useful tune behavior round robin load balancing bind grpc allow set argument generic string string string integer pair expose leave interpretation implementation dependent	['pull-request-available']	3	4	Resolved	68	['cpp', 'error', 'type', 'return', 'test', 'package', 'run', 'use', 'file', 'fail']
13182422	ARROW	packaging fix break nightly package build introduce recent cmake change orc test		['pull-request-available']	3	3	Resolved	41	['package', 'return', 'test', 'pyarrow', 'add', 'run', 'type', 'use', 'error', 'fail']
13407977	ARROW	add example register grpc service flight server	application want use grpc conjunction flight benefit grpc tooling fairly straightforward java possible python possible grpc need demonstration good cookbook example	['pull-request-available']	3	4	Resolved	34	['cpp', 'use', 'fail', 'error', 'run', 'return', 'pyarrow', 'add', 'support', 'file']
13407819	ARROW	disable window wheel testing python	layer official python window image available download docker pull return unexpected status resolve reader forbidden transient error block release process build log	['pull-request-available']	3	1	Resolved	2	['error', 'return', 'add', 'run', 'pyarrow', 'support', 'cpp', 'fail', 'test', 'use']
13309976	ARROW	glib add support build apache arrow dataset glib non instal apache arrow dataset	require packaging noformat cxx fatal error arrow util file directory include noformat	['pull-request-available']	3	4	Resolved	24	['add', 'error', 'fail', 'file', 'return', 'run', 'pyarrow', 'cpp', 'support', 'use']
13298421	ARROW	windows wheel build fail boost	build log	['pull-request-available']	3	1	Resolved	17	['fail', 'run', 'cpp', 'test', 'error', 'return', 'pyarrow', 'add', 'support', 'file']
13210977	ARROW	packaging fix fail osx clang conda forge build	log	['pull-request-available']	3	1	Resolved	17	['fail', 'run', 'cpp', 'test', 'error', 'return', 'pyarrow', 'add', 'support', 'file']
13349197	ARROW	use pip install crossbow dependency comment bot	setup conda action long enable github action use alternative way install archery bot	['pull-request-available']	3	1	Resolved	34	['cpp', 'use', 'fail', 'error', 'run', 'return', 'pyarrow', 'add', 'support', 'file']
13207730	ARROW	dev allow maintainer use github api token merge pull request	rate limited today unauthenticated request reason failure mode dev pretty bad make output helpful add option use api token set environment variable	['pull-request-available']	3	4	Resolved	34	['cpp', 'use', 'fail', 'error', 'run', 'return', 'pyarrow', 'add', 'support', 'file']
13315984	ARROW	python support pickling scalar	scalar currently support pickling implement scalar	['pull-request-available']	3	4	Resolved	9	['support', 'type', 'error', 'add', 'pyarrow', 'test', 'return', 'run', 'file', 'fail']
13387394	ARROW	segfault send record batch	send record batch server segfault flight check case return error turn grpc try increment refcount result buffer serialization handler return successfully code cpp grpc status message writeoptions option msg message option store serializer later access message serializer void message bool remove void possible void template parameter need implicit need observe difference behavior clang gcc certain internal user status result check serialize unconditionally initialize return result return status code flight return error initialize buffer segfault originally report stackoverflow	['pull-request-available']	3	1	Resolved	3	['return', 'error', 'cpp', 'type', 'use', 'fail', 'file', 'run', 'test', 'support']
13503863	ARROW	fail link almalinux	noformat failed gandiva glib env share rpmbuild build apache build meson uninstalle bin scanner libtool gandiva gandiva glib include gandiva glib gandiva glib build rpmbuild build apache gandiva glib build rpmbuild build apache build gandiva glib build rpmbuild build apache build rpmbuild build apache build rpmbuild build apache redhat linux build src build rpmbuild build apache redhat linux build src build rpmbuild build apache src build rpmbuild build apache src build rpmbuild build apache build rpmbuild build apache build rpmbuild build apache redhat linux build src build rpmbuild build apache redhat linux build src build rpmbuild build apache src build rpmbuild build apache src rpmbuild build apache build gandiva glib libgandiva prefix ggandiva prefix ggandiva export gandiva glib begin build rpmbuild build apache build rpmbuild build apache build rpmbuild build apache redhat linux build src build rpmbuild build apache redhat linux build src build rpmbuild build apache src build rpmbuild build apache src usr include usr include usr include usr include gobject end include rpmbuild build apache build arrow glib include share build rpmbuild build apache build gandiva glib gandiva glib build rpmbuild build apache build arrow glib build rpmbuild build apache redhat linux build release library library library dir rpmbuild build apache dir rpmbuild build apache error bin rpmbuild build apache redhat linux build release undefined reference const int char const char const error return exit status noformat	['pull-request-available']	3	4	Resolved	16	['error', 'return', 'fail', 'package', 'file', 'pyarrow', 'add', 'run', 'cpp', 'use']
13186678	ARROW	redeclare dllimport attribute reference dll linkage mingw	follow warning report mingw build arrow glib arrow code src arrow warn redeclare dllimport attribute reference dll linkage inline noexcept null code	['pull-request-available']	4	4	Resolved	68	['cpp', 'error', 'type', 'return', 'test', 'package', 'run', 'use', 'file', 'fail']
13271586	ARROW	freeze windows japanese locale	follow example doc freeze wait result forever windows session info set value version version windows system rstudio language collate ctype asia tokyo date package package version date lib source arrow cran assertthat cran bit cran cran cli cran crayon cran cran glue cran magrittr cran purrr cran cran rcpp cran reprex cran rlang cran rstudioapi cran sessioninfo cran tidyselect cran withr cran hiroaki yutani document win files library code	['parquet', 'pull-request-available']	2	1	Resolved	116	['package', 'return', 'pyarrow', 'test', 'add', 'run', 'type', 'use', 'error', 'fail']
13197221	ARROW	python merging parquet files pandas meta schema mismatch	try merge multiple parquet file schema identical field wise parquetwriter complain investigation find panda meta schema different cause error code python import file file writer writer schema true code code traceback recent file line file frameworks lib site package pyarrow line raise valueerror table schema match schema create file code	['parquet', 'pull-request-available']	3	1	Resolved	90	['file', 'error', 'package', 'return', 'pyarrow', 'add', 'run', 'cpp', 'support', 'use']
13251061	ARROW	python expose option		['pull-request-available']	3	4	Resolved	68	['cpp', 'error', 'type', 'return', 'test', 'package', 'run', 'use', 'file', 'fail']
13472091	ARROW	java jsonfilewriter throw ioobe write list	hey folk try write listvector jsonfilewriter get ioobe stack trace follow indexoutofboundsexception index length expect try write offset buffer list set buffervaluecount duv enter loop hit condition varbinary varchar vector fall try write element offset vector ioobe include list check admittedly aware history section time hit exclude duv vector yield single let know info provide cheer james	['pull-request-available']	4	1	Resolved	68	['cpp', 'error', 'type', 'return', 'test', 'package', 'run', 'use', 'file', 'fail']
13477624	ARROW	binary uploader reusable datafusion	want reuse apt yum repository objection mailing list add asf package apt yum repository	['pull-request-available']	3	4	Resolved	26	['package', 'return', 'pyarrow', 'test', 'add', 'run', 'type', 'use', 'error', 'fail']
13400878	ARROW	support binary like type	extension non fix width type need separate approach split new jira	['kernel', 'pull-request-available']	3	4	Resolved	12	['type', 'support', 'fail', 'return', 'run', 'pyarrow', 'cpp', 'test', 'file', 'error']
13303254	ARROW	require struct initialization stringconverter parse string type	run issue work refactore kernel stringconverter initialize able support parametric type like timestamp produce awkwardness possibly performance penalty measure inlined function case refactore static non stateful	['pull-request-available']	3	4	Resolved	12	['type', 'support', 'fail', 'return', 'run', 'pyarrow', 'cpp', 'test', 'file', 'error']
13482431	ARROW	java flakiness jdbc driver test	think suppress kind exception flight sql actionable noformat error time elapse error sqlexception close statement method sep nettyserverhandler onstreamerror warning stream error stream close write place cause flightruntimeexception internal connection close goaway error code debug data byte distribution write error noformat	['pull-request-available']	3	1	Resolved	108	['error', 'test', 'support', 'add', 'return', 'run', 'pyarrow', 'cpp', 'use', 'file']
13328838	ARROW	sure default aws region respect	sdk detect region metadata present let specify default region environment variable sure override sdk pull region sound like currently handle	['pull-request-available']	3	4	Resolved	68	['cpp', 'error', 'type', 'return', 'test', 'package', 'run', 'use', 'file', 'fail']
13375498	ARROW	benchmark compression real datum	flight benchmark program random test datum payload random data hard compress test compressed payload zstd default level actually bit large original uncompressed payload compression pure loss current benchmark well use real world test set reasonable benchmark compression influence flightrpc performance benchmark client server accept path ipc file option	['pull-request-available']	3	4	Resolved	74	['test', 'file', 'error', 'pyarrow', 'fail', 'use', 'add', 'return', 'run', 'cpp']
13185568	ARROW	hard code version thirdparty toolchain	change flatbuffer git hash break dependency download script version string have	['pull-request-available']	3	4	Resolved	68	['cpp', 'error', 'type', 'return', 'test', 'package', 'run', 'use', 'file', 'fail']
13143215	ARROW	python allow subscripte structvalue	code python obj true structvalue traceback recent file line typeerror structvalue object subscriptable code	['pull-request-available']	3	5	Resolved	90	['file', 'error', 'package', 'return', 'pyarrow', 'add', 'run', 'cpp', 'support', 'use']
13117346	ARROW	python read write panda dataframe decompose blockmanager coerce arrow format	discussion permit zero copy read dataframe contain python object event objectblock array bad pickle reconstruct receive	['pull-request-available']	3	2	Resolved	68	['cpp', 'error', 'type', 'return', 'test', 'package', 'run', 'use', 'file', 'fail']
13407283	ARROW	python installation fail macos wheel build	trail comma script	['pull-request-available']	3	1	Resolved	17	['fail', 'run', 'cpp', 'test', 'error', 'return', 'pyarrow', 'add', 'support', 'file']
13275741	ARROW	test cpp static fail link error arrow hdfs test	code failed debug arrow hdfs test bin ccache bin noexcept type color conversion sign conversion unused variable src arrow cmakefiles arrow hdfs debug arrow hdfs test cpp debug debug debug lib linux gnu lib linux gnu lib linux gnu lib linux gnu lib linux gnu lib linux gnu install lib lib linux gnu lib linux gnu lib linux gnu lib linux gnu lib linux gnu lib linux gnu lib linux gnu prefix src src arrow cmakefiles arrow hdfs function int include boost system undefined reference include boost system undefined reference include boost system undefined reference src arrow cmakefiles arrow hdfs function const const include boost system undefined reference include boost system undefined reference src arrow cmakefiles arrow hdfs function const int const include boost system undefined reference include boost system undefined reference include boost system undefined reference src arrow cmakefiles arrow hdfs function const const include boost filesystem undefined reference const src arrow cmakefiles arrow hdfs function include boost filesystem undefined reference src arrow cmakefiles arrow hdfs function const include boost filesystem undefined reference const error return exit status code possibly relate	['pull-request-available']	3	1	Resolved	60	['test', 'error', 'cpp', 'fail', 'return', 'type', 'run', 'pyarrow', 'use', 'package']
13104025	ARROW	python fix package dependency issue cause build failure	instal package requirement python build step second step cause conda downgrade numpy result abi conflict broken build sure suddenly start happen instal package pin numpy version fix	['ci-failure', 'pull-request-available']	3	1	Resolved	116	['package', 'return', 'pyarrow', 'test', 'add', 'run', 'type', 'use', 'error', 'fail']
13269344	ARROW	python pass directory parquetfile class give confusing error message	error work pyarrow try access folder parquet file generate amazon athena python test parquet work fine contrast python test parquet raise arrowioerror fail open local file test parquet error access deny	['parquet', 'pull-request-available']	3	1	Resolved	90	['file', 'error', 'package', 'return', 'pyarrow', 'add', 'run', 'cpp', 'support', 'use']
13211413	ARROW	python run python travis unit test linux java codebase change	java library dependency python test test trigger change subtree blind spot introduce job split apart	['pull-request-available']	3	1	Resolved	105	['test', 'file', 'add', 'run', 'support', 'return', 'pyarrow', 'cpp', 'use', 'package']
13178862	ARROW	detect orc system package	cmake refactor possible use build orc package detect like toolchain dependency	['pull-request-available']	3	4	Resolved	7	['package', 'file', 'use', 'fail', 'pyarrow', 'add', 'return', 'run', 'cpp', 'error']
13180002	ARROW	python allow light construction schema structtype	explicitly example	['pull-request-available']	3	5	Resolved	68	['cpp', 'error', 'type', 'return', 'test', 'package', 'run', 'use', 'file', 'fail']
13398766	ARROW	add min max aggregation function	return struct array point want compute kernel projectnode allow struct array element nice max scalar want	['kernel', 'pull-request-available']	2	2	Resolved	101	['package', 'return', 'pyarrow', 'file', 'test', 'run', 'add', 'type', 'error', 'use']
13425405	ARROW	ensure system grpc system protobuf	kou post ensure system grpc mix bundle protobuf cause test failure valid combination likely link copy protobuf	['pull-request-available']	3	4	Resolved	57	['test', 'error', 'add', 'file', 'cpp', 'run', 'support', 'return', 'package', 'pyarrow']
13380816	ARROW	use concurrency setting github actions	currently dedicated github actions cancel previous job new job queue well concurrency setting unfortunately beta	['pull-request-available']	4	3	Resolved	34	['cpp', 'use', 'fail', 'error', 'run', 'return', 'pyarrow', 'add', 'support', 'file']
13389170	ARROW	list hash aggregate kernel	hash aggregate kernel list rest function presumably intend directly callable go find place list aggregation support group	['kernel', 'pull-request-available']	3	4	Resolved	9	['support', 'type', 'error', 'add', 'pyarrow', 'test', 'return', 'run', 'file', 'fail']
13246415	ARROW	csv reader option handle line	followup false line fail parse invalid csv file correct behavior fill line miss datum column	['csv', 'pull-request-available']	4	1	Resolved	28	['file', 'package', 'fail', 'add', 'return', 'run', 'pyarrow', 'cpp', 'support', 'use']
13383902	ARROW	release generate api doc ubuntu	notice ubuntu build variable pass runtime environment variable container	['pull-request-available']	3	1	Resolved	68	['cpp', 'error', 'type', 'return', 'test', 'package', 'run', 'use', 'file', 'fail']
13191862	ARROW	ruby import red parquet	want donate ruby binding apache parquet glib develop	['pull-request-available']	3	2	Resolved	68	['cpp', 'error', 'type', 'return', 'test', 'package', 'run', 'use', 'file', 'fail']
13405956	ARROW	llvm macos gha build		['pull-request-available']	2	1	Resolved	68	['cpp', 'error', 'type', 'return', 'test', 'package', 'run', 'use', 'file', 'fail']
13042885	ARROW	script easily verify release language	have script parquet cpp download tarball verify signature build test language helpful future releaes	['pull-request-available']	3	5	Resolved	105	['test', 'file', 'add', 'run', 'support', 'return', 'pyarrow', 'cpp', 'use', 'package']
13416311	ARROW	add simple stdout json exporter opentelemetry	odd library configure opentelemetry exporter reason actual end user unable configure directly use implementation user likely python important bit nice way dump information collect nice dump datum easily parseable format consumption enable ostream exporter custom exporter dump json example discussion	['pull-request-available', 'query-engine']	3	4	Resolved	34	['cpp', 'use', 'fail', 'error', 'run', 'return', 'pyarrow', 'add', 'support', 'file']
13295294	ARROW	add doexchange rpc flight protocol	mailing list discussion vote	['pull-request-available']	3	2	Resolved	24	['add', 'error', 'fail', 'file', 'return', 'run', 'pyarrow', 'cpp', 'support', 'use']
13387262	ARROW	consistent timeout java jni build	jni build consistently gets kill github action	['pull-request-available']	3	1	Resolved	68	['cpp', 'error', 'type', 'return', 'test', 'package', 'run', 'use', 'file', 'fail']
