id	project_name	processed_title	processed_description	processed_labels	priority_id	type_id	status_name	topic_id	top_terms
13175092	FLINK	support custom flinkkafkapartitioner kafka table sink factory	currently kafka table sink factory support custom flinkkafkapartitioner need use case	['pull-request-available']	3	7	Resolved	31	['select', 'table', 'support', 'thread', 'main', 'use', 'planner', 'need', 'query', 'value']
13561594	FLINK	update junit	log improve exception throw file delete clean temporary directory create include root cause help debug	['pull-request-available']	3	11500	Resolved	22	['snapshot', 'job', 'exception', 'example', 'table', 'start', 'end', 'check', 'file', 'scala']
13234591	FLINK	introduce planner rule remove redundant shuffle collation	exchange sort heavy operator create flinkexpandconversionrule operator require input satisfy distribution trait collation trait planner rule operator provide distribution collation batchexechashaggregate batchexechashjoin provide distribution shuffle key batchexecsortmergejoin provide distribution collation join key provide trait satisfy require trait exchange sort redundant code sql schema int bigint varchar int bigint varchar int bigint varchar int bigint varchar sql select join join leave outer join physical plan redundant exchange sort remove code physical plan exchanges sortmergejoins redundant shuffle key sort sortmergejoins left hand redundant input sort note exchange remove maybe exist sub tree like localhashaggregate globalhashaggregate localhashaggregate remove localhashaggregate redundant localrank globalrank localsortaggregate globalsortaggregate situation shuffle collation remove multiple over code sql schema mytable int int varchar sql select count partition order partition order rank partition order partition order count partition order mytable physical plan redundant exchange sort remove asc asc asc asc asc asc asc code exchange sort overaggregates redundant shuffle key sort key	['pull-request-available']	3	2	Closed	11	['int', 'table', 'sql', 'checkpoint', 'create', 'file', 'select', 'job', 'return', 'string']
13382184	FLINK	task block broadcast stream status	cluster observe symptom task block long time cause long delay unaligned checkpointing case cause broadcastemit stream status noformat error localbufferpool blocking wait available buffer exception stracktracegenerator snapshot snapshot snapshot snapshot snapshot snapshot snapshot snapshot snapshot snapshot snapshot snapshot snapshot snapshot snapshot snapshot snapshot snapshot snapshot snapshot snapshot snapshot snapshot snapshot snapshot snapshot snapshot snapshot snapshot snapshot flink snapshot flink snapshot flink snapshot flink snapshot noformat see happen source network task case source task broadcastemit easily bypass non block check question stream idle like millisecond broadcast status optimise broadcasting cb event issue event request require buffer	['pull-request-available']	2	1	Closed	26	['info', 'snapshot', 'error', 'connector', 'run', 'exception', 'current', 'java', 'source', 'state']
13311786	FLINK	introduce method wait datum ready	currently method insert statement return tableresult job submit user use wait job finish api look ugly issue aim introduce method code snippet look like code java val tenv submit job wait job finish code suggest new method code java wait necessary datum ready select operation method wait unit row access local insert operation method wait job finish result contain row operation method return immediately result ready local executionexception future complete exceptionally interruptedexception current thread interrupt wait void await throw interruptedexception executionexception wait necessary give time datum ready select operation method wait unit row access local insert operation method wait job finish result contain row operation method return immediately result ready local timeout maximum time wait unit time unit timeout argument executionexception future complete exceptionally interruptedexception current thread interrupt wait timeoutexception wait time void timeout timeunit unit throw interruptedexception executionexception timeoutexception code	['pull-request-available']	3	4	Closed	30	['thread', 'method', 'checkpoint', 'job', 'time', 'order', 'instead', 'java', 'support', 'return']
13435068	FLINK	fail miss execution	mapohl fail executiongraphexception indicate expect execution code cause flinkexception execution unexpectedly long run task executor code	['pull-request-available', 'test-stability']	3	1	Resolved	36	['execution', 'job', 'scala', 'use', 'table', 'java', 'run', 'method', 'state', 'task']
13257717	FLINK	support configurable failover strategy scheduler	introduce new version failover strategy scheduler failover strategy future user able choose proper strategy job configuration	['pull-request-available']	3	7	Closed	27	['support', 'class', 'introduce', 'sql', 'exception', 'python', 'log', 'follow', 'add', 'default']
13426365	FLINK	pyflink datastream test fail azp	test pyflink datastream test fail azp code feb failures feb feb feb self feb feb def feb feb eventtime feb feb hello feb feb hello feb feb hello feb types int types string feb types string feb feb class feb feb def value int feb return feb feb class feb feb def feb feb feb feb feb def runtimecontext feb types int feb feb types int feb feb types int types string feb statettlconfig feb feb updatetype onreadandwrite feb feb statettlconfig statevisibility returnexpiredifnotcleanedup feb feb feb feb feb feb def value ctx feb import time feb feb feb feb feb feb feb key feb key feb feb feb feb yield current key current value state current list state feb current map state current value feb feb feb feb feb feb def timestamp ctx feb pass feb feb feb feb feb types string feb types string feb feb time stamp assigner key process function feb result feb expect current key current value state current list state feb current map state current value feb feb current key hello current value state feb current list state current map state current value feb feb current key current value state current list state feb current map state current value feb feb current key hello current value state current list state feb current map state hello current value feb feb current key current value state current list state feb current map state current value feb feb current key hello current value state current list state feb current map state hello hello current value feb feb result feb feb pyflink datastream test feb feb pyflink datastream test feb actual feb assertionerror list differ current value current value feb feb differ element feb current value feb current value feb feb diff character long set feb warning summary feb pyflink datastream test feb flink lib site package future deprecationwarning imp module deprecate favour importlib module documentation alternative use feb import imp feb feb pyflink datastream test feb flink lib site package typehint deprecationwarning import abc collection instead deprecate python stop work feb collection iterable feb feb pyflink datastream test feb flink lib site package typehint deprecationwarning import abc collection instead deprecate python stop work feb collection sequence set feb feb pyflink datastream test feb flink lib site pytestunhandledthreadexceptionwarning exception thread feb feb traceback recent feb file flink python lib line feb feb file flink python lib line run feb feb file flink lib site package runner worker line feb target lambda feb file flink lib site package runner worker line feb element feb file flink lib site package line feb return feb file flink lib site package line feb raise self feb feb feb feb feb pyflink datastream test feb flink python pyflink table deprecationwarning deprecate use expression instead feb feb feb pyflink datastream test feb flink python pyflink table deprecationwarning deprecate use instead feb use instead deprecationwarning feb feb doc feb slow duration feb pyflink datastream test feb pyflink datastream test feb pyflink datastream test feb pyflink datastream test feb pyflink datastream test feb pyflink datastream test feb pyflink datastream test feb pyflink datastream test feb pyflink datastream test feb pyflink datastream test feb pyflink datastream test feb pyflink datastream test feb pyflink datastream test feb pyflink datastream test feb pyflink datastream test feb pyflink datastream test feb pyflink datastream test feb pyflink datastream test feb pyflink datastream test feb pyflink datastream test feb short test summary info feb failed pyflink datastream test feb fail pass skip warning feb test module flink python pyflink datastream fail feb error invocationerror command bash exit code feb finish run test second feb start run test post feb finish run test post second feb summary feb error command fail feb cleanup flink apache feb tox check code	['pull-request-available', 'test-stability']	2	1	Resolved	15	['state', 'field', 'value', 'use', 'error', 'operator', 'int', 'type', 'sink', 'table']
13242690	FLINK	leverage partition state improve region failover experience	current region failover process input result partition state unknown failure cause partitionexception unhealthy partition identify lead multiple unsuccessful failover unhealthy need partition identify producer involve failover unsuccessful failover mean recovered task fail soon missing input partition track partition state help region failover identify partition early help case basic idea build restartpipelinedregionstrategy resultpartitionavailabilitychecker query track partition state	['pull-request-available']	3	7	Closed	6	['state', 'table', 'python', 'run', 'support', 'task', 'sql', 'blink', 'issue', 'file']
13449408	FLINK	upgrade calcite version	late available version calcite currently need execute rework plan upgrade calcite upgrade calcite upgrade available version need resolve multiple bug additional note flink currently use calcite note release page warning calcite severe issue rexnode simplification cause search operator wrong datum query optimization like nullpointerexception use development beware calcite corrupt datum follow file remove flink code base upgrade calcite correlate filter intersect minus setop sort union value window hintpredicate nodetypehintpredicate logicalcorrelate logicalfilter logicalintersect logicalminus logicalsort logicalunion logicalvalues logicalwindow	['pull-request-available']	3	11500	Closed	9	['type', 'planner', 'file', 'return', 'configuration', 'null', 'result', 'currently', 'use', 'error']
13247618	FLINK	bump powermock	bump powermock resolve issue initoutputpathtest code java illegalstateexception fail transform class initoutputpathtest reason source error call constructor private method method cause javassist cannotcompileexception source error call constructor private javassist cause compile error call constructor private	['pull-request-available']	3	7	Closed	10	['file', 'python', 'source', 'method', 'cause', 'error', 'apache', 'table', 'connector', 'issue']
13328023	FLINK	introduce batcharrowpythongroupwindowaggregatefunctionoperator	introduce batcharrowpythongroupwindowaggregatefunctionoperator support pandas batch group window aggregation	['pull-request-available']	3	7	Closed	27	['support', 'class', 'introduce', 'sql', 'exception', 'python', 'log', 'follow', 'add', 'default']
13296468	FLINK	support create table table definition	able create table base property table include merge property create new table base	['pull-request-available']	3	7	Closed	11	['int', 'table', 'sql', 'checkpoint', 'create', 'file', 'select', 'job', 'return', 'string']
13317346	FLINK	simplify method executor interface sql client	introduce method executor interface replace method include listcatalog listdatabase createtable droptable listtable listfunction usecatalog usedatabase gettableschema use describe	['pull-request-available']	3	7	Closed	3	['error', 'method', 'time', 'run', 'failure', 'elapse', 'java', 'python', 'skip', 'issue']
13303573	FLINK	value throw stackoverflowerror	error reproduce follow code code java executionenvironment env batchtableenvironment tenv code error follow code java exception thread main stackoverflowerrorexception thread main stackoverflowerror code	['pull-request-available']	3	1	Closed	18	['source', 'thread', 'job', 'task', 'run', 'execution', 'exception', 'log', 'java', 'method']
13339733	FLINK	test desire functionality	succeed different reason testingjobgraphstore start illegalstateexception prevent code reach set removejobgraphfuture trigger test succeed reason test implement	['pull-request-available']	4	1	Closed	0	['version', 'sql', 'create', 'dependency', 'new', 'kafka', 'thread', 'return', 'remove', 'checkpoint']
13560042	FLINK	use maven releasing flink shaded	currently maven enforcer plugin configuration release noformat noformat outdate sync use	['pull-request-available']	3	11500	Open	12	['file', 'null', 'error', 'python', 'use', 'table', 'add', 'support', 'java', 'need']
13370387	FLINK	add documentation new window tvf base operation	version support window tvf base aggregation topn add documentation need restructure query page	['pull-request-available']	3	7	Closed	25	['add', 'remove', 'support', 'need', 'introduce', 'case', 'blink', 'query', 'job', 'planner']
13335158	FLINK	support window tvf base window aggreagte planner	support window tvf base window aggreagte planner introduce new physical node streamexecwindowpropertyaggregate streamexecwindowassigner optimize streamexecgroupwindowaggregate possible	['pull-request-available']	3	7	Closed	16	['api', 'table', 'user', 'use', 'support', 'add', 'mode', 'planner', 'introduce', 'release']
13391864	FLINK	use layered configuration executor planner	configuration story flink consistent moment ideally layered approach pipeline executor datastream api table api store configuration add global configuration request big change like avoid point instead partially follow approach add access config low layer access global configuration plan require access property store	['pull-request-available']	3	7	Closed	7	['key', 'default', 'set', 'add', 'configuration', 'value', 'execution', 'info', 'require', 'batch']
13197075	FLINK	connectedcomponent test instable travis	connectedcomponents iteration high parallelism end end test succeed travis log contain follow exception code error rpcresultpartitionconsumablenotifi schedule update consumer jobmanager executiongraphexception find execution execution source code	['pull-request-available']	2	1	Closed	22	['snapshot', 'job', 'exception', 'example', 'table', 'start', 'end', 'check', 'file', 'scala']
13360062	FLINK	add sqlexpression table common	introduce dedicated function definition use sql expression table api usability clear maven module design well add dedicated sqlexpression table common allow catalog specify unresolved sql expression dependency table api furthermore add sql specific function new schema class	['pull-request-available']	3	7	Closed	16	['api', 'table', 'user', 'use', 'support', 'add', 'mode', 'planner', 'introduce', 'release']
13305181	FLINK	subsume checkpoint channel state mode	channel state handle underlie stream create discard delete reference state handle	['pull-request-available']	2	1	Closed	2	['job', 'state', 'string', 'type', 'task', 'set', 'snapshot', 'add', 'checkpoint', 'return']
13307804	FLINK	erroneous check	fix flush accidentally introduce single byte int write fscheckpointstateoutputstream significantly affect performance	['pull-request-available']	1	1	Closed	11	['int', 'table', 'sql', 'checkpoint', 'create', 'file', 'select', 'job', 'return', 'string']
13270976	FLINK	managed memory fraction round properly sum	managed memory fraction round floor certain precision divide number operator fraction sum double precision issue operator fail allocate manage memory suppose able acquire achieve think change use scale roundmode calculate fraction way sum fraction exceed scale bit large maybe lose little manage memory	['pull-request-available']	3	7	Closed	23	['add', 'support', 'java', 'job', 'sql', 'remove', 'dependency', 'check', 'cause', 'use']
13170005	FLINK	potential resource leak	relate code code optionsfactory null opt code opt dboptions instance close rewrite getcolumnoptions similar issue	['pull-request-available']	4	1	Closed	6	['state', 'table', 'python', 'run', 'support', 'task', 'sql', 'blink', 'issue', 'file']
13431016	FLINK	release testing explicit shutdown signal taskmanager jobmanager	introduce explicit signalling taskmanager jobmanager taskmanager shut reduce time take reactive cluster scale restart setup add follow line flink config enable reactive mode code localhost workaround scheduler mode reactive restart strategy fixeddelay code create usrlib folder place topspeedwindowe jar code bash mkdir usrlib example stream code start job code bash bin standalone start class topspeedwindowe code start task manager code bash bin start bin start bin start code wait job stabilize log file task start operator code globalwindows sink print std switch initializing test stop taskmanager code bash bin stop code success condition job cancel run second log find line text taskexecutor shut teardown stop taskmanager jobmanager code bash bin standalone stop bin stop code	['release-testing']	1	4	Resolved	22	['snapshot', 'job', 'exception', 'example', 'table', 'start', 'end', 'check', 'file', 'scala']
13243703	FLINK	fail travis	fail travis code failure error expect code	['test-stability']	1	1	Resolved	33	['error', 'end', 'snapshot', 'sql', 'java', 'time', 'failure', 'connector', 'run', 'elapse']
13433368	FLINK	fail azure	code error test run failure error skip time elapse method code	['pull-request-available', 'test-stability']	3	1	Resolved	3	['error', 'method', 'time', 'run', 'failure', 'elapse', 'java', 'python', 'skip', 'issue']
13260688	FLINK	add watermark information tableschema	discuss watermark information tableschema expose connector vis need introduce watermarkspec class describe watermark information	['pull-request-available']	3	7	Resolved	25	['add', 'remove', 'support', 'need', 'introduce', 'case', 'blink', 'query', 'job', 'planner']
13249297	FLINK	update continuousfileprocessingmigrationtest restore savepoint	update continuousfileprocessingmigrationtest restore savepoint	['pull-request-available']	1	7	Closed	37	['noformat', 'plan', 'task', 'update', 'source', 'error', 'cause', 'time', 'state', 'contain']
13262831	FLINK	add taskmanageresourceinfo match memory composition taskmanager	information taskexecutorresourcespec add taskexecutorregistration code json public class taskmanagerresourceinfo private final double cpucore private final long frameworkheap private final long frameworkoffheap private final long taskheap private final long taskoffheap private final long shufflememory private final long managedmemory private final long jvmmetaspace private final long jvmoverhead private final long totalprocessmemory code url response add code java resource cpucore frameworkheap frameworkoffheap taskheap taskoffheap shufflememory managedmemory jvmmetaspace jvmoverhead totalprocessmemory code	['pull-request-available']	3	7	Closed	21	['type', 'class', 'file', 'time', 'doc', 'add', 'method', 'need', 'long', 'issue']
13269568	FLINK	add local aggregate solve datum skew rollup cube case	tpc query rollup keyword translate multiple group example group rollup channel equivalent group channel group channel group datum group shuffle single node typical datum skew case local aggregate data size shuffle single node greatly reduce currently cost mode estimate local aggregate cost plan local aggregate choose query rollup keyword add rule base phase physical phase enforce local aggregate input group	['pull-request-available']	3	7	Closed	25	['add', 'remove', 'support', 'need', 'introduce', 'case', 'blink', 'query', 'job', 'planner']
13319108	FLINK	allow variable column name scala table api	user report scala api lack way reference column store variable string interpolation inconvenient case allow scala code valuevar code	['pull-request-available']	3	4	Closed	16	['api', 'table', 'user', 'use', 'support', 'add', 'mode', 'planner', 'introduce', 'release']
13565966	FLINK	job disconnect resourcemanager	code main wait condition thread state wait parking method parking wait code	['github-actions', 'pull-request-available', 'test-stability']	2	1	In Progress	18	['source', 'thread', 'job', 'task', 'run', 'execution', 'exception', 'log', 'java', 'method']
13313189	FLINK	genericarraydata convert object array primitive array	throw cast exception back object array	['pull-request-available']	3	1	Closed	18	['source', 'thread', 'job', 'task', 'run', 'execution', 'exception', 'log', 'java', 'method']
13195344	FLINK	misleading	base script end end test clean file clean file give current behavior end test log check exception expect one whiteliste test fail test choose exception ignore case file clean test check error file test falsely pass solution simple rename method descriptive like include check exist test falsely pass	['pull-request-available']	3	1	Closed	22	['snapshot', 'job', 'exception', 'example', 'table', 'start', 'end', 'check', 'file', 'scala']
13139933	FLINK	cancel scheduling operation cancel executiongraph	change support queued scheduling executiongraph able handle cancellation call fully schedule example case wait new container cancellation cancel execution result available slot assign execution cancel slot assign slot cancel fail overall eager scheduling operation scheduling result callback trigger global fail operation happen execution release executiongraph state cancelling result executiongraph go state failing failed order solve problem propose track scheduling operation cancel result future concurrent suspend cancel fail happen	['flip-6']	3	1	Closed	1	['error', 'result', 'create', 'exception', 'table', 'info', 'sql', 'java', 'query', 'connector']
13375100	FLINK	build function collection	number build function work collection support vendor look postgresql bigquery spark select list generic function collection detail feedback doc welcome	['pull-request-available', 'stale-assigned']	3	7	Reopened	23	['add', 'support', 'java', 'job', 'sql', 'remove', 'dependency', 'check', 'cause', 'use']
13262881	FLINK	restartpipelinedregionstrategy leverage track partition availability well failover experience defaultscheduler	current region failover defaultscheduler input result partition state unknown failure cause partitionexception unhealthy partition identify lead multiple unsuccessful failover unhealthy need partition identify producer involve failover unsuccessful failover mean recovered task fail soon missing input partition track partition state help region failover identify partition early help case achieve propose follow change failoverstrategy failoverstrategy resultpartitionavailabilitychecker add return defaultscheduler use resultpartitionavailabilitychecker schedulerbase create failover strategy factory fail batchfinegrainedrecoveryitcase unexpected failover count legacy scheduler similar optimization	['pull-request-available']	3	7	Closed	2	['job', 'state', 'string', 'type', 'task', 'set', 'snapshot', 'add', 'checkpoint', 'return']
13245941	FLINK	remove legacy batch fault tolerance page redirect new task failure recovery page	batch fault tolerance project flink flink doc dev batch describe deprecated way configure restart strategy remove redirect task failure recovery page late description fault tolerance configuration include restart strategy failover strategy	['pull-request-available']	4	4	Closed	25	['add', 'remove', 'support', 'need', 'introduce', 'case', 'blink', 'query', 'job', 'planner']
13533001	FLINK	azure warning space leave device	run warning code loaded image confluentinc loaded image testcontainer applylayer exit status stdout stderr write lib module space leave device exit code finish restore docker image code	['build-stability', 'pull-request-available']	3	1	Closed	30	['thread', 'method', 'checkpoint', 'job', 'time', 'order', 'instead', 'java', 'support', 'return']
13429142	FLINK	changelog incorrect materializationid pass changelogstatebackendhandleimpl	changelogstatebackendhandleimpl constructor materializationid persistedsizeofthischeckpoint mix	['pull-request-available']	1	1	Resolved	12	['file', 'null', 'error', 'python', 'use', 'table', 'add', 'support', 'java', 'need']
13182292	FLINK	elasticsearch updaterequest fail binary incompatibility	try send get follow error code cause nosuchmethoderror elasticsearch action elasticsearch action bulk bulkprocessor code elasticsearchsinkfunction code import updaterequest def updaterequest new updaterequest myindex record override def runtimecontext runtimecontext requestindexer requestindexer unit code binary compatibility issue base module compile old version current elasticsearch version work simply copy bulkprocessorindexer project ensure class compile correctly	['pull-request-available']	1	1	Resolved	9	['type', 'planner', 'file', 'return', 'configuration', 'null', 'result', 'currently', 'use', 'error']
13174320	FLINK	document unified table source sink format	recent unification table source sink format need documentation propose new page explain build source sink format page customization public interface	['pull-request-available']	3	4	Resolved	14	['null', 'order', 'table', 'remove', 'file', 'add', 'store', 'default', 'create', 'support']
13381697	FLINK	azure pipeline away ubuntu september	azure support ubuntu start october need migrate new ubuntu version time build relatively stable able clearly identify issue relate version upgrade feature freeze	['pull-request-available']	2	1	Closed	32	['error', 'info', 'java', 'start', 'connector', 'example', 'null', 'time', 'end', 'job']
