id	project_name	processed_title	processed_description	processed_labels	priority_id	type_id	status_name	topic_id	top_terms
13347529	FLINK	clean useless code push calcprogram correlate	projectprogram streamphysicalcorrelatebase	['pull-request-available']	3	4	Closed	12	['file', 'null', 'error', 'python', 'use', 'table', 'add', 'support', 'java', 'need']
13335243	FLINK	add metaspace metric	want expose currently metaspace memory provide metric system	['pull-request-available']	3	7	Closed	25	['add', 'remove', 'support', 'need', 'introduce', 'case', 'blink', 'query', 'job', 'planner']
13238698	FLINK	improve expression base tableschema extraction datastream dataset	improve extraction tableschema datastream dataset currently split stage extract type ignore time attribute extract rowtime proctime position adjust index information happen single pass deal porting removing method streamtableenvimpl	['pull-request-available']	3	7	Closed	21	['type', 'class', 'file', 'time', 'doc', 'add', 'method', 'need', 'long', 'issue']
13369265	FLINK	resulttype generatedexpression stringcallgen compatible definition flinksqloperatortable	add follow test case tableenvironmentitcase reproduce bug code scala def mytest unit table null code exception stack code codegenexception mismatch function argument data type actual argument type string code return type inference substr flinksqloperatortable result type generatedexpression	['pull-request-available']	3	1	Closed	4	['return', 'python', 'support', 'type', 'use', 'example', 'exception', 'timeout', 'mode', 'case']
13267696	FLINK	join condition simplify logical phase	currently plan tpcds contain nestedloopjoin join condition distinct distinct distinct planner find equal join key condition simplifyjoinconditionrule solve	['pull-request-available']	3	7	Closed	37	['noformat', 'plan', 'task', 'update', 'source', 'error', 'cause', 'time', 'state', 'contain']
13076769	FLINK	elasticsearch release artifact publish maven central	release artifact elasticsearch connector publish maven central elasticsearch require java minimum release need build java	['flink-rel-1.3.1-blockers']	1	1	Resolved	12	['file', 'null', 'error', 'python', 'use', 'table', 'add', 'support', 'java', 'need']
13526876	FLINK	fail construct type	case problem cast expect return null array map fail example fail query code sql select array select map code noformat error execute sql statement reason numberformatexception input string invalid character find source noformat	['pull-request-available']	3	1	Resolved	0	['version', 'sql', 'create', 'dependency', 'new', 'kafka', 'thread', 'return', 'remove', 'checkpoint']
13216882	FLINK	create blink sql planner runtime module	mention create separate module perform blink sql merge issue create table planner blink table runtime blink module	['pull-request-available']	3	2	Closed	17	['blink', 'table', 'file', 'module', 'implementation', 'remove', 'add', 'release', 'runtime', 'planner']
13486345	FLINK	batchexecutionkeyedstatebackend incorrect executionconfig create serializer	freshly construct executionconfig instead configure user environment code java public getorcreatekeyedstate typeserializer namespaceserializer statedescriptor statedescriptor throw exception namespace serializer checknotnull keyserializer state key serializer configure config operation use partition state executionconfig code correct obtain	['pull-request-available']	4	1	Closed	15	['state', 'field', 'value', 'use', 'error', 'operator', 'int', 'type', 'sink', 'table']
13303954	FLINK	fail travis	code error failure error expect error expect error expect code	['test-stability']	1	1	Closed	33	['error', 'end', 'snapshot', 'sql', 'java', 'time', 'failure', 'connector', 'run', 'elapse']
13528615	FLINK	backport filterjoinrule miss opportunity push filter semijoin input flinkfilterjoinrule	optimization flink copy slightly change filterjoirule optimization come update idea apply change flinkfilterjoinrule	['pull-request-available']	3	4	Closed	28	['task', 'info', 'file', 'source', 'python', 'new', 'table', 'order', 'null', 'type']
13267622	FLINK	byteshashmap warn invoke stack want spill	byteshashmap warn invoke stack want spill lead lot message log need remove stack print warn	['pull-request-available']	3	4	Closed	24	['checkpoint', 'error', 'scala', 'table', 'file', 'job', 'info', 'remove', 'task', 'add']
13337361	FLINK	integrate filesystem hive connector changelog format debezium json	filesystem hive migrate interface possible integrate changelog format debezium json canal json source sink add test	['pull-request-available']	3	7	Closed	1	['error', 'result', 'create', 'exception', 'table', 'info', 'sql', 'java', 'query', 'connector']
13343489	FLINK	simplify type parameter execnode	currently take batchplanner streamplanner parameter execnode type parameter planner indicate node batch node stream node future plan contain batch node stream node type parameter remove implementation base class cast planner expect planner	['pull-request-available']	3	7	Closed	21	['type', 'class', 'file', 'time', 'doc', 'add', 'method', 'need', 'long', 'issue']
13269870	FLINK	relax structured type constraint	mention order allow type extraction structured type register catalog need relax structured type concept inline anonymous structured type identify object identifi catalog fully qualified implementation class order support case class immutable type relax constraint enforce default constructor alternative have constructor fully assign field parameter name type code generation implementation create instance default constructor relatively easy	['pull-request-available']	3	7	Closed	21	['type', 'class', 'file', 'time', 'doc', 'add', 'method', 'need', 'long', 'issue']
13214194	FLINK	miss configuration section doc	merge content option new doc generator note commit apache flink commit section introduction meaningful summary important setting alphabetical list option text actually contain information new description like particular advanced manage memory configuration note batch user	['pull-request-available']	3	1	Closed	21	['type', 'class', 'file', 'time', 'doc', 'add', 'method', 'need', 'long', 'issue']
13448986	FLINK	pyflink installation failure windows	pemja support window make installation fail window need fix asap	['pull-request-available']	2	1	Resolved	6	['state', 'table', 'python', 'run', 'support', 'task', 'sql', 'blink', 'issue', 'file']
13358139	FLINK	remove	long need construct new state call remove contain logic constructor	['pull-request-available']	3	7	Closed	25	['add', 'remove', 'support', 'need', 'introduce', 'case', 'blink', 'query', 'job', 'planner']
13310359	FLINK	init lookup join fail use udf lookup table	throw exception code cause scala matcherror character set class scala code sql code sql select join usertable hello jark code use function rexcall match rexinputref cause error myabe shoud add return skip	['pull-request-available']	3	1	Closed	38	['run', 'snapshot', 'fix', 'start', 'sql', 'apache', 'file', 'throw', 'error', 'java']
13275390	FLINK	jobmanager crash standalone model cancel job subtask status schedule	use start standalone cluster submit job streaming example topspeedwindowe parallelism wait minute cancel job jobmanager crash exception stack noformat error fatalexitexceptionhandler fatal thread flink produce uncaught exception stop process error fatalexitexceptionhandler fatal thread flink produce uncaught exception stop process completionexception completionexception illegalstateexception assign resource current execution attempt deltatrigger timeevictor comparableaggregator passthroughwindowfunction sink print std unassigned cancel method scala scala scala scala completionexception illegalstateexception assign resource current execution attempt deltatrigger timeevictor comparableaggregator passthroughwindowfunction sink print std unassigned cancel morecause illegalstateexception assign resource current execution attempt deltatrigger timeevictor comparableaggregator passthroughwindowfunction sink print std unassigned cancel info blobserver stop blob server noformat	['pull-request-available']	1	1	Resolved	32	['error', 'info', 'java', 'start', 'connector', 'example', 'null', 'time', 'end', 'job']
12731999	FLINK	material section project website	suggest add material section new project website update logo etc allow people material project flink addition think menu entry project source code unnecessary link github main page want rename github	['documentation', 'easyfix', 'starter']	4	4	Resolved	14	['null', 'order', 'table', 'remove', 'file', 'add', 'store', 'default', 'create', 'support']
13244486	FLINK	temporaltypestest randomly fail travis	temporaltypestest wrong result optimize expect detail	['test-stability']	2	1	Closed	35	['plan', 'cause', 'optimize', 'method', 'scala', 'time', 'java', 'job', 'execution', 'log']
13156154	FLINK	improve error message taskmanager fail	taskmanager fail frequently message code flinkexception release taskmanager code message misleading sound like intended operation failure container resourcemanager report jobmanager	['pull-request-available']	2	4	Closed	39	['apache', 'current', 'failure', 'new', 'kafka', 'checkpoint', 'java', 'case', 'add', 'state']
13375535	FLINK	defaultcompletedcheckpointstore drop unrecoverable checkpoint silently	try resilient recover checkpoint transient storage outage checkpoint corrupt behaviour introduce problem behaviour cause ignore late valid checkpoint transient problem restore process guarantee clearly violate exactly processing guarantee hard spot propose change behaviour fail read checkpoint suppose read recover method fail recovery kill process usually restart process retry checkpoint recover operation problem transient nature eventually succeed case problem occur initial job submission job directly transition failed state propose behaviour entail permanent problem checkpoint corrupted checkpoint flink able recover intervention user believe right decision flink long exactly guarantee situation user need explicitly resolve situation	['pull-request-available']	2	1	Resolved	5	['checkpoint', 'info', 'null', 'set', 'state', 'problem', 'result', 'task', 'job', 'create']
13593144	FLINK	use stringbuilder equivalentexprshuttle	currently equivalentexprshuttle map tostring node relnode fact need tostring calculate time usage stringbuilder hood face weird case consume memory	['pull-request-available']	3	1	Resolved	25	['add', 'remove', 'support', 'need', 'introduce', 'case', 'blink', 'query', 'job', 'planner']
12781666	FLINK	add polynomial base feature mapper library	add feature mapper map vector polynomial feature space preprocessing step prior apply learner flink library	['ml']	3	4	Closed	25	['add', 'remove', 'support', 'need', 'introduce', 'case', 'blink', 'query', 'job', 'planner']
13287779	FLINK	execute end end test azp	ensure execute end end test azp sure test reference split reference run nightly test script sure java test execute	['pull-request-available']	3	7	Resolved	33	['error', 'end', 'snapshot', 'sql', 'java', 'time', 'failure', 'connector', 'run', 'elapse']
13336925	FLINK	fail nullpointerexception	code error partitionrequestclientfactoryt time elapse code	['pull-request-available', 'test-stability']	3	1	Resolved	3	['error', 'method', 'time', 'run', 'failure', 'elapse', 'java', 'python', 'skip', 'issue']
13283964	FLINK	fully support raw type api	currently table api expose way create raw type datatypefactory reason raw type need resolve later stage similar user define type need resolve catalog api change introduction abstractdatatype high type resolve unresolved data type introduction class name datatypes unresolved type helper class method construct unresolved type type safe need well support blink planner	['pull-request-available']	3	7	Closed	21	['type', 'class', 'file', 'time', 'doc', 'add', 'method', 'need', 'long', 'issue']
13562457	FLINK	add zip package github actions runner	show fail gha find zip add dependency test code java flink flink end end test test script line zip command find code	['github-actions', 'pull-request-available']	3	7	Closed	33	['error', 'end', 'snapshot', 'sql', 'java', 'time', 'failure', 'connector', 'run', 'elapse']
13362864	FLINK	heap state restore skip key group state backend	new incremental mode heap backend wrap keygroupsstatehandle incrementalremotekeyedstatehandle compute intersection directly aware offset return keyrange intersection recovery unused keygroup filter rocksdb state backend change heap state backend	['pull-request-available']	3	7	Resolved	15	['state', 'field', 'value', 'use', 'error', 'operator', 'int', 'type', 'sink', 'table']
13146902	FLINK	slotpool fail release slot	slotpool release idle slot release operation fail timeout simply continue slot problematic owning taskexecutor fail unregistere meantime slotpool result slotpool reuse slot try return idle fail effectively render scheduling job impossible	['flip-6']	1	1	Closed	4	['return', 'python', 'support', 'type', 'use', 'example', 'exception', 'timeout', 'mode', 'case']
13323402	FLINK	optimize reading channel state recovery	curently channel state read sequentially invert control efficient current chain code java loop subpartition loop datum bufferbuilder code propose chain code java loop state handle ordererd handle offset request buffer way bufferbuilder bufferbuilder pass boolean boolean code	['pull-request-available']	3	7	Resolved	2	['job', 'state', 'string', 'type', 'task', 'set', 'snapshot', 'add', 'checkpoint', 'return']
13493693	FLINK	table store sink continuously fail try add file add snapshot commit slow	table store sink continuously fail try add file add snapshot commit slow bug method find identifi remove identifier map different snapshot identifier example append commit follow compact commit identifier need use set check identifier snapshot commit fast identifi check job restart happen snapshot committing slow multiple identifier check identifier mistakenly keep	['pull-request-available']	3	1	Closed	22	['snapshot', 'job', 'exception', 'example', 'table', 'start', 'end', 'check', 'file', 'scala']
13238749	FLINK	introduce partitionabletablesource partition pruning	datum source partitionable storage hive hdfs druid query need read small subset total datum use partition information prune skip file irrelevant user query query optimization time execution time reduce obviously especially large partitioned table	['pull-request-available']	3	2	Closed	36	['execution', 'job', 'scala', 'use', 'table', 'java', 'run', 'method', 'state', 'task']
13297293	FLINK	improve literals conversion expressionconverter	couple issue expressionresolver literals conversion lot code duplication precision certain type lose binary char	['pull-request-available']	3	1	Closed	21	['type', 'class', 'file', 'time', 'doc', 'add', 'method', 'need', 'long', 'issue']
13596954	FLINK	support lead lag function table api	natively support lag lead function table api	['pull-request-available']	3	4	Open	16	['api', 'table', 'user', 'use', 'support', 'add', 'mode', 'planner', 'introduce', 'release']
13380454	FLINK	fail concurrentmodificationexception		['test-stability']	3	1	Closed	12	['file', 'null', 'error', 'python', 'use', 'table', 'add', 'support', 'java', 'need']
13375384	FLINK	avoid discard checkpoint case failure	statehandlestore implementation apache flink blob flink kubernetes src main java org apache flink kubernete highavailability apache flink blob flink runtime src main java org apache flink runtime zookeeper discard checkpoint checkpoint metadata write backend cover case datum actually write backend fail network issue case end have pointer backend pointing checkpoint discard instead discard checkpoint datum case want specific use case run exception recover checkpoint later want add warning user point possibly orphan checkpoint datum	['pull-request-available']	2	1	Closed	39	['apache', 'current', 'failure', 'new', 'kafka', 'checkpoint', 'java', 'case', 'add', 'state']
13320399	FLINK	use execute insert statement sql client	currently sql client lot logic execute insert job simplify executesql method	['pull-request-available']	3	7	Closed	33	['error', 'end', 'snapshot', 'sql', 'java', 'time', 'failure', 'connector', 'run', 'elapse']
13239501	FLINK	add travis profile gelly kafka	misc test profile frequently hit timeout resolve move gelly universal kafka connector separate profile	['pull-request-available']	3	4	Closed	16	['api', 'table', 'user', 'use', 'support', 'add', 'mode', 'planner', 'introduce', 'release']
13305196	FLINK	add specialized collecting iterator	add specialized collecting iterator need implement algorithm legacy planner datum structure like resettableexternalbuffer blink planner implement algorithm legacy planner legacy planner use current collect implementation	['pull-request-available']	3	7	Closed	17	['blink', 'table', 'file', 'module', 'implementation', 'remove', 'add', 'release', 'runtime', 'planner']
13340904	FLINK	avro confluent registry sql format support add nullable column	generate union null nullable logical type set default value null turn make impossible generate backwards compatible schema ddl statement example create table create table int null avro confluent create new table topic alter old table create table int null optionaldescription string avro confluent format read newt record insert fail optionaldescription default value	['pull-request-available']	2	1	Closed	14	['null', 'order', 'table', 'remove', 'file', 'add', 'store', 'default', 'create', 'support']
13473258	FLINK	fail		['pull-request-available']	1	1	Closed	12	['file', 'null', 'error', 'python', 'use', 'table', 'add', 'support', 'java', 'need']
13353899	FLINK	add itcase test checkpoint task finish	write test feature corner case include check commit effect notifycheckpointcomplete call broadcaststate non key follow key exchange align unaligned checkpoint unaligned checkpoint keyed operator subtask partially finish rare aligned checkpoint maybe good test unaligned checkpoint	['pull-request-available']	3	7	Closed	8	['add', 'checkpoint', 'error', 'state', 'sink', 'task', 'apache', 'failure', 'java', 'info']
13172232	FLINK	add string print method identify output datastream	output print method dataset allow user supply string identify jira browse datastream support valuable add feature datastream	['pull-request-available']	3	2	Closed	16	['api', 'table', 'user', 'use', 'support', 'add', 'mode', 'planner', 'introduce', 'release']
13527535	FLINK	upgrade calcite version	calcite style escape string support leverage enhance string literal usage issue	['pull-request-available']	3	4	Open	2	['job', 'state', 'string', 'type', 'task', 'set', 'snapshot', 'add', 'checkpoint', 'return']
13370377	FLINK	join select composite primary key cause arrayindexoutofboundsexception	add follow test case jointest reproduce bug code scala def mytest unit table mytable int bigint primary key enforced left join mytable code exception stack code runtimeexception error apply rule streamphysicaljoinrule arg flinklogicaljoin leave flinklogicalcalc flinklogicaltablesourcescan mytable method cause runtimeexception error occur apply rule streamphysicaljoinrule cause arrayindexoutofboundsexception source source source source code consider case projection push cause composite primary key select	['pull-request-available']	3	1	Closed	10	['file', 'python', 'source', 'method', 'cause', 'error', 'apache', 'table', 'connector', 'issue']
13302805	FLINK	send flink shaded issue pull request notification	similar send issue pull request notification instead	['pull-request-available']	3	4	Closed	21	['type', 'class', 'file', 'time', 'doc', 'add', 'method', 'need', 'long', 'issue']
13540036	FLINK	add annotation	add annotation disable specific test java similar	['pull-request-available']	3	7	Closed	25	['add', 'remove', 'support', 'need', 'introduce', 'case', 'blink', 'query', 'job', 'planner']
13590912	FLINK	disable japicmp plugin deprecate api	apache flink release allow removal public api japicmp plugin usually check kind change avoid add explicit exclude change jira issue suggest disable api check api mark deprecate	['pull-request-available']	3	4	Resolved	16	['api', 'table', 'user', 'use', 'support', 'add', 'mode', 'planner', 'introduce', 'release']
13303105	FLINK	unify slot request timeout handle streaming batch task	different slot request timeout handling mechanism batch streaming task stream task slot request fail fulfil slotrequesttimeout batch task slot request check periodically fulfillable fail unfulfillable certain slot mark occupy indefinitely unify handling confluence display flink extendedslotproviderinterface detail	['pull-request-available']	3	7	Closed	37	['noformat', 'plan', 'task', 'update', 'source', 'error', 'cause', 'time', 'state', 'contain']
13553700	FLINK	misc module yarn test flaky	code oct error test run failure error skip time elapse clusterdeployment oct error clusterdeployment oct error clusterdeployment oct error remote file provide lib fli oct error runtime oct info oct error test run failure error skip code	['github-actions', 'test-stability']	3	7	Closed	33	['error', 'end', 'snapshot', 'sql', 'java', 'time', 'failure', 'connector', 'run', 'elapse']
13305384	FLINK	remove restartindividualstrategy	legacy scheduler anymore remove ease work remove legacy scheduling logic executiongraph	['pull-request-available']	3	7	Closed	25	['add', 'remove', 'support', 'need', 'introduce', 'case', 'blink', 'query', 'job', 'planner']
13217182	FLINK	add optimize program organize optimization phase	currently flink organize optimization phase different method easy extend especially optimization stage blink hand method similar match order rule set hep optimization phase target trait rule set volcano optimization phase abstract optimization stage flinkoptimizeprogram blink define follow code like program flinkoptimizeprogram transform relational expression relational expression trait optimizecontext def relnode context relnode code flinkoptimizeprogram subclass include flinkrulesetprogram abstract program add remove ruleset set target trait flinkheprulesetprogram subclass flinkrulesetprogram run hepplanner flinkvolcanoprogram subclass flinkrulesetprogram run volcanoplanner flinkgroupprogram program contain sequence sub program group program group execute sequence group execute iteration time flinkchainedprograms responsible organize program program optimize method call sequence call	['pull-request-available']	3	2	Closed	21	['type', 'class', 'file', 'time', 'doc', 'add', 'method', 'need', 'long', 'issue']
13397715	FLINK	dispatcher log jobmaster initialization error info level	dispatcher log jobmaster initialization error hard understand job fail client receive jobresult propose log failure cause job finish dispatcher	['pull-request-available']	3	1	Closed	33	['error', 'end', 'snapshot', 'sql', 'java', 'time', 'failure', 'connector', 'run', 'elapse']
13354473	FLINK	reactive mode change adaptive scheduler set infinite parallelism jobgraph	reactive mode scheduler need change parallelism maxparalllelism submit job graph max value check unsupported flag enable submit jobgraph configuration unaligned checkpoint	['pull-request-available']	3	7	Closed	2	['job', 'state', 'string', 'type', 'task', 'set', 'snapshot', 'add', 'checkpoint', 'return']
13187324	FLINK	respect	documentation state set override discover hostname set value effect look code value instead deprecated	['pull-request-available']	3	1	Closed	15	['state', 'field', 'value', 'use', 'error', 'operator', 'int', 'type', 'sink', 'table']
13336872	FLINK	return number row large	return number row large suggest introduce treat small large input different way small input use precise large input copy old approximated implementation temporary solution fix revert commit	['pull-request-available']	3	1	Closed	16	['api', 'table', 'user', 'use', 'support', 'add', 'mode', 'planner', 'introduce', 'release']
13259037	FLINK	support global failure handle defaultscheduler schedulerng	global failure restart widely executiongraph component component recover job inconsistent state need support defaultscheduler break safety net detail apache flink follow up task replace usage restart jvm termination case consider bug unexpected happen implementation plan add executionfailurehandler add interface schedulerng implement defaultscheduler add interface internaltaskfailureslistener rework implementation use rework invoke scheduler	['pull-request-available']	3	7	Closed	8	['add', 'checkpoint', 'error', 'state', 'sink', 'task', 'apache', 'failure', 'java', 'info']
13486027	FLINK	extract changelog file	currently changelog file store extra file datafilemeta compaction changelog introduce add extra file statistic different correspond merge tree file need extract changelog file	['pull-request-available']	3	7	Closed	12	['file', 'null', 'error', 'python', 'use', 'table', 'add', 'support', 'java', 'need']
13280694	FLINK	add	add	['pull-request-available']	3	7	Closed	25	['add', 'remove', 'support', 'need', 'introduce', 'case', 'blink', 'query', 'job', 'planner']
13341196	FLINK	add check unsupported result type pandas udaf	currently return type pandas udaf primitive data type return scalar python primitive type int float numpy data type ideally specific scalar type accordingly add relate datatype check throw readable exception unsupported datatypes add related note doc	['pull-request-available']	3	4	Closed	21	['type', 'class', 'file', 'time', 'doc', 'add', 'method', 'need', 'long', 'issue']
13336001	FLINK	result partition untracked producer task fail taskmanager	invoke task report fail taskmanager result partition tack job manager partition tracker	['pull-request-available']	3	1	Closed	2	['job', 'state', 'string', 'type', 'task', 'set', 'snapshot', 'add', 'checkpoint', 'return']
