id	project_name	processed_title	processed_description	processed_labels	priority_id	type_id	status_name	topic_id	top_terms
13310147	FLINK	checkpubsubemulatortest fail azure	code java main info checkpubsubemulatort wait receive essage main info checkpubsubemulatort timeout shutdown timeoutexception time wait innerservice stopping reach terminal state current state main info gcloudemulatormanager error test run failure error skip time elapse code	['pull-request-available']	2	1	Closed	34	['info', 'error', 'end', 'connector', 'java', 'execution', 'failure', 'run', 'scala', 'maven']
13320624	FLINK	create uber jar package flink avro sql client	currently user provide dependency avro jackson core asl jackson mapper asl joda time job jar datastream job manually copy flink lib sql job avro formatting well generate uber jar include dependency packaging flink avro module	['pull-request-available']	3	4	Closed	23	['add', 'support', 'java', 'job', 'sql', 'remove', 'dependency', 'check', 'cause', 'use']
13472200	FLINK	throw exception intentionally new snapshot commit restore	currently snapshot commit notifycheckpointcomplete job fail successful checkpoint notifycheckpointcomplete snapshot commit job restart writer start need read late snapshot build late structure lsm tree step happen concurrently writer late snapshot fix problem throw exception intentionally new snapshot commit restore way job forcefully restart likely writer late snapshot	['pull-request-available']	3	4	Closed	22	['snapshot', 'job', 'exception', 'example', 'table', 'start', 'end', 'check', 'file', 'scala']
13395473	FLINK	deleteexecutor npe	encounter situation npe jdbcupsertoutputformat occur jdbc disconnect try reconnect need write datum mysql upsert way sql group unique key jdbcbatchingoutputformat jdbc sink use tablejdbcupsertoutputformat jdbc disconnect data interval exceed set connection time jdbc reconnect preparestatement preparestatement come npe jdbcbatchingoutputformat protect function reset preparestatement tablejdbcupsertoutputformat override function reset deleteexecutor work preparestatement	['pull-request-available']	2	1	Resolved	29	['need', 'new', 'string', 'datum', 'return', 'way', 'use', 'read', 'batch', 'order']
13556226	FLINK	fail nosuchmethoderror	code java error error test run failure error skip time elapse failure error time elapse error nosuchmethoderror void string code run xcomp flink action stage run xcomp flink action stage	['github-actions', 'test-stability']	3	7	Resolved	33	['error', 'end', 'snapshot', 'sql', 'java', 'time', 'failure', 'connector', 'run', 'elapse']
13345832	FLINK	remove slotsharingmanager	scheduler remove remove slotsharingmanager allow remove dynamic slot sharing functionality hard maintain understand	['pull-request-available']	3	7	Closed	14	['null', 'order', 'table', 'remove', 'file', 'add', 'store', 'default', 'create', 'support']
13272974	FLINK	type precision execute sql client blink planner	create table sql client blink planner noformat create table int varchar filesystem csv schema true xxxxxxx noformat table description look good noformat flink sql describe root int string select query fail noformat flink sql select error execute sql statement reason codegenexception incompatible type expression result type type result type noformat	['pull-request-available']	3	1	Resolved	11	['int', 'table', 'sql', 'checkpoint', 'create', 'file', 'select', 'job', 'return', 'string']
13412195	FLINK	support python api implement	support python api implement	['pull-request-available']	3	7	Resolved	6	['state', 'table', 'python', 'run', 'support', 'task', 'sql', 'blink', 'issue', 'file']
13311386	FLINK	test crash exit code	code java warning requested profile skip webui build activate exist error fail execute goal maven surefire test integration test project flink connector test failure error error refer flink connector flink connector target surefire report individual test result error refer dump file exist error executionexception fork terminate properly say goodbye crash call error command flink connector flink connector target lib jvm openjdk jre bin java flink connector flink connector target surefire flink connector flink connector target surefire error error occur start fork check output log error process exit code error crash test error error surefirebooterforkexception executionexception fork terminate properly say goodbye crash call error command flink connector flink connector target lib jvm openjdk jre bin java flink connector flink connector target surefire flink connector flink connector target surefire error error occur start fork check output log error process exit code error crash test error error error error error error error error error error error error error error error error error error error error error error method error error error error error error error error cause surefirebooterforkexception fork terminate properly say goodbye crash call error command flink connector flink connector target lib jvm openjdk jre bin java flink connector flink connector target surefire flink connector flink connector target surefire error error occur start fork check output log error process exit code error crash test error error error error error error error error error error help error error stack trace error run maven switch error run maven switch enable debug log error error information error possible solution read follow article error help error error correct problem resume build command error mvn flink connector mvn exit exit code code environment issue start	['pull-request-available', 'test-stability']	1	1	Closed	33	['error', 'end', 'snapshot', 'sql', 'java', 'time', 'failure', 'connector', 'run', 'elapse']
13514838	FLINK	refactor table store documentation	currently document table store messy lack basic concept ticket refactor table store documentation mean time add basic concept	['pull-request-available']	3	4	Closed	11	['int', 'table', 'sql', 'checkpoint', 'create', 'file', 'select', 'job', 'return', 'string']
13419872	FLINK	changlog materialization incremental checkpoint work local test	currently changelog materialization rocksdb state backend snapshot method generate incrementalremotekeyedstatehandle changelogstatebackendhandleimpl materialize artifact materialization report incrementalremotekeyedstatehandle local test report incrementalremotekeyedstatehandle local localrpcinvocation localrpcinvocation serialize message lead register incrementalremotekeyedstatehandle add sharedstateregistry locate checkpoint report incrementalremotekeyedstatehandle sharedstateregistry throw exception contain sharedstateregistry incrementalremotekeyedstatehandle code java public void stateregistry long checkpointid sharedstateregistry stateregistry state handle register share state give registry code bug distribution environment incrementalremotekeyedstatehandle serialize sharedstateregistry tag transient	['pull-request-available']	3	1	Resolved	2	['job', 'state', 'string', 'type', 'task', 'set', 'snapshot', 'add', 'checkpoint', 'return']
13241176	FLINK	add upsert table sink jdbc	support append jdbc sink limited consider simple wordcount need insert update sink primary key need support upsert jdbc sink abstractjdbcoutputformat extract common method jdbcoutputformat introduce upsertjdbcoutputformat extend abstractjdbcoutputformat upsertjdbctablesink	['pull-request-available']	3	2	Closed	25	['add', 'remove', 'support', 'need', 'introduce', 'case', 'blink', 'query', 'job', 'planner']
13253401	FLINK	behavior match java doc	java doc state return null accumulator produce actually npe trigger accumulator produce go rewrite getaccumulatorresult method following code java public accumulatorname optionalfailure result result null return return null code assign issue solution acceptable	['pull-request-available']	3	1	Resolved	30	['thread', 'method', 'checkpoint', 'job', 'time', 'order', 'instead', 'java', 'support', 'return']
13314702	FLINK	test fail locally	test fail locally ide cmd mvn clean install code unsatisfiedlinkerror method method code	['pull-request-available']	3	1	Closed	3	['error', 'method', 'time', 'run', 'failure', 'elapse', 'java', 'python', 'skip', 'issue']
13290702	FLINK	checkpointcoordinatorfailuretest log linkageerror	issue log output code java main error reconfigure jmx linkageerror loader constraint violation loader instance org powermock core classloader javassist javassistmockclassloader previously initiate loading different type javax management mbeanserver method method code	['pull-request-available']	4	1	Closed	3	['error', 'method', 'time', 'run', 'failure', 'elapse', 'java', 'python', 'skip', 'issue']
13356475	FLINK	add declarativescheduler fail state	subtask add declarative scheduler add fail state flink include test fail unrecoverable fault occur scheduler stop executiongraph cancel	['pull-request-available']	3	7	Closed	25	['add', 'remove', 'support', 'need', 'introduce', 'case', 'blink', 'query', 'job', 'planner']
13229888	FLINK	support sub plan reuse	query plan duplicate sub plan compute logic identical reuse duplicate sub plan reduce computing digest relnode identifier distinguish relnode digest sub plan contain inner node digest use digest sub plan find duplicate sub plan code sql select limit select physical plan sub plan reuse source code sub plan calc limit exchange limit tablesourcescan reuse batch job reuse node lead deadlock hashjoin nestedloopjoin reuse input probe hashjoin start read datum build finish dam operator sort hashaggregate probe datum block probe case set exchange node exist add new batch mode break exchange node dam operator	['pull-request-available']	3	2	Closed	37	['noformat', 'plan', 'task', 'update', 'source', 'error', 'cause', 'time', 'state', 'contain']
13315521	FLINK	fail address use	code error zkcheckpointidcountermultiserverstest time elapse error bindexception address use code	['test-stability']	3	4	Closed	33	['error', 'end', 'snapshot', 'sql', 'java', 'time', 'failure', 'connector', 'run', 'elapse']
13457204	FLINK	enable identify job vertex contain source sink operator	speculative execution support source sink version create speculation instance vertex contain source sink operator note job vertex input output mean source sink vertex multi input source input possible vertex output edge contain sink operator new sink topology spread sink logic multiple job vertex connect job edge	['pull-request-available']	3	7	Closed	8	['add', 'checkpoint', 'error', 'state', 'sink', 'task', 'apache', 'failure', 'java', 'info']
13285302	FLINK	performance regression continuousfilereaderoperator	switch cfro single thread execution model performance regression expect benchmarke november merge master turn reason chain strategy set default cfro factory read output record split single mail action reverse regression half strategy set batching enable fix regression start batch size batch practice significantly delay checkpointe approach process record repeat defaultmailboxactionavailable havenewmail reverse regression improve performance compare old version final solution thing try help cfro rework subsequent commit remove checkpoint lock different batch size include split chain strategy fix partial improvement disable close disable checkpointing disable output serialization linkedlist instead priorityqueue	['pull-request-available']	1	1	Closed	20	['process', 'remove', 'null', 'version', 'type', 'fix', 'order', 'noformat', 'planner', 'use']
13258474	FLINK	remove unnecessary scala duration usage flink runtime	ticket remove usage scala duration finiteduration flink runtime usage akka component akkautils akkarpcactor actorsystemscheduledexecutoradapter	['pull-request-available']	3	7	Resolved	24	['checkpoint', 'error', 'scala', 'table', 'file', 'job', 'info', 'remove', 'task', 'add']
13443577	FLINK	drop flink client test jar	test jar actually unused remove entirely	['pull-request-available']	3	11500	Closed	0	['version', 'sql', 'create', 'dependency', 'new', 'kafka', 'thread', 'return', 'remove', 'checkpoint']
13097764	FLINK	taskexecutor filter duplicate jobmanager gain leadership message	currently taskexecutor filter duplicate jobmanager gain leadership message cause multiple jobmanagerconnection open properly close order solve problem filter duplicate message wrt leader session	['flip-6']	4	1	Closed	13	['error', 'null', 'find', 'order', 'java', 'default', 'runtime', 'table', 'info', 'exception']
13553705	FLINK	find test packaging licensing job		['github-actions', 'test-stability']	3	7	Resolved	2	['job', 'state', 'string', 'type', 'task', 'set', 'snapshot', 'add', 'checkpoint', 'return']
13300458	FLINK	mvn exit exit code library test job	apache flink apache maven report build success exit code code info flink state processor api success info info build success info info total time min info finish info final memory info warning requested profile hadoop activate exist mvn exit exit code try kill watchdog code	['test-stability']	2	1	Resolved	34	['info', 'error', 'end', 'connector', 'java', 'execution', 'failure', 'run', 'scala', 'maven']
13353983	FLINK	add slotallocator	add slotallocator define confluence mwtrcg slotallocator implementation support slot sharing respect configure parallelism operator respect max parallelism operator point cover configured parallelism exceed max parallelism double check	['pull-request-available']	3	7	Closed	8	['add', 'checkpoint', 'error', 'state', 'sink', 'task', 'apache', 'failure', 'java', 'info']
13257113	FLINK	flink runtime scala free	consensus link dedicated thread mind flink runtime eventually scala free maintenance concern release concern umbrella issue track effort scala free flink runtime	['auto-deprioritized-major']	4	4	Closed	24	['checkpoint', 'error', 'scala', 'table', 'file', 'job', 'info', 'remove', 'task', 'add']
13227639	FLINK	support limit sortlimit rank union blink batch	support limit add limit case blink batch support sortlimit add sortlimit case blink batch support rank add rank case blink batch support union add union case blink batch	['pull-request-available']	3	2	Closed	25	['add', 'remove', 'support', 'need', 'introduce', 'case', 'blink', 'query', 'job', 'planner']
13347850	FLINK	support minibatch optimize python udaf	support minibatch optimize python udaf	['pull-request-available']	3	4	Closed	27	['support', 'class', 'introduce', 'sql', 'exception', 'python', 'log', 'follow', 'add', 'default']
13434297	FLINK	lost scheme	code java give job construct path dirty entry correspond job result store jobid job construct dirty entry path path dirty entry give job private path jobid return new code like piece code directly use create new path afraid cause scheme lose cause issue filesystem implementation try stat path	['pull-request-available']	1	1	Resolved	2	['job', 'state', 'string', 'type', 'task', 'set', 'snapshot', 'add', 'checkpoint', 'return']
13574402	FLINK	jobidloggingitcase fail checkpoint confirmation unknown task	code java mar error test run failure error skip time elapse failure jobidloggingitcase mar error time elapse failure mar assertionerror mar event job log taskexecutor mar expect logger taskexecutor level debug message taskmanager receive checkpoint confirmation unknown task mar mar mar mar mar mar mar mar code	['pull-request-available', 'test-stability']	3	1	Closed	33	['error', 'end', 'snapshot', 'sql', 'java', 'time', 'failure', 'connector', 'run', 'elapse']
13550488	FLINK	supportsreadingmetadata apply load compiledplan	condition meet apply readingmetadata interface source overwrite code public boolean supportsmetadataprojection return false code source implement supportsprojectionpushdown table metadata column code create table src string int timestamp null metadata virtual code query table select src fail code cause illegalargumentexception row arity serializer arity code reason supportsreadingmetadataspec create pushprojectintotablesourcescanrule rule apply	['pull-request-available']	3	1	Closed	1	['error', 'result', 'create', 'exception', 'table', 'info', 'sql', 'java', 'query', 'connector']
13316393	FLINK	remove deprecated class flink connector jdbc	refactore class structure flink connector jdbc module keep old api class compatible purpose safe remove class	['pull-request-available']	3	4	Closed	21	['type', 'class', 'file', 'time', 'doc', 'add', 'method', 'need', 'long', 'issue']
13588651	FLINK	create view return invalid query	especially view comment instance create view code sql create view comment test view select code create code sql create view code return query code sql create view select comment test view code try execute fail noformat error execute sql statement reason parseexception incorrect syntax near keyword comment line column expect noformat reason comment query accord syntax mention	['pull-request-available']	3	1	Resolved	0	['version', 'sql', 'create', 'dependency', 'new', 'kafka', 'thread', 'return', 'remove', 'checkpoint']
13541194	FLINK	properly implement	purpose check nullpointerexception happen event processing happen shutdown embeddedexecutorservice concurrent execution handle properly test succeed close happen shutdown multi thread nature test leave actual test scenario test	['pull-request-available']	3	1	Resolved	18	['source', 'thread', 'job', 'task', 'run', 'execution', 'exception', 'log', 'java', 'method']
13475827	FLINK	fail assertionerror	code java aug error time elapse aug aug aug aug aug code	['pull-request-available', 'test-stability']	3	1	Closed	3	['error', 'method', 'time', 'run', 'failure', 'elapse', 'java', 'python', 'skip', 'issue']
13232585	FLINK	include timestamp	test generate configuration external process include timestamp message easy figure order operation different process occur	['pull-request-available']	3	4	Closed	20	['process', 'remove', 'null', 'version', 'type', 'fix', 'order', 'noformat', 'planner', 'use']
13213306	FLINK	port clienttest	check port clienttest new code base necessary	['pull-request-available']	3	7	Closed	29	['need', 'new', 'string', 'datum', 'return', 'way', 'use', 'read', 'batch', 'order']
13233460	FLINK	introduce planner rule semi anti join	issue aim introduce planner rule semi anti join rule include flinksemiantijoinfiltertransposerule push semi anti join tree past filter flinksemiantijoinjointransposerule push semi anti join tree past non semi anti join flinksemiantijoinprojecttransposerule push semi anti join tree past project projectsemiantijointransposerule push project tree past semi anti join planner rule non semi anti join introduce jira browse	['pull-request-available']	3	2	Closed	25	['add', 'remove', 'support', 'need', 'introduce', 'case', 'blink', 'query', 'job', 'planner']
13240859	FLINK	yarnsessioncapacityscheduleritcase fail non prohibit exception	yarnsessioncapacityscheduleritcase fail non prohibit exception code java info executiongraph reduce switch running failed flinkexception long allocate job flinkexception long allocate job scala scala scala scala info executiongraph job flink java job fri jun utc switch state running failing flinkexception long allocate job	['test-stability']	2	1	Closed	22	['snapshot', 'job', 'exception', 'example', 'table', 'start', 'end', 'check', 'file', 'scala']
13521245	FLINK	rocksdb memory management end end test fail unexpected exception	test instability rocksdb memory management end end test test fail exception detect log code jan check error jan error log file jan check exception jan find exception log file print line log detail jan check non file jan non file jan jan fail rocksdb memory management end end test fail minute second test exit exit code log contain error exception non file code exception report flink log warning code warn checkpointfailuremanager fail trigger complete checkpoint job consecutive fail attempt far checkpointexception checkpoint coordinator suspend snapshot snapshot snapshot snapshot snapshot snapshot snapshot snapshot method rpc snapshot rpc snapshot rpc snapshot rpc snapshot rpc snapshot rpc snapshot flink rpc snapshot flink rpc snapshot scala flink rpc snapshot scala flink rpc snapshot flink rpc snapshot scala flink rpc snapshot scala flink rpc snapshot scala flink rpc snapshot flink rpc snapshot flink rpc snapshot flink rpc snapshot flink rpc snapshot flink rpc snapshot flink rpc snapshot flink rpc snapshot flink rpc snapshot code	['pull-request-available', 'test-stability']	2	1	Closed	22	['snapshot', 'job', 'exception', 'example', 'table', 'start', 'end', 'check', 'file', 'scala']
13180226	FLINK		fail travis	['test-stability']	2	1	Closed	12	['file', 'null', 'error', 'python', 'use', 'table', 'add', 'support', 'java', 'need']
13571580	FLINK	add special thank page flink website	issue aim add special thank page flink website honor appreciate company organization sponsor machine service project discussion thread	['pull-request-available']	3	2	Open	25	['add', 'remove', 'support', 'need', 'introduce', 'case', 'blink', 'query', 'job', 'planner']
13288731	FLINK	flink dist bundle exclusive dependency	output system code error yarnhighavailabilityitcase time elapse clusterdeployment error clusterdeployment info error test run failure error skip code dig deeply problem root cause code info compatibility emulate injectsessionexpiration warn curatorzookeeperclient session timeout connection timeout info clusterentrypoint shutting yarnsessionclusterentrypoint application status failed diagnostic nosuchmethoderror util method info akkarpcservice stop akka rpc service info shut remote daemon info remote daemon shut proceed flush remote transport info remote shut info akkarpcservice stop akka rpc service error clusterentrypoint start cluster entrypoint yarnsessionclusterentrypoint clusterentrypointexception fail initialize cluster entrypoint yarnsessionclusterentrypoint snapshot flink snapshot flink snapshot cause nosuchmethoderror util shade shade shade snapshot snapshot snapshot snapshot snapshot snapshot method shade snapshot snapshot code	['pull-request-available', 'test-stability']	1	1	Closed	26	['info', 'snapshot', 'error', 'connector', 'run', 'exception', 'current', 'java', 'source', 'state']
13346291	FLINK	port batchexecpythoncalc streamexecpythoncalc java	separate implementation batchexeccalc streamexeccalc port batchexeccalc streamexeccalc java streamexecpythoncalc extend commonexecpythoncalc commonexecpythoncalc extend commonpythonbase scala class involve lot code java class extend scala interface default implementation create issue separately port java	['pull-request-available']	3	7	Closed	23	['add', 'support', 'java', 'job', 'sql', 'remove', 'dependency', 'check', 'cause', 'use']
13347673	FLINK	pythoncalcsplitconditionrule work expect	currently user write sql select select select mytable null optimize mytable source optimize plan runnable need fix	['pull-request-available']	3	1	Closed	28	['task', 'info', 'file', 'source', 'python', 'new', 'table', 'order', 'null', 'type']
13247978	FLINK	catalogtablestatisticsconverter treenode correct package	currently catalogtablestatisticsconverter treenode catalogtablestatisticsconverter treenode	['pull-request-available']	3	1	Closed	9	['type', 'planner', 'file', 'return', 'configuration', 'null', 'result', 'currently', 'use', 'error']
13236178	FLINK	add jobid argument	inform partition release signature make bit tricky track partition exist give job maintain map partition jobid addition map jobid partition include jobid parameter simplify interfere current use case	['pull-request-available']	3	7	Closed	4	['return', 'python', 'support', 'type', 'use', 'example', 'exception', 'timeout', 'mode', 'case']
13310959	FLINK	flink orc flink parquet invalid notice file	flink orc provide variant ship binary binary document meta inf notice similar file directory notice force shading commons lang notice file look valid meta inf service assume introduce	['pull-request-available']	1	1	Closed	12	['file', 'null', 'error', 'python', 'use', 'table', 'add', 'support', 'java', 'need']
13243014	FLINK	support explain dag plan	flink planner query optimize call job multiple sink mean insertinto sqlupdate call multiple time final job contain independent sub graph case duplicate computing multiple sink job blink planner multiple sink query optimize avoid duplicate computing query optimize insertinto sqlupdate instead query optimize execute issue aim support case issue introduce explain method tableenvironment execute method introduce jira browse code java explain multiple sink plan string extend code sure behavior flink planner islazyoptmode file add environmentsettings tell table environment optimize query immediately method flink false execute method blink true	['pull-request-available']	3	2	Closed	25	['add', 'remove', 'support', 'need', 'introduce', 'case', 'blink', 'query', 'job', 'planner']
13505880	FLINK	allow filestorescan read incremental change overwrite snapshot table store	currently abstractfilestorescan read incremental change append snapshot overwrite snapshot user append new record table change discover compact job source overwritten partition compact	['pull-request-available']	3	7	Closed	29	['need', 'new', 'string', 'datum', 'return', 'way', 'use', 'read', 'batch', 'order']
13232568	FLINK	fix broken link documentation cron travis job work	cron travis job fail documentation link check follow broken link code java error dev stream find error table find error release note find error release note find error release note find error release note find error fig find error dev find error fig find error fig find error fig find error fig find error fig find error fig find error fig find error fig find error fig find error fig find error dev find error dev find error apis streaming find error apis streaming find error apis streaming find error dev table find error fig find error fig find code	['pull-request-available']	3	1	Closed	13	['error', 'null', 'find', 'order', 'java', 'default', 'runtime', 'table', 'info', 'exception']
