id	project_name	processed_title	processed_description	processed_labels	priority_id	type_id	status_name	topic_id	top_terms
13481792	HUDI	bootstrap table deltastreamer read spark	code java scala val hoodieexception file find read user provide path scala elide code	['pull-request-available']	1	1	Closed	3	['new', 'record', 'read', 'partition', 'commit', 'base', 'metadata', 'type', 'add', 'use']
13403349	HUDI	tune hoodierotablepathfilter cache aim reduce unnecessary list request	cache hoodietablefilesystemview basedir level hoodietablemetaclient	['pull-request-available']	1	3	Resolved	6	['test', 'metadata', 'partition', 'path', 'commit', 'cause', 'record', 'query', 'run', 'update']
13557253	HUDI	hoodiebasefilegrouprecordbuffer check option	option exception throw call happen reader enable test testbasefileandlogfileupdatematchesdeleteblock code java cause nosuchelementexception value present option code	['pull-request-available']	3	1	Closed	7	['commit', 'metadata', 'cause', 'issue', 'enable', 'query', 'test', 'update', 'set', 'read']
13328894	HUDI	umbrella metadata table file listing table metadata	umbrella ticket track overall implementation	['hudi-umbrellas', 'pull-request-available']	1	15	Closed	8	['metadata', 'path', 'commit', 'datum', 'run', 'add', 'base', 'create', 'enable', 'test']
13454521	HUDI	test flaky		['pull-request-available']	3	1	Closed	6	['test', 'metadata', 'partition', 'path', 'commit', 'cause', 'record', 'query', 'run', 'update']
13581212	HUDI	resolve conflict mixed hdf local path flink test	bump depdency mitigate vulnerability	['pull-request-available']	3	1	Open	6	['test', 'metadata', 'partition', 'path', 'commit', 'cause', 'record', 'query', 'run', 'update']
13480198	HUDI	find partition column query bootstrappe table spark	bootstrap table code java val srcpath testing partition parquet table date val basepath testing bootstrap hudi val bootstrapdf datasourcewriteoptions key partition srcpath overwrite code code java scala partition count group partition analysisexception resolve partition give input column line pos aggregate partition partition subqueryalias view relation elide code	['pull-request-available']	3	1	Closed	6	['test', 'metadata', 'partition', 'path', 'commit', 'cause', 'record', 'query', 'run', 'update']
13521845	HUDI	hive sync fail noclassdeffounderror	url jdbc hive hive path hive warehouse default value extractor slashencodeddaypartitionvalueextractor throw follow exception code java info main close connection metastore current connection exception thread main noclassdeffounderror com esotericsoftware kryo kryoserializable method method cause classnotfoundexception kryoserializable code work version	['pull-request-available']	1	1	Closed	10	['cause', 'time', 'read', 'type', 'update', 'commit', 'log', 'use', 'config', 'support']
13410662	HUDI	rollback partially fail commit new partition fail metadata table	commit rolledback commit new partition present table file pertain new partition rollback plan file end dangle clean commit file file file file file partial fail write trigger rollback generate rollback plan fetch partition tablefilesystemview hit metadata table enable return complete filter file match case miss rollback file add	['pull-request-available']	1	3	Resolved	3	['new', 'record', 'read', 'partition', 'commit', 'base', 'metadata', 'type', 'add', 'use']
13421844	HUDI	unify hive mor inputformat implementation parquet hfile	essentially hive different mor implementation differ file format actual base file write today case currently hive mor inputformat implementation inherit respective cow file format counterpart hoodieparquetinputformat hoodiehfileinputformat instead unify mor impls common base class separate file format specific impls extend parquet hfile override getrecordreader method	['pull-request-available']	1	4	Closed	1	['metadata', 'issue', 'case', 'partition', 'base', 'path', 'datum', 'read', 'use', 'create']
13562047	HUDI	mit fail attempt change partition	follow code java drop table exists table exists create table parquetpartitioned version timestamp birthdate create table int version int string birthdate timestamp string hudi partitioned tblproperties primarykey type cow insert version timestamp birthdate date select set true merge select match update set code exception code java fail upsert commit time hoodieupsertexception fail upsert commit time sparkexception job abort stage failure task stage fail time recent failure lost task stage tid jonathan mbp executor driver nullpointerexception driver stacktrace scala morecause nullpointerexception code	['pull-request-available']	1	1	Closed	4	['commit', 'run', 'update', 'time', 'need', 'base', 'cause', 'partition', 'issue', 'write']
13375691	HUDI	investigate hive sync work expect quickstart environment	hive sync fail user report slack example need investigate real issue	['sev:critical']	3	1	Open	4	['commit', 'run', 'update', 'time', 'need', 'base', 'cause', 'partition', 'issue', 'write']
13510670	HUDI	fix merge performance trap	merge currently rely sparksqltypedrecord abstraction field record lookup cache key avro schema incur bear non trivial overhead lead compute waste	['performance', 'pull-request-available']	1	1	Closed	12	['record', 'read', 'use', 'base', 'create', 'datum', 'query', 'time', 'set', 'currently']
13563263	HUDI	fallback key base merging position log header	turn merge record position position header log block reader fall key base merging	['pull-request-available']	1	4	Closed	0	['type', 'support', 'base', 'record', 'time', 'read', 'enable', 'new', 'use', 'log']
13518366	HUDI	set class loader parquet datum block	set hoodiehfiledatablock set hoodieparquetdatablock cause code java runtimeexception classnotfoundexception class inlinefilesystem find scala classnotfoundexception class inlinefilesystem find code	['pull-request-available']	1	1	Closed	13	['set', 'query', 'enable', 'config', 'read', 'write', 'add', 'test', 'path', 'run']
13545617	HUDI	add downgrade step detect new delete block	table version introduce new delete block format avro serde downgrade table need perform compaction handle delete block create new format addition record index field metadata table schema downgrade need delete metadata table avoid column drop error downgrade	['pull-request-available']	3	4	Open	3	['new', 'record', 'read', 'partition', 'commit', 'base', 'metadata', 'type', 'add', 'use']
13574309	HUDI	break schema evolution add schema evolution change port spark	large review need break small prs create add necessary schema evolution spark minor version compatibility port spark reader code	['pull-request-available']	3	7	Closed	5	['write', 'config', 'partition', 'support', 'add', 'path', 'need', 'use', 'record', 'metadata']
13468374	HUDI	sure hoodiestorageconfig specify writer	currently apache hudi matter user specify explicitly rely default value config value overridden potentially revert specify user way presently enforce config write schema contain decimaltype fit range instead behavior override default config value case decimaltype expect range config specify user overridden	['pull-request-available']	1	1	Closed	5	['write', 'config', 'partition', 'support', 'add', 'path', 'need', 'use', 'record', 'metadata']
13596390	HUDI	spark read enum avro log block	spark read enum string avro log block fail	['pull-request-available']	2	1	Closed	9	['partition', 'log', 'metadata', 'time', 'read', 'commit', 'path', 'datum', 'issue', 'new']
13437912	HUDI	ensure heart beat client health check rollback threadsafe multiple writer	multiple writer check partially fail commit rollback ensure thread safe overstepping happen wrt writer roll commit	['pull-request-available']	1	1	Closed	4	['commit', 'run', 'update', 'time', 'need', 'base', 'cause', 'partition', 'issue', 'write']
13519998	HUDI	support auto record key generation spark sql	add support auto record key generation spark dataframe jira aim add support spark sql change require point need handle case mode set strict insert fail essentially base patch want ensure spark sql write support auto generation record key	['release-0.14.0-blocker']	2	1	Closed	5	['write', 'config', 'partition', 'support', 'add', 'path', 'need', 'use', 'record', 'metadata']
13584881	HUDI	partition create correctly sql multiple partition specify order	multiple partition specify order compare order field create table command partitioning storage incorrect test script notice create table insert command city state partition clause state city code java drop table exists create table bigint string rider string driver string fare double city string state string hudi option primarykey precombinefield partitioned state insert values insert values insert values insert values code create partition follow note city state value swap screenshot query filter result code java spark sql select result time take second code test master recent regression	['pull-request-available', 'spark-sql']	3	1	Closed	6	['test', 'metadata', 'partition', 'path', 'commit', 'cause', 'record', 'query', 'run', 'update']
13515862	HUDI	improve performance savepoint mdt	metadata table enable savepoint operation slow large number partition root cause partition metadata table scan unnecessary	['pull-request-available']	1	4	Closed	6	['test', 'metadata', 'partition', 'path', 'commit', 'cause', 'record', 'query', 'run', 'update']
13489022	HUDI	fix flaky testcleaner test testinsertandcleanbycommit	see flakiness testinsertandcleanbycommit test testcleaner	['pull-request-available']	1	1	Closed	6	['test', 'metadata', 'partition', 'path', 'commit', 'cause', 'record', 'query', 'run', 'update']
13477964	HUDI	avoid illegal reflective access code	java certain kind reflective access long allow check jep strong encapsulation detail example code usage objectsizecalculator code throw inaccessibleobjectexception run high avoid illegal reflective access	['jdk', 'pull-request-available', 'reflection', 'writer']	2	3	Closed	4	['commit', 'run', 'update', 'time', 'need', 'base', 'cause', 'partition', 'issue', 'write']
13595156	HUDI	fix partition stat update async comapction	case compaction set istightbound true async compction possible deltacommit complete compaction compaction complete recompute stat base compaction metadata info commit happen compaction case stat file add deltacommit async compaction progress ignore	['pull-request-available']	1	3	Closed	1	['metadata', 'issue', 'case', 'partition', 'base', 'path', 'datum', 'read', 'use', 'create']
13592385	HUDI	fix partition stat compaction cluster	consider partition file slice compaction trigger file slice partition stat update file slice key partition path old partition stat record partition path account file slice old stat final read value merge version file slice account late version compaction clustering partition stat recompute old record partition invalidate add validation test	['pull-request-available']	1	1	Closed	6	['test', 'metadata', 'partition', 'path', 'commit', 'cause', 'record', 'query', 'run', 'update']
13535294	HUDI	fix lock identity inprocesslockprovider	extend inprocesslockprovider support multiple table process have memory static final map store mapping table base path read write reentrant lock writer use correspond lock base base path close lock provider close remove lock entry close call close write client lock remove subsequent concurrent writer different lock instance table cause locking mechanism table useless following example writer write table concurrently need acquire process lock writer lock unlock close writer try lock lock unlock close writer try lock lock unlock close writer release lock close lock provider lock instance remove map writer different lock instance compare writer	['pull-request-available']	1	1	Closed	5	['write', 'config', 'partition', 'support', 'add', 'path', 'need', 'use', 'record', 'metadata']
13515120	HUDI	add support write record level index mdt	add support write record level index partition mdt	['pull-request-available']	1	4	Closed	5	['write', 'config', 'partition', 'support', 'add', 'path', 'need', 'use', 'record', 'metadata']
13479179	HUDI	fix inflight clean action prevent clean service continue multiple clean allow	hudi deltastreamer async cleaning spark job fail middle cleaning leave clean instant inflight spark job retry time resume inflight clean action false multiple clean schedule disable bug code relevant logic basehoodiewriteclient code java public hoodiecleanmetadata cleaninstanttime boolean scheduleinline boolean skiplocking throw hoodieioexception return null final timer context timercontext hoodietimeline hoodiecleanmetadata metadata null hoodietable table hadoopconf start proceed multiple clean schedule enable pende clean scheduleinline tableservicetype clean metadata cleaninstanttime skiplocke timercontext null metadata null long durationms file earliest retained instant cleanerelapsedms durationms return metadata code	['pull-request-available']	1	1	Closed	8	['metadata', 'path', 'commit', 'datum', 'run', 'add', 'base', 'create', 'enable', 'test']
13392640	HUDI	reduce run time deltastreamer bulk insert row writer test	reduce run time deltastreamer bulk insert row writer test testhoodiemultitabledeltastreamer testhoodiedatasourceinternalbatchwrite testhoodiedeltastreamer testhoodiebulkinsertdatainternalwriter	['pull-request-available']	3	6	Resolved	2	['test', 'run', 'add', 'cause', 'support', 'use', 'time', 'base', 'commit', 'query']
13357740	HUDI	fix archival max log size potentially bug archival	gist issue udit take deep look happen archival code path hoodietimelinearchivelog need write log file commit record similar log file write mor table code notice couple issue default maximum log block size define apache hudi blob master hudi client hudi client common src main java org apache hudi config utilize class mor log block write case result real control block size end writing potentially overflow bytearrayoutputstream maximum size integer happen scenario integer overflow follow code path inside bytearrayoutputstream need use maximum block size concept addition bug code apache hudi blob master hudi client hudi client common src main java org apache hudi table flush record file batch size default clear list go accumulate record logically wrong duplication apart fact increase log file block size write reference	['core-flow-ds', 'sev:high', 'user-support-issues']	3	1	Open	9	['partition', 'log', 'metadata', 'time', 'read', 'commit', 'path', 'datum', 'issue', 'new']
13422027	HUDI	optimize record payload handling	gap need fill new record merge api extend merge api support merge operation insert update delete include customize getinsertvalue option old schema oldschema option new schema newschema typedproperties prop add merge mode allow differentiation dedup logic add new argument merge mode pre combine update merge api customized dedup merge log record instead operationmodeawareness simplify compatibility hoodierecord conversion hoodierecordcompatibilityinterface provide adaption representation type avro row etc guarantee type end end avro row spark rowdata flink avro log block need conversion avro row spark revisit hoodierecord design affect row writing hoodierecord merely wrap engine specific datum structure contain java object store record key location etc end end row writing use engine specific type internalrow instead hoodierecord append key location etc row field well leverage spark optimization dataframe internalrow bug fix hoodiesparkparquetreader append partition path value nice have critical path merge logic engine agnostic different engine need implement merge logic base engine specific datum structure spark internalrow flink rowdata etc different hoodierecordmerger implementation class provide getfield api hoodierecord allow engine agnostic merge logic implement mdt payload new merge api necessary use parquet base log file format mdt existing engine specific reader use hoodierecord implement new file group reader writer need fix exist reader old plan currently hudi biased assumption particular payload representation avro long term like steer away record payload completely opaque record payload representation engine specific avoid unnecessary serde loop engine specific avro engine specific binary proposal phase revisit record handling shirt week goal avoid tight coupling particular record representation read path currently avro enable revisit recordpayload api deprecate getinsertvalue combineandgetupdatevalue api replace new opaque api return avro payload rebase recordpayload hierarchy engine specific common engine specific base abstract common functionality spark flink java feature specific semantic implement engine introduce new api access key record partition convert record avro bwc revisit recordpayload handling writehandle api accept opaque recordpayload avro conversion opaque record merging necessary pass filewriter filewriters accept recordpayload interface engine specific handle internal record representation recordreader api provide opaque recordpayload avro conversion	['hudi-umbrellas', 'pull-request-available']	2	15	In Progress	3	['new', 'record', 'read', 'partition', 'commit', 'base', 'metadata', 'type', 'add', 'use']
13441639	HUDI	fix upgrade step wrt precombine field	relate detail bug explicitly set precombine field hudi fall back default value go read mor table project require column add precombine field original table basic read fail log file base file mor upgrade step need update precombine field user set precombine field remove user set field update	['pull-request-available']	1	1	Closed	13	['set', 'query', 'enable', 'config', 'read', 'write', 'add', 'test', 'path', 'run']
13436063	HUDI	add metric async indexer	add metric async metadata indexer time base file initialization time catch etc	['pull-request-available']	3	3	Closed	2	['test', 'run', 'add', 'cause', 'support', 'use', 'time', 'base', 'commit', 'query']
13407322	HUDI	ability clean dangle data file hudi cli	scenario commit archived data file clean cleaning frequency less tha archival	['sev:normal', 'user-support-issues']	2	3	Open	4	['commit', 'run', 'update', 'time', 'need', 'base', 'cause', 'partition', 'issue', 'write']
13554327	HUDI	hoodieavroparquetreader set config wrong prevent schema evolution non row writer	tryoverridedefaultconfig set wrong config object inside reader different config object set config like code java parquetreader reader new false false code set correct object believe	['pull-request-available']	2	1	Closed	13	['set', 'query', 'enable', 'config', 'read', 'write', 'add', 'test', 'path', 'run']
13552984	HUDI	fix integration test failure	code java error failure error find output expect number time expect error command hoodie hudi spark datasource hudi spark sync path url jdbc type table multi partition key expect succeed exit expect error command hoodie hudi spark datasource hudi spark sync path url jdbc type table multi partition key source path streaming source checkpointe path streaming ckpt expect succeed exit expect error command hoodie hudi spark datasource hudi spark sync path url jdbc type table expect succeed exit expect info error test run failure error skip code	['pull-request-available']	1	6	Closed	8	['metadata', 'path', 'commit', 'datum', 'run', 'add', 'base', 'create', 'enable', 'test']
13436292	HUDI	hudi raise exception provide	issue parse ddb config	['pull-request-available']	3	1	Closed	1	['metadata', 'issue', 'case', 'partition', 'base', 'path', 'datum', 'read', 'use', 'create']
13425062	HUDI	unable merge hoodiemetadatapayload illegalargumentexception combine	run integration test mvn test verify test fail retrieve list partition metadata table stacktrace code java cause hoodieexception error fetch partition path metadata table method method cause hoodiemetadataexception fail retrieve list partition metadata cause hoodieexception exception read log file cause illegalargumentexception combine method	['hudi-bug']	1	1	Closed	6	['test', 'metadata', 'partition', 'path', 'commit', 'cause', 'record', 'query', 'run', 'update']
13470042	HUDI	fix hoodiedroppartitionstool base refactore meta sync	cause master fail refactoring meta sync	['pull-request-available']	3	4	Closed	10	['cause', 'time', 'read', 'type', 'update', 'commit', 'log', 'use', 'config', 'support']
13438745	HUDI	datum skipping work correctly presence schema evolution	currently data skipping handle correctly case column stat align column file combination miss csi occur different scenario schema evolution csi config change	['pull-request-available']	1	1	Closed	1	['metadata', 'issue', 'case', 'partition', 'base', 'path', 'datum', 'read', 'use', 'create']
13593603	HUDI	fix mor query hive integration test	mor query integration test hive fail run	['pull-request-available']	1	1	Closed	2	['test', 'run', 'add', 'cause', 'support', 'use', 'time', 'base', 'commit', 'query']
13524702	HUDI	handle payload abstractdebeziumavropayload	hoodiemergehandle decide long need copy old record handle properly abstractdebeziumavropayload	['pull-request-available']	3	4	Closed	12	['record', 'read', 'use', 'base', 'create', 'datum', 'query', 'time', 'set', 'currently']
13579400	HUDI	defaulthoodierecordpayload projection compatible	defaulthoodierecordpayload list projection compatible relation reader end read column mor read	['pull-request-available']	1	1	Closed	12	['record', 'read', 'use', 'base', 'create', 'datum', 'query', 'time', 'set', 'currently']
13409695	HUDI	upgrade java toolset runtime	upgrade preferably current late lts plan migration compilation compile source code source target stay require sure migrate add dependency feature compatible migrate toolset happen later point stop provide assurance code able run runtime run code jvm compatibility issue run code compile dependency compatibility sure test suite run	['performance']	1	4	Closed	2	['test', 'run', 'add', 'cause', 'support', 'use', 'time', 'base', 'commit', 'query']
13593000	HUDI	fix bootstrap index type setting metaclient	hoodietablemetaclient payload class wrongly set instead bootstrap index class	['pull-request-available']	3	1	Closed	11	['type', 'record', 'support', 'set', 'create', 'write', 'issue', 'base', 'test', 'partition']
13567639	HUDI	add config custom write support parquet row writer	hoodieavrowritesupport allow custom write support avro writing feature exist spark row writer add new config add custom write support	['pull-request-available']	3	2	Closed	5	['write', 'config', 'partition', 'support', 'add', 'path', 'need', 'use', 'record', 'metadata']
13537187	HUDI	add bundle validation base release candidate	check code validation bundle release candidate release process easy	['pull-request-available']	2	4	Open	2	['test', 'run', 'add', 'cause', 'support', 'use', 'time', 'base', 'commit', 'query']
13507199	HUDI	npe collumn stat null value	apache hudi hudi common src main java org apache hudi metadata throw npe avro util process null value	['pull-request-available']	1	1	Closed	8	['metadata', 'path', 'commit', 'datum', 'run', 'add', 'base', 'create', 'enable', 'test']
13489158	HUDI	add support rollback residual clustering disable clustering	user enable clustering disabled reason chance pende clustering leave timeline clustering disabled lie affect metadata table compaction whcih turn affect data table archival need way fix	['pull-request-available']	1	1	Patch Available	5	['write', 'config', 'partition', 'support', 'add', 'path', 'need', 'use', 'record', 'metadata']
13579434	HUDI	bootstrap read try parse partition bootstrap base path	bootstrap get partition path value bootstrap base path read base file hudi table case use hudi path case partition parse simple	['pull-request-available']	3	1	Closed	1	['metadata', 'issue', 'case', 'partition', 'base', 'path', 'datum', 'read', 'use', 'create']
13514290	HUDI	rollback mdt effective	rare condition rollback mdt effective apparenlty set clean policy lazy rollbacks happen clean kick start new commit give mdt single writer table rollback block effective commit rollback prior rollback block scenario fail inline compaction code java datum table timeline mdt timeline code attempt mdt roll crash mid way word log block write mdt deem invalid happen log block lay attempt crash roll read log block abstractlogrecordreader ideally want ignore encounter rollback block check previous log block match commit rollback match assume duplicate rollback deem valid log block mdt serve data file valid base listing standpoint impact log block ignore consider valid fix	['pull-request-available']	1	1	Closed	9	['partition', 'log', 'metadata', 'time', 'read', 'commit', 'path', 'datum', 'issue', 'new']
13448884	HUDI	read metadata table spark throw nullpointerexception createhfilereader	environment emr oss spark hudi master storage load metadata table spark shell follow code throw nullpointerexception case metadata table base file hfile format happen follow combination spark hudi spark hudi code java code code java cause nullpointerexception code spark shell code java spark shell yarn mode client memory memory executor core kryoserializer hadoop hudi true log spark app hoodiesparksessionextension hoodiecatalog code	['pull-request-available']	1	1	Closed	1	['metadata', 'issue', 'case', 'partition', 'base', 'path', 'datum', 'read', 'use', 'create']
13539934	HUDI	automatically decide archival boundary base clean config	throw error archival aggressive hour base cleaning improve automatically decide archival boundary hour base cleaning	['pull-request-available']	3	4	Closed	0	['type', 'support', 'base', 'record', 'time', 'read', 'enable', 'new', 'use', 'log']
